rating,title,review,userName,date,isEdited,app_name,app_id,developerResponse
5,A MUST HAVE after 2020,"Like pretty much everyone else, I noticed my mental health had a deep decline in the fall and winter months. I already suffer from anxiety and I knew I needed to make some changes in my life, but I wasn’t sure where to start or what app might be best. I have had one other meditation app in the past and went to use it again, but I was frustrated with the pay wall so I kept searching, hoping I could find something that would also help me set intentions for what I want to get out of my practice. I was especially interested in something that would correspond between meditation and sleep, as I have been experiencing sleep problems in recent months which are completely new to me.

I am so thankful and happy to have come across Shine! The structure of the app is both easy to navigate for simple daily use, but also wonderful to explore deeper practices. I really enjoy having bios of all the speakers, as it makes me feel more connected to who I am taking time to meditate with.I literally just downloaded the app two and a half days ago, so I haven’t had as much time to explore all the features and benefits but I’m already cooked.

Speaking back to the paywall, I was even more excited to learn that this is a minority and female owned company, so I had zero hesitation in paying for premium. The cost is about the same for many other apps, so why not support the awesome women behind this fantastic app?!?!!",SillyR1015,2021-01-07 22:55:25,False,shine-calm-anxiety-stress,1293721589,
5,Best meditation app EVER,"I can’t get over how much I love Shine. I used to use headspace but I found the meditations repetitive and I didn’t feel like they did much more than tell me to breathe. Shine has so many different kids of meditations, one of my favorites being the daily rituals that go along with activities like drinking coffee, doing makeup, commuting, doing dishes, and even waiting. And the daily shine always feels tailored to me, like they know exactly what I need to hear that day. And I love the encouragement to reflect and jot down a few notes, which I like looking back on. I just love this app so much!!! 

(If a developer is reading this, I do have two minor requests. When I finish the meditation, the quiet music continues for a moment but then stops during the reflection. Is there a way for it to keep going while I type and reflect? Two — it always seems to miscount my streak, I think that might be a bug. Love you!)",andyesse57,2021-03-15 17:07:33,False,shine-calm-anxiety-stress,1293721589,
5,Love love love!,"I am a behavioral therapist and I recommend this app to all of my clients, and use it myself as often as I can. I love the meditations, I’m OBSESSED with the guided journaling, and the sleep music library has honestly been a game changer for my nighttime routine. My only suggestion for the creators is to get some content regarding frustration with one’s health and specifically loving oneself when it feels like your body or your mental health are working against you. I am disabled and could see myself making content like this for my clients because it’s difficult to find elsewhere, but I would love even more for it to be on this app so I can do them for myself (it’s more difficult to be kind to oneself than others in my experience). Overall the app is wonderful and absolutely worth the subscription fee even though I don’t use it every day. Please keep up the great work.",EdgarAlliePoe,2021-05-07 11:30:48,False,shine-calm-anxiety-stress,1293721589,
5,Best. App. Ever.,"I’ve tried many meditation apps and podcasts before, but I’ve never found something as unique as The Shine App.

The app is so intuitively created, and well written so that you truly have a self-care journey. Special mentions to the weekly intentions that they let you set, so that recommended content is shown to fit your chosen affirmation!

The Shine App also excels with it’s guided structure. Every morning they prompt you with an exceptional guided meditation, a reflection, written takeaways, recommended articles, and then 2 quick questions to note down your gratitude. It has introduced the perfect morning routine!

The meditations are extremely well edited, with high quality audio and soothing tones! I have to give a shout-out to Mel Chanté, her daily meditations are well written and amazingly delivered.

Lastly, I have to applaud the fact that the app is created by two women of color— this is well reflected in the content created. As the majority of the meditation speakers are of color! Not to mention, many meditations touch on racial healing and wellness. 

As a WOC who meditates, much of the podcasts I listen to are mostly led by white women, so it is nice to see my values and identity represented at Shine. 

Best. App. Ever.

Will continued to support as much as possible. Thank you to everyone who helped created this! ✨",scorpioofcolor,2021-01-26 17:27:14,False,shine-calm-anxiety-stress,1293721589,
1,SHINE,"I use to love Shine.... I used it every single day. You know, shine use to be a beautiful app that helped me so much with my anxiety and depression. I use to be able to listen to new voices and people helping me every day. I use to connect with them on social media. Tracking my mood. Listening to meditations and enjoying daily shines, sleep help, so much and I go into a slump for some months to come back to find out all I can do I pretty much check in. You have to pay to have access to more than 90% of the app now. Banking off people on a app that cost not only significanty less not even a year ago, but yeah didn't cost to track moods... Like come on. Most people can't even afford health care and you've turned Shine into one of ""THOSE"" apps. I guess I'll find an alternative to get back into shape and help me with my anxiety. Youper now offers the best help, along with ""insight timer"". Over 90k free meditations free. Smh. It's so unethical and sad what this app has changed into. So so much different. I never leave all reviews or have to delete apps I love but this will be it. :(",SammieBR93,2021-05-03 18:20:53,False,shine-calm-anxiety-stress,1293721589,"{'id': 22633474, 'body': 'Hi there, thanks for reaching out! I have shared this with the team. Hearing from members like you helps us create a better experience on Shine. We appreciate the feedback.', 'modified': '2021-05-05T13:11:33Z'}"
5,A Mind Saver,"This app has been a mind saver. Mental health has always been a struggle for me. I’ve had much trauma in my life, so have always read and been immersed in the practices of mindfulness and resilience. I needed something to go along with the therapy I was doing, and wasn’t finding anything that I could solely rely on. The Shine app served it all! As a POC it was refreshing to find a community here of POC’s sharing their wisdom. It’s so rare to see POC’s in this industry. Knowing that they were POC gave me an added layer of comfort and relatability which has definitely been a refreshingly different experience. I started the app on free service for a few weeks to really learn if it was for me. I’ve just subscribed to the paid today, absolutely no regrets and continue to look forward to the progress I can learn here. Thank you Shine App!",Minsi Li,2021-02-28 18:21:02,False,shine-calm-anxiety-stress,1293721589,
5,"Amazing, some room for improvement","I love the Shine app. I used to use Headspace but I’ve found this app to be more personal and helpful. Compared to Shine, headspace is sterile, un-interactive, and less diverse. The subscription is totally worth it. 
Room for improvement: the app doesn’t work well with Sign In With Apple so I had to switch to an email for a smoother experience. I’m my experience, the start-up screen flashes once or twice which isn't a big deal but makes the app feel a bit less polished. Lastly, I would love to have a dark mode. I use the app at night a lot and the white background is super bright. Overall, amazing app and I would recommend to anyone looking for mindfulness and less worries in their daily life. This app is a great addition to my ‘toolkit’.",Liamlicious14,2021-06-10 00:33:21,False,shine-calm-anxiety-stress,1293721589,
5,Meditation Encouraging Self Compassion and Love,"I've really been enjoying taking little breaks here and there with the meditative sessions curated to my weekly goals and just looking through the library for what I want to work on in that particular moment: calming my anxiety, staying motivated, or taking a moment to be grateful. 

I love that there's a range of shorter to longer sessions for any occasion or mood. An improvement I'd like is for the audio to keep playing even after my screen locks. Otherwise if I fall asleep to a relaxation session, my phone will just stay in the app all night until it dies which isn't great when I use my phone for an alarm.",Jess Dreams,2021-02-05 00:42:41,False,shine-calm-anxiety-stress,1293721589,
4,"Love the app, check-in is glitchy, though","I love this app and have been using it to maintain my commitment to meditation and mental health! Unfortunately, I find that usually at night, the check-in function gets glitchy and it’s impossible to move forward and complete it—at least, it appears incomplete. The next day, however, I discover that my attempts at entering information have gone through, to the tune of four or five times. So i’ll have 4 or 5 copies of the same “my gratitude” information, for example. Since I cannot erase them after the fact, I’m  stuck with all of it. Irritating. Either fix the bug and make users able to remove what they entered.",zenma25,2021-06-21 17:42:07,True,shine-calm-anxiety-stress,1293721589,"{'id': 22512047, 'body': 'Hi there, thanks for reaching out! We’d love to look a bit further into this issue. Please contact our customer service team at help@shinetext.com with the relevant details, and we can help you get this sorted out.', 'modified': '2021-04-28T13:14:26Z'}"
4,Shine Review,"Context: I only tried the free version, not the premium

This app uses psychological treatment for anxiety using mindfulness, the awareness of experience in the present, and acceptance and commitment therapy which uses mindfulness skills that helps to accept and deal with upsetting  thoughts or feelings, understanding values and using values to change said behavior. 
The app also gives an outlet to others to talk to which isn’t something that connects specifically to a psychological treatment but is a good way to relieve some stresses of anxiety. 
Overall, this app features many good options for someone with anxiety. Some features that I thought were great resources or options for someone who has anxiety are:

Journaling
Talking with others (that use the app)
Meditation
In the moment joys

I would give this app a 4.5 but I can’t give half stars (I’m not sure why). I think that the app could improve by adding an option to talk with a therapist or having a therapist look over group conversations (I couldn’t tell if something like this was happening or not so I was a bit concerned).",Shiloh T.,2021-03-24 13:32:58,False,shine-calm-anxiety-stress,1293721589,
5,Wonderful!,"This app is really great! It is easy to use, feels safe and welcoming. I love that it gives you options if there is a section you aren’t in the mindset to complete if you aren’t able to gather your thoughts in that moment. I also like that it gives you the option to listen to a meditation, read something, type something, or speak vocally- it is inclusive of all forms of communication! You also have the option of connecting with others and seeing what they want to share on their. It is uplifting, positive, and calming. I highly recommend Shine!",TulJaM,2021-03-03 20:41:03,False,shine-calm-anxiety-stress,1293721589,
3,Missing the lengthy text,"I’ve been a member of shine for so long I’m at 800 check ins. I love the content and it’s finally something I have that fits me and my morning routine.

But.

Since the format has changed, I feel scattered, I have to jump all around the app in order to get the meditation, article, and then finally the check in. The way it was—in text form—was so intuitive and had a wonderful flow. This is disjointed and it’s just really disappointing. Not only that, but since the change none of the things I have bookmarked have shown up in my favorites, so now I cannot access certain things. I know I am not the only one struggling with this but I just can’t get used to it.",Itsshxpxptspycbjkkjctsajnk,2021-02-03 12:48:23,False,shine-calm-anxiety-stress,1293721589,
5,My Favorite Place To Be,"This app has meant so much to me. Even my 4 year old daughter loves it & asks for it every night before bed. She calls it “the calm thing”. The soothing voices, the wonderful messages, the breathing. It’s all been so good. I know I’ll be sad when my year subscription runs out, but am so thankful for the time we’ve had so far. Especially during this exceptionally bizarre time in life, pandemic, presidencies, staying distant from our friends & family... it’s nice to have a “friend” who can give you some positive words of support & reassurance. Thank you ladies!",Buhnee3,2021-01-30 10:14:59,False,shine-calm-anxiety-stress,1293721589,
5,LOVE + Adjustments Needed,"I love this app. It is so well designed and the content is quality. If everyone used this app, they would be happier. There are a few things I wish this app had: a longer journaling section, as to reflect more in depth , an option to view previous days and journaling to reflect on your progress and previous lessons, a way to queue meditations or articles to read for later or for the next day. Having those things would improve my experience using this app!!",Catbozz,2021-03-16 05:18:27,False,shine-calm-anxiety-stress,1293721589,
5,Great for Beginners,"I would undoubtedly recommend this app to anyone. If you have stress or anxiety, a lack of confidence or self esteem, or just want to relax your mind, this app is for you. I would recommend trying their free meditations first to make sure you like it, but paying for all the mediations is well worth it. Their SHINE method for anxiety is amazing, and doing the daily shine every morning makes my days start off so much better. Plus I genuinely feel like they are a great company with good intent and give love and support to any marginalized group.",A Non-Bearded Vegan,2021-03-23 23:06:06,False,shine-calm-anxiety-stress,1293721589,
5,Just for me!,"It’s wild how much someone can feel seen all through a meditation app. I just started using meditation apps before I downloaded this one and now I’ve deleted the others. Having women of color from around the world being the voices for this is nothing short of amazing. On top of that the simple examples of struggles, the topics, they just relate so well to women of color. I didn’t realize their could be something like this and now I can’t go back. Thanks for making this!",Tashaheartsthisapp,2021-04-28 12:12:41,False,shine-calm-anxiety-stress,1293721589,
5,Love it!,"This app is aesthetically pleasing, clean, simple, beautiful... but there is so much on there. Affirmations, gratitude, guided meditation, and awesome notifications that allow me to check in with myself and my goals. And their free option provides all these things, and then subscribing just opens the door to more. Unlike other meditation apps, you can actually find a lot of benefits from the free version, making it super accessible and a great place to start! I love it and highly recommend it.",zhoukristen,2021-06-15 03:12:35,False,shine-calm-anxiety-stress,1293721589,
3,I did not find app very helpful,"I found a lot of the content was recycled. I receive emails from shine way too often. And, while I downgraded my subscription months ago, earlier this month it had been renewed anyway. Had I not reviewed my credit card statement I would not have noticed. I’m not sure if this is because they are somewhat disconnected from the subscriptions in the App Store. I submitted a case to Apple Card. Also, I find the app glitchy. To address this issue, I tried to click the support menu item at the bottom. It only took me to a blank screen.",jpyams,2021-06-26 14:20:13,False,shine-calm-anxiety-stress,1293721589,"{'id': 23632072, 'body': 'Hi there, thanks for reaching out! We’d love to look a bit further into this issue. Please contact our customer service team at help@shinetext.com with the relevant details, and we can help you get this sorted out.', 'modified': '2021-06-28T13:56:49Z'}"
5,Push notifications keep me going,"I wrote here over a year ago upset I was unable to receive the promised daily text.  I still don’t get a text (unsure anyone does now), but it doesn’t matter because the intuitive push notifications arrive every morning and every night.  They are a welcome inspiration to set the tone for each day and a thoughtful reflection to ponder every night.  I am genuinely grateful for Shine.",indiawenden,2021-02-25 03:11:31,True,shine-calm-anxiety-stress,1293721589,"{'id': 8222588, 'body': 'Hi there. Thanks so much for your review. If you haven\'t already, please reach out to help@shinetext.com with the headline ""App Review"" and we\'d be happy to help resolve this for you.', 'modified': '2019-04-15T15:14:36Z'}"
5,Meditation with me in mind,"Shine feels like I’m surrounded by a group of friends who stand in my corner cheering for my success and well-being. Shine was created with me, a Black woman, in mind and that alone feels powerful. I have a variety of meditation themes to walk me through different emotions. I really enjoy checking in regarding my mood and free-writing to expound on why that particular emotion is present. The daily shine kickstarts my day and sets me up for success.",K. Kirby,2021-01-05 15:24:17,False,shine-calm-anxiety-stress,1293721589,
5,Girl power 💜,"I love that this app has female voices! It has a beautiful and calming interface and the functions of this app are pretty cool. If you have the paid version you can complete check ins and based on what mood you report, they make recommendations on a meditation for how you are feeling. It tracks your progress and I think it will be so cool to go back and look at how I was feeling months ago. This app has been such a blessing!",Melissamoo54,2021-05-09 12:47:40,False,shine-calm-anxiety-stress,1293721589,
1,Pretty much useless if you can’t afford premium,"I don’t currently have the money for tons of subscriptions right now. I barely have enough for the ones I’m already paying. This looks to be a meditation app, and usually the content in those is pretty decent, if bare bones, for free. In this I can’t even access my past logs without paying! Am I signing up for a service or have I already signed my information over to your company? I don’t like the start of this, already. Only the content YOU put out should be under YOUR paywall. YOU lock the content I put in your meditation app, and it starts looking EXTREMELY shady...",small hobbit,2021-01-12 15:32:31,False,shine-calm-anxiety-stress,1293721589,
1,Too many better options to choose from,"Don't worry, besides needing your credit card to try it out right from the start, if you do pay you'll have the option to have meditations sponsored by GrubHub. You wanting me to pay for meditations sponsored by GrubHub is crazy.

Forcing politics in to every turn, they just want to add to the overwhelming situations. Trying to put enough guilt on someone to stay with this half-baked app despite so many shortfalls. 

So many great options exist, this needs to fade away and go where apps go after their time is up. Look in to Insight Timer, Headspace, or Calm for a real meditation app, this doesn't cut it.",SingleServPepper,2021-02-01 15:27:16,False,shine-calm-anxiety-stress,1293721589,
5,Recovery,"I suffered a mental breakdown last summer. It was so severe that I was off for 6 months under going talk therapy, sound and meditation therapy and now taking mild meds. I wanted to continue my new practice of meditation and journaling but I wanted a motivative nudge. I found this in Shine. I completely go through all of the daily words of encouragement and meditation and mental check ins. I appreciate the developers of the app.",Cafe Conversations,2021-04-10 15:31:39,False,shine-calm-anxiety-stress,1293721589,
1,Great content - app does not work well,"I have a new iPhone. 
While I love Shine, and purchased the premium subscription, the app user interface always frustrates me. The top back button on the top left keeps sending me back to the App Store instead of the previous page.  The app had multiple crashes and I had to reinstall so it would work. My premium subscription was not popping up. The bottom content menu looks jammed.
Seriously Shine?
This is a wonderful mind resource, just make the app experience better and it will be super awesome! For now, I am going back to Calm ... sorry.",ALVAM,2021-03-04 06:41:46,False,shine-calm-anxiety-stress,1293721589,"{'id': 21567690, 'body': 'Hi there, so sorry for this frustrating experience. We can look into this. Please contact our customer service team at help@shinetext.com with the relevant details, and we can help you get this sorted out. Thanks for your patience.', 'modified': '2021-03-10T14:19:05Z'}"
5,Great investment,"I am so glad I invested in this app. It was been transformative for me, helping to reshape my thoughts and give me a gentle reset anytime I need it. Absolutely love the Shine app! Plus, it is integrated with so much scientific psychological research. As a Licensed Clinical Psychologist, I approve and share many of the meditations with my clients during our sessions as well. Thank you for making this available for us!!",B-Monica,2021-03-11 04:35:30,False,shine-calm-anxiety-stress,1293721589,
4,Please fix!,"I love this app! I meditate every morning now and I don’t regret it. However, when I complete a Daily Shine session, the check mark doesn’t immediately appear below today’s date. Whenever I kill the app, it will tell me to sign in again. After I sign in, the check mark will appear. This has been happening to me for the past couple of days, so I hope you will fix this!",Yums3286,2021-01-28 13:49:00,False,shine-calm-anxiety-stress,1293721589,
5,Shine of the Day,"I deliberately I clicked on Shine to view what it “had to say”, I forgot I had this subscription.  Am pleased with the inspiration it gave me.  I am very displeased with my life thinking I have failed with no hope of it getting better.  Then Shine suggested I make  it better by deciding what I will do today, and then at the end of the day review what I have done.",qwxstr too,2021-01-18 14:35:38,False,shine-calm-anxiety-stress,1293721589,
5,Helping avoid a spiral,Been using your services for about 10 months.  Has helped just stay calm in a crazy year until the last couple weeks and had a sudden breakup that led me to a very dark place.  I’m not out of it but the app has helped so much with pulling me back towards the light.  Thank you so much!,snowjunkie,2021-04-28 03:47:42,False,shine-calm-anxiety-stress,1293721589,
2,It was better before 2020,"In 2020 they hiked the price up and the content became predictable and depressing. Not everybody was struggling mentally during 2020. I had an amazing year and wanted to continue to work on some areas around personal growth. Yet I felt like every daily shine and exercise became centered around COVID stress and there was no longer a good balance of subjects covered. If I could have gotten a refund for this last year, I would have. I used to recommend it a lot but stopped this last year.",liveoutloud2today,2021-05-14 15:28:05,False,shine-calm-anxiety-stress,1293721589,"{'id': 22854387, 'body': 'Hi there, thanks for reaching out! We’d love to look a bit further into this issue. Please contact our customer service team at help@shinetext.com with the relevant details, and we can help you get this sorted out.', 'modified': '2021-05-17T14:20:14Z'}"
5,Actually Shocked,"I have been trying to deepen my spirituality with meditation for months and struggling to make it click, but I just found this app and am immediately hooked. I cannot describe the comfort of hearing a woman’s voice who sounds like someone I might actually know and trust guiding me. 10/10 recommend.",popcornkittycat4,2021-01-19 19:39:27,False,shine-calm-anxiety-stress,1293721589,
5,The Shine App has changed it all.,Since being introduced to the shine app back in April 2020 I have listened to it every. Single. Day. It has helped me through so many hard moments and given me the support and  tools I need to navigate this messy 2020 and life. I cannot say enough nice things about it. Thank you Shine!,kellun06,2021-01-28 11:18:15,False,shine-calm-anxiety-stress,1293721589,
5,Empowering App!,I absolutely love the simplicity and profound nature of this app. As a mental health professional I always recommend this app to my clients because it just breeds mindfulness and centering. I look forward to the evening stories. I never realized how impactful it would be to be able to check in with myself every day.,AlexOkeke,2021-01-23 04:26:18,False,shine-calm-anxiety-stress,1293721589,
4,I love this app but it’s not working every other time I open it!,"When working I’d gift this to others it’s so fantastic. It’s really easy to use. Understands the user and what we’re experiencing right now. It’s on point! But it’s not working left and right! I have the most recent version, just praying for improvements soon!",jvt1908,2021-05-09 12:47:10,False,shine-calm-anxiety-stress,1293721589,
