rating,date,title,isEdited,review,userName,app_name,app_id,developerResponse
3,2020-07-24 14:28:38,Still no fix for toggling questions?,True,I complained before about being unable to toggle off the questions without being prompted to subscribe. Was told there’d be a fix in the next update. At least two updates and still no fix?,AllTheNicksWereTaken,stoic,1312926037,"{'id': 16666136, 'body': 'woops, my mistake. you should be able to turn off questions without a premium sub.\nmy apologies, we will fix that in the next update.\n\nm.\n\n—\n\nyeah, my apologies. i understood from your previous message that we have a bug when toggling the switch.\nbut the fact that you can see the premium wall there is not a bug. the basic options of the app are free, personalization is paid.\n\nm.', 'modified': '2020-07-16T08:21:20Z'}"
4,2020-04-14 15:02:26,"Excellent concept, needs capitalization",False,"First off, I love the concept, and I want to love the app. It gets so much right for me in content and approach, but the lack of rigorous editing (not the least of which is the maddening lack of conventional capitalization throughout) is too distracting.",Slothrop in Seattle,stoic,1312926037,
5,2020-03-28 13:41:00,love it!,False,"this app thought of absolutely everything i could have wanted it to and it’s the only journaling app i can keep up with. i love the thought put into the little things, like the clicking to measure seconds during the breathing exercises or the overall design and font coordination in the app. will definitely continue to be using this going into the future. thank you!",anne0173,stoic,1312926037,
5,2020-02-21 12:40:35,I NEVER write reviews,False,"☀️this has been one of the best parts of my day, I am so grateful to have found this app, thank you for opening new perspectives into my own life. This is a Must Download !☀️",Keighty6,stoic,1312926037,
5,2020-02-12 02:59:55,Very helpful app,False,"To anyone who is struggling with mental health, this app shows you another way of thinking. It’s super helpful and works beautifully even on the worst days.",hurricanehazel,stoic,1312926037,
3,2021-02-08 13:24:21,It was okay,False,"For a while I kept a consistent pattern using this and it helped center my thoughts . I would recommend giving it a chance. I format is black and white which I Like. However, sometimes I get annoyed with the questions they ask .",anywaysallfhenicknamesaretaken,stoic,1312926037,
5,2020-01-24 05:19:15,"Stellar app, stoicism just works in the chaos of today",False,This app is well-developed and smart. Intuitive and visually appealing. I have ADHD inattentive and find this a soothing straight path in guiding myself like a gentle nudge. It’s not forceful but suggestive. Let’s be better. Be sharp.,Megan in Milwaukee,stoic,1312926037,
5,2020-12-29 15:02:55,Please add a list feature!,False,I love this app very much but I also think it would be great if there was a list feature to make lists,hozhonizhoni,stoic,1312926037,
5,2020-09-25 02:43:20,Great stoic app,False,This app has improved over the past year. Keep it up. Love the daily questions that force you to reflect on your progress and shortcomings,scrape72,stoic,1312926037,
5,2020-07-26 13:37:00,Just a few days,False,I’ve been using this app for just a few days & it has made me stop in my tracks and REALLY THINK about what is important to me.,curtishafen,stoic,1312926037,
5,2020-05-16 21:03:55,Bug with the quotes section?,False,"Hi,

Today I am having issues with the app. The quotes section, one of my most used areas of the app, is blank. There are no quotes. Otherwise this is a great app.",ZaneFleming,stoic,1312926037,"{'id': 15409378, 'body': 'my apologies about that bug! it will be fixed in the next update.\n\nm.', 'modified': '2020-05-19T06:40:41Z'}"
5,2020-05-04 13:05:48,The best journal app,False,"Beautiful minimal/ economic design. Lots of variety in the way the app can be used, a little something for everyone. Frequently updated and improved.",ViroRose<3,stoic,1312926037,
5,2021-04-26 10:40:36,Breathing is really good,False,The breathing exercises used in this app is very good for relaxing yourself and calming down. This app also really helps with getting your emotions under control avoiding any mental turmoil.,goaty don,stoic,1312926037,
5,2021-04-09 20:01:36,The Best out there,False,I have tried meditation and guided journaling apps for years. Not one of them comes close to stoic. The free version has a ton of content. It is the best in an ocean of mediocre apps like it.,jacklhasa,stoic,1312926037,
5,2020-06-01 15:23:27,So glad I found this,False,It has only been a day or two but I’m really enjoying having this app to compile some thoughts and emotions in. Really like the structure.,Drewcifer1985,stoic,1312926037,
4,2020-08-01 20:09:08,It’s a great app,False,"I’ve enjoyed the Stoic app for the last 7 months. It is helpful with mindfulness and centering. This app introduced me to Seneca and his teachings. Now for the downside. I’m an Atheist. When the religious quotes appeared, I stopped using the app. Thanks for allowing me to experience a great app.",ManfromtheSip,stoic,1312926037,"{'id': 17026079, 'body': 'hey,\n\nany chance you have catholic quotes turned on in you tab -> personalize -> philosophies?\n\nm.', 'modified': '2020-08-02T12:33:31Z'}"
5,2020-03-19 04:01:57,Practical and Introspective,False,I love the aesthetic design of the app and the various options that they give for the morning/evening routines. The quotes are relatable and I love going over them whenever I need some motivation.,Aissetou11,stoic,1312926037,
5,2020-12-20 08:00:08,Greatest app,False,This app brings so much value to my life. Classical philosophy is more important now than ever. Please bring back the ability to write custom affirmations on the widget.,icantgetthenameiwant,stoic,1312926037,
5,2020-09-22 06:37:53,Stoically simple,False,"I just downloaded the app, explore it a bit, and it’s clearly a nice tool to keep learning  and practicing Stoicism. Well designed, easy to navigate and nice features. ✨",Aby Lili,stoic,1312926037,
5,2020-02-21 07:58:36,Cool app,False,"Love the app and how everything can be found in one location! Ever thought of incorporating a collaborative aspect where people can share notes, etc?",CK Sav,stoic,1312926037,
4,2020-06-01 20:33:06,The quotes part...,False,I love this app in general. The only thing that I am confused is about the quotes part. It seems to be endless and up to a point I become even more hectic than I was before since it never ends....,Cindy dumbledore,stoic,1312926037,
5,2020-06-26 15:41:06,Amazing,False,"This app is just amazing, its help me over come my anxiety and make me feel peace, i found this app at the right time and its really help me not feel what im supposed to not feel. Great app",fuzinsani,stoic,1312926037,
5,2020-11-15 15:28:00,Best daily meditation app,False,"I really like this app. I like the daily quotes, exercises and questions. I have other apps that are better for guided meditation, but this is the best daily checkin app. I really like it.",SaoriseD,stoic,1312926037,
5,2020-11-08 22:38:41,Really hits the spot,False,Recommended by a friend. I’ve only been using it for a day but I can already tell it’s designed to teach me to love myself. Worth it 100%,TKYA1993,stoic,1312926037,
5,2020-06-25 17:55:02,Wow,False,"Truly, this is one of the best mental health apps I’ve found. It really takes from classic Cognitive Behavioral techniques and zen practices and helps you cope with various anxieties throughout the day. I’m very very impressed.",Sawyer925,stoic,1312926037,
5,2020-04-13 04:13:29,Amazing App,False,"This app actually helped me so much. It was so vital in helping me establish a morning and evening routine of reflection & growth. Would recommend to anyone, DEFINITELY worth the premium purchase",radghostgirl,stoic,1312926037,
5,2020-03-28 16:29:46,This is the app,False,The updates have made this app awesome. If you’re a Tim Ferris fan or Ryan holiday fan get this app. Combines a lot of the practices in 1 place.   Ive been using it daily for 3 months just do it.,jangeles253,stoic,1312926037,
5,2021-01-07 06:45:41,worth a download,False,"i get easily caught up in my emotions and most of the time, i don’t know how to handle them. this app has helped calm me down and make sense of what i’m feeling throughout the day- helps keep me in check and in focus.

i opted for the free version and it’s worked very well for me. if you could afford the paid version, i’m sure this app will do you more wonders. 

keep up the good work.",imalittleteapotshortandstout,stoic,1312926037,
2,2021-06-14 01:03:33,No bueno with pencil,False,"Great app but unusable unless you type with it. 

Shocking that it is not designed to use with pencil considering the proven benefits of writing by hand, especially when journaling. 

App forces one to use pencil way up high on screen, and then constantly inserts words into different sentences anyway.

Please allow handwriting to be handwriting!  I don’t want or need text-to-type (and the app cannot do it properly in the first place).

I’ll be watching for app updates in this regard, really like app otherwise but is too buggy and a real pain for those using pencil.",the one buying,stoic,1312926037,
5,2020-12-11 20:19:45,Good App,False,"It’s a good app to have if you enjoy reflecting on quotes and such. The app has many features, such as a journal to write in if you don’t already have one.",SlothPawgThroatWarrior,stoic,1312926037,
2,2020-06-23 11:58:07,Very little value,False,"So far, I’m not impressed. The same questions are asked everyday and therefore using this app gets boring very quickly. I’ve also noticed multiple grammatical errors- they have to improve their editing process. Either way, I wish I had skipped on this app.",VPR1030,stoic,1312926037,
5,2020-12-05 23:24:03,What I’ve been looking for,False,"I’ve been searching for the right emotional tracker app for what feels like forever! I really love this one, and the widgets are wonderful",Araven3,stoic,1312926037,
5,2020-11-14 16:52:10,So Much Zen,False,This is the best app I’ve ever used in all my searching for an app to help me with my anxiety this one finally hits it on the head. Thank you and so much love to the creators. Gratitude.,EthericPeacee89,stoic,1312926037,
5,2020-03-21 21:38:07,Great for a beginner!,False,"It's a good touchstone for the day, especially those just starting out on their mindfulness journeys.  It's not necessarily time-intensive and it's a simple, straightforward app.  Aesthetically pleasing, too!",ira plastic,stoic,1312926037,
5,2020-01-15 18:32:05,Great daily check-in,False,"This is one of the only daily check-in/self-care apps that I use regularly. Love the format, length of daily entries and activities listed. Great free app",sierrraaadeeee,stoic,1312926037,
5,2020-05-25 16:38:19,I love it,False,I love how minimalistic it is and how many options and variety of questions there are! iI look forward to its next updates,melieacosta,stoic,1312926037,
4,2020-11-17 11:00:05,Enjoying features I’m looking for,False,Enjoying the 2x daily journaling and that approach.  Has been great motivation to get into/back into this product.  I like the start and end of day perspective.,Smarkovits,stoic,1312926037,
1,2020-07-16 16:13:43,It makes me feel more anxious rather than calming,False,There are multiple instances where the app tells me quotes that are aimed at the wrong moment’s. I’m trying to write a little journal about I was in an toxic relationship. The app then tells me to be grateful for what I have and that others don’t have that. I understand that but it isn’t good to belittle my pain and trauma.,anon1886,stoic,1312926037,
5,2020-01-27 03:46:28,Very good,False,I have been dealing with anxiety for about 7 years now and this seems to really help keep it under control,Anxiousmoose,stoic,1312926037,
5,2020-01-22 04:18:25,Highly Recommend,False,This app is awesome! If you are looking for something to boost your life in all directions I would use this app!,Halls360,stoic,1312926037,
2,2020-01-02 21:37:33,Needs editing,False,"There’s some interesting content here, but I just cannot feel good about paying $30 a year for a journaling app that isn’t well-written. Grammar and spelling errors abound, and it irks me. If the developers don’t care enough to correct the mistakes, I certainly don’t care enough to spend my money.",Maly46,stoic,1312926037,
5,2021-06-17 14:29:45,Simple and effective.,False,Try it out for a few months. It may change your thoughts and preconceived notions in life.,Ballofyarn123,stoic,1312926037,
5,2020-01-30 13:51:11,Simple,False,It’s a very beautiful app. Gets you right into a Stoic mind set from the moment you begin your morning practice. Glad I downloaded it.,Sleeping Forset,stoic,1312926037,
5,2020-01-29 21:08:10,Awesome App,False,This app helps me on the road to Stoicism and to place day to day issues in perspective. Very user friendly and easy app to work with on the road to understanding.,amadeus88,stoic,1312926037,
5,2020-12-31 23:30:27,Literally Use This Everyday,False,"SUCH a great app! Great design, great concept. This app helps me manage my emotions in a way I have never been able to do before.",lbjbtb,stoic,1312926037,
5,2021-01-29 13:09:20,Adaptive and responsive,False,I had an issue with content and was immediately responded to with direction to modify in the app. Love it. On my second year.,fxfiii,stoic,1312926037,
4,2021-04-08 23:53:15,Awesome idea but needs work,False,"I love the writing style and icons. The idea is amazing, but a few bugs here and there. For one thing, the walks begin and for almost all of it I have just silence. Aside from that, it’s a beautiful app with a lot of potential. I think things you read and fill in sections or write your thoughts would be cool as well.

10/5 for the idea and future abilities
4.95/5 for current work

Keep it up, please developers!",the dog forever,stoic,1312926037,
5,2020-05-11 16:39:11,Cool,False,It makes you think. Sometimes a little time to reflect is the best way to see what you missed throughout the motion.,Rankawolf,stoic,1312926037,
5,2020-03-03 17:18:19,Absolutely great!,False,I really enjoy this app. The widgets that come along with this app are super convenient. With its breathing tools and great wisdom to think on it’s a great way to start your day.,Marinefuz,stoic,1312926037,
5,2020-02-23 09:38:15,Love it,False,Amazing one can turn a philosophy practice app and a boring journal app to something so meaningful and fun to use. I rarely write review but these folks deserve my whole hearted recommendations.,Tang12543,stoic,1312926037,
5,2020-12-02 06:44:44,Amazing,False,"You have nothing to lose, and for the main features to be free, this app is mind blowingly outstanding.",Ag3900,stoic,1312926037,
5,2020-09-05 15:44:11,Amazing,False,This app helps a lot when you’re feeling stressed or just want to get away from the troubles of the world.,thatdepressed kid,stoic,1312926037,
5,2020-03-12 10:27:55,Stoicism in my life,False,I start each morning with my breathing and then a reading. I’m grateful that I found the stoic way of viewing life. I owe a lot to reading “The Obstacle is the Way “ (Ryan Holiday),Andres y Tres,stoic,1312926037,
5,2021-04-13 13:28:46,This is amazing,False,I’ve had this app for two years and I love it. Thank you so much I just wish I got it on my iCloud for free,smiling_teeth,stoic,1312926037,
5,2020-11-14 06:04:40,This is a nice little daily ritual,False,Helps put you on the path first thing in the morning and reflect on that path at night.,Gnrlpattonater,stoic,1312926037,
5,2020-03-15 05:45:56,Great Stoic App,False,The layout and features are great. Exercises at the end are helpful. I highly recommend it to anyone wanting to learn more about stoicism and self reflection.,Ray 1202,stoic,1312926037,
4,2020-11-01 14:41:41,Pretty great!,False,Only criticism I have is there are sometimes typos in the quotes like “the power or our will” instead of “the power of our will.” ⏳,leitmotif,stoic,1312926037,
5,2020-01-24 01:41:01,yay!,True,"i have been looking for an app like this. I just realized that the circles line up. :) the app is making me feel so much more grateful, and happier everyday.",FluffyCloudPillows,stoic,1312926037,"{'id': 13032952, 'body': 'these circles will align. like your mindfulness. just give them some time.\n\nm.', 'modified': '2020-01-21T07:46:46Z'}"
5,2021-02-02 05:04:39,The best application on the store,False,"If you are an Aspiring Stoic, or at least like philosophy, this is a must get. It is a masterpiece. It is just a shame that it does not have the fame it deserves.",Nmonda,stoic,1312926037,
5,2021-01-01 17:07:09,Great work man,False,"Incredible app, been into stoicism for years now, great to have a product like this to keep the practice top of mind.",sactownhalfer,stoic,1312926037,
5,2020-12-18 05:12:33,Reshape your mind aka change your mind,False,This app has all the tools to take control of your life.,Online-Seller,stoic,1312926037,
5,2020-10-27 17:39:33,Everything I’ve been looking for,False,I absolutely love everything about this app.,KRC0813,stoic,1312926037,
5,2020-01-31 13:42:57,Simple and pleasing,False,I suffer from various mental illness and this app definitely has helped keep me grounded. 5 stars for how well put together this app is,Anthonysmommy101212,stoic,1312926037,
4,2020-01-02 04:31:42,Good app,False,This has been a good app for me and I have enjoyed the guided journaling. I just wish the I could upload at least one picture a day. That would make this a great app.,funnymonkey1106,stoic,1312926037,
5,2021-03-09 01:43:53,Very helpful,False,I love it. I especially like using voice recognition to type and keep journals.,rachel 47292,stoic,1312926037,
5,2020-12-16 05:13:24,Truly amazing app,False,"Amazing. Nothing more can be said. Keep track of where you stand with yourself, journal, set goals, practice meditation fn breathing exercises. Great app",No0$e,stoic,1312926037,
5,2020-09-15 02:47:45,GREAT,False,love this app i can calm myself down in ways i didn’t know i could definitely recommend.,clacos01,stoic,1312926037,
5,2020-09-02 03:59:36,A few days of clarity,False,It’s a wonderful app and with great hopes that it will help me sort out my emotions with some solace and clarity beyond the self destructive idea of self.,iDaddyO,stoic,1312926037,
4,2020-06-28 10:19:46,Frustrated,True,I’m going to bump it up to four stars.  This app has good features and just a few bugs to make it more user friendly.,jswope773,stoic,1312926037,"{'id': 16254646, 'body': 'please ping me at m@lobodzinski.me and we will figure out what’s going on.\n\nmy apologies for not getting back to you earlier.\n\nbest,\nm.', 'modified': '2020-06-27T18:36:49Z'}"
5,2020-04-07 14:49:33,It is amazing!,False,I’ve used it for over a week now and I am amazed. It’s so helpful. I love meditating and this app provides relaxing sounds. LOVE IT! Totally recommend.,lemknade,stoic,1312926037,
4,2020-07-15 04:56:07,Please fix Counter!!,False,"It’s been nice
But it’s definitely been more than two days
And the days counter is just stuck on day 2.

Please fix!!",Mango Salad,stoic,1312926037,
5,2020-02-05 12:08:44,Interesting prompts,False,"The app is helpful.  
It is a fast reminder of what’s is important and it has plenty of resources in the free version.",Tecgefhubf,stoic,1312926037,
5,2020-01-28 04:07:03,Life changing so far,False,"This has really helped my mindset be less pessimistic, helped me begin meditation, and has gotten me to journal and sit with my thoughts.",Uchiha Illusio,stoic,1312926037,
5,2021-03-27 15:48:54,Definitely a keeper!,False,A good way to start working from within. Great app for healing and finding balance.,Johnny Dankk,stoic,1312926037,
5,2020-08-27 17:12:11,Perfect!,False,"This app is amazing. Even if you don’t consider yourself to be stoic, the tools and exercises are useful and beneficial to everyone. Great job team!",ohhjaye,stoic,1312926037,
4,2021-01-25 21:56:28,Crashing,False,It’s still crashing when going to add to goals or hide completed it’s just shuts off,okiuyitoti,stoic,1312926037,
5,2020-05-14 12:45:41,"Omit snake oil salesman Ryan Holiday quotes, otherwise great",False,"Amazing app, use it almost daily. Idk why the secular Joel Osteen, Ryan Holiday gets space in here though. He shouldn’t. It’d be cool to have an Existentialist expansion of quotes though!",Jordan Aguacate,stoic,1312926037,
5,2020-12-13 16:39:04,Life changing,False,I’ve been an avid reader of the stoic classics for a few years. I was blown away at how this app incorporates stoic principles into daily routines.,PhrankG,stoic,1312926037,
5,2020-11-05 18:55:02,Best app to ever exist,False,I love this app so freaking much. To whoever came up with this idea thank you thank you thank you a hundred times!!! ❤️,kejsih,stoic,1312926037,
5,2020-01-28 03:15:49,Good Stuff,False,"The app really helps with anxiety and depression. Self reflection, coupled with meditation is allowing me to make progress on a daily basis as I work towards my goals.",DMW1212120,stoic,1312926037,
5,2020-01-26 13:05:21,Thanks,False,Because it automatically comes up is great. Breath just a little bit....,q1q2q2q2,stoic,1312926037,
5,2020-09-09 21:39:44,Great App!,False,This app has been so helpful and it continues to get better and better. Thank you,STLStoic,stoic,1312926037,
5,2020-07-15 05:05:17,"Wow, what an app!",False,It has helpful exercises to promote well being. There is so many tools packed into this app. Try it out!,Kalioat,stoic,1312926037,
5,2020-03-09 02:09:03,Great app,False,"I like the journal prompts, gets you to thinking. Great way to start off your morning^^ the evening prompts help to wind down the day.",Musicalprincess26,stoic,1312926037,
5,2020-02-09 06:36:51,10/10,False,Easy to follow instructions. Easy to use interface. Great content! :0D (looking up the publisher Maciej Lobodzinski was a good choice),Yonkers._.,stoic,1312926037,
5,2021-05-21 12:35:57,Student of Stoicism,False,"I use this app every day,combined with studying Stoicism and applying the principles into my life has proven to help me develop my routine and contributed to increased serenity and peace of mind. Milan",milansrq,stoic,1312926037,
5,2021-01-20 20:34:57,It helps,False,It’s has helped me though a lot I very much recommend,addisynfairh,stoic,1312926037,
3,2020-05-12 15:15:53,amazing! there’s one thing...,False,"this app is awesome, it helps me calm down and the fact that there’s multiple categories of journals you can write is great!

the layout of the app keeps getting better and it’s aesthetically pleasing to the eye in my opinion.

i did have to reinstall the app though, because it got stuck on the part where you open up the app and you pick how you feel. i don’t mind too much though, just a quick reinstall, no biggie!

edit: for some reason the app messed up again, and i didn’t know that i would’ve lost all my progress because of reinstalling it. i’m not gonna pay for the membership because something like this is happening either. this is kind of frustrating.",Doodledoobie,stoic,1312926037,
5,2021-04-25 22:46:57,Mac review :),False,I've been using the ios app for the past year and now that it is on mac I am absolutely LOVING it!,Dandalion.pdf,stoic,1312926037,
5,2020-06-02 01:55:24,Beautiful app,False,Has made me aware of things in my life I highly recommend,gperegrine1110,stoic,1312926037,
1,2020-06-04 17:19:13,Still in beta?,False,"The app doesn’t do text wrapping in a way that works with my phone or tablet, and has a substantial number of typos and glitches.  I’m hesitant to sign up for the subscription because it looks like the app isn’t finished even though it’s been around for a year.","TPB, Esq.",stoic,1312926037,
5,2020-01-24 19:39:59,Amazing,False,"The best way to calm down from heartbreak and or tough times. It even helps you with meditation, fear, and much more.",P0kemanz,stoic,1312926037,
5,2021-01-04 04:01:02,Immediately useful,False,Started using right away - useful & applicable.,Kathemajors,stoic,1312926037,
5,2020-09-02 14:07:58,Peaceful,False,This app is one of a kind. I love how peaceful and simple the layout is. It helps you stay calm and mindful about you day.,ILoveDogs482,stoic,1312926037,
5,2020-07-14 17:13:07,Pretty good,False,It’s a good app would recommend to have more options for color themes.,Florgen Horgan,stoic,1312926037,
5,2020-02-27 08:45:34,Great app.,False,Try to use it every day. It’s a great app to start off a new day and reflect on the end of a day. Thank you!,hand tools,stoic,1312926037,
5,2021-01-27 06:08:29,"You need this app, seriously",False,"This thing holds me ACCOUNTABLE! I can visually track the progress of my work, exercise, and mental health. Plus it’s free.",haleywhy_,stoic,1312926037,
2,2021-04-16 02:09:49,Very buggy,False,Some buttons don't seem to work. Try to slide menu items and they don't respond press some-and very furs nothing happens very frustrating interface,JDHgames,stoic,1312926037,
5,2020-07-31 18:47:42,This helped me so much,False,"I'm gonna be honest I really love this app. It truly helps me notice my feelings, set goals, etc.",kai tregre,stoic,1312926037,
5,2020-04-23 14:03:03,Unique,False,Nice little program to manage thought.,cycloperator,stoic,1312926037,
5,2020-01-30 10:55:20,I love it!,False,It’s the best app to keep track of your life. This is the app one been looking for my whole life.,Adrylucev,stoic,1312926037,
5,2020-12-12 02:37:37,I love this app..,False,This app is a great way to express myself when I feel I’m not being heard.,Dee🎀👑,stoic,1312926037,
