rating,date,title,isEdited,review,userName,app_name,app_id,developerResponse
5,2021-01-22 12:55:53,Making a difference in my life,False,"I’ve stuck with it for 29 straight days, journaling morning and evenings, writing about my focus, where I’m putting my time, stating what I’m grateful for. Since I’ve started this I’ve noticed I’ve put some distance between events, my emotions, and reactions to those events.",Leemom4,stoic,1312926037,
5,2020-09-21 00:24:09,Love It,False,"This is a wonderful app, but I’ll get to the point. I wish there was a way to have accounts without paying for premium. I use multiple devices, and it’s extremely annoying when none of my journals or progress are stored in the same place.",annabeth_granger02,stoic,1312926037,
5,2020-03-06 18:08:02,Exactly what I needed,False,"I needed a map, a compass, a trekking pole and a mentor/friend to get my life in track. This app is all that and more. If you are looking for a life changing app to help you live your life better than ever before, to reap the benefits of a healthy mindset than this is the app I would unequivocally recommend!",Siebear13,stoic,1312926037,
3,2020-06-08 11:37:13,It’s ok,False,"I use it more as a journal to answer question, don’t really do the breathing stuff or meditation... i like the quotes, the answering questions and maybe introduce new activity’s to take your brain off of things.. like a simple puzzle or more complex puzzle with some kind of meaning behind it... idk. I enjoy the app. It’s been a good thing to open up a few times a day to just type out your thoughts and get inspired a bit",srumeater,stoic,1312926037,
5,2020-01-02 00:40:17,Wonderful,False,"I cannot express how great this app is. It opened up the world of stoicism for me and has given me a better perspective about my life. Better yet, it blends these two aspects wonderfully! I also highly appreciate how the core features of the app are not pay walled, since that is so common place right now.",Benny potato,stoic,1312926037,
5,2020-11-24 01:13:00,Best Self-Journey App To Date!,False,"I don’t have much to say but the app itself is solemnly doing what it is meant to do, I have been using this app for twelve days so far and I loved the experience. I enjoy the ad-free the best regardless of whether you bought the premium or not! It’s helped me get out of stressful situations through calm tactics.",Xirinz,stoic,1312926037,
5,2020-08-04 16:56:15,Awesome!,False,"I recently started journaling but was struggling in exactly what to journal about, this app has really helped me with purposeful and thoughtful prompts each day. I love the different breathing exercises & even did my first meditation last night! 

I would love to see a desktop version of the app in the future so that I can make entries if I’m at work or not near my phone - sometimes I also just want to type on a real keyboard lol

I’ve shared the app with a few of my friends and some would love to look into it but sadly they’re androids users so at the moment they can’t.

Thanks for making this app!!",Maddym0,stoic,1312926037,
5,2020-03-07 01:10:10,Healthy for the Mind,False,I have begun using this app to better record my daily habits and events and began to feel better about taking five minutes for myself. It helps by aiding in answering questions about yourself and preparing for different difficulties. Definitely an underrated app.,TheTerenity,stoic,1312926037,
5,2021-02-17 18:46:48,THIS APP SHOULD BE 5⭐️,False,"This app really helped me and my mental health, I didn’t believe at first in mental health. But the app made me questions that I thought I had the answers to, and now I LOVE doing my morning routine and night routine. Writing my thoughts down and giving myself time. I recommended to my friends and they downloaded it so I’m happy.",Njcc2003,stoic,1312926037,
5,2020-02-17 13:55:18,Secular But Not into Meditation,False,"I'm someone who is not religious but I've never quite caught on to meditation in the Buddhist tradition. I have Sam's Waking Up app and I use it periodically, but the practice of meditation and of ""no self"" never quite spoke to me personally. Stoicism does. I enjoy the writing routines and the wisdom of the ancient Stoics. I intend to continue this into the future.",ScoopanPete,stoic,1312926037,
3,2020-05-21 22:02:31,Handwritten options,False,"This app has so much potential but one of the things that has drawn me to journaling is the handwritten aspect, and the organic thoughts that come with that. I think this would be perfect if there was Apple Pencil compatibility for iPads just because you wouldn’t feel just like you’re on another social media app. Please try and implement that in future updates and I’ll definitely be back!",~golden~,stoic,1312926037,
5,2020-02-07 05:31:29,"Simply put, well done",False,Thank you for making something like this available to everyone. I am only a few days in but the more I am doing it and exploring I am enjoying it more and more. I thank you for this gift and look forward to what you might add next etc.,Coachrat92683,stoic,1312926037,
5,2021-05-18 23:43:04,BEST APP!,False,"I am very picky about apps that pertain to my mental health but I’ve been on this app for only 2 weeks and I have never skipped one day. The breathing exercises are genius and they even offer a certain sound to guide you in the process. Beautifully aesthetic app with so much potential. Thank you guys, I needed this!",dendreis8,stoic,1312926037,
5,2021-02-19 03:41:07,really nice,False,The breathing/ meditations are really calming and surprisingly helpful... I used to not really believe in this sort of thing but it’s really nice. There are little mood checks and journaling which is good and being consistent has actually mad things better for me by a lot. I am very pleased with this app.,Japa speed,stoic,1312926037,
5,2020-12-24 03:56:39,Hey Please read this :),False,"I haven't been using this for long but I logged on to do my evening mood and I can't find it or know how to get to it. I did the morning mood today but now the evening one won't show up, but I've also never done the evening mood. Please help, I want to do it before I go to sleep :)",myb_v13,stoic,1312926037,
5,2020-09-22 01:36:28,Perfect,False,"Amazing app for practicing stoics and non alike. Even if you only use a part of this app, you improve your perspective. It has an amazing flow, guiding you throughout the day to reflect on what’s truly important. The new widget is great, encouraging me to fill my rings with daily practice, journaling, and other balancing activities. Well done indeed.",Deeptech666,stoic,1312926037,
5,2020-12-01 07:01:28,Beautiful app,False,The design keeps me coming back for more. A joy to use and I get a lot out of the journal prompts. I also really enjoy the breathing and thoughts feature. It was a bit of a learning curve using the cognitive distortions tool and writing about it in a clear manner but I’m getting the hang of it.,ememky,stoic,1312926037,
5,2020-07-02 13:25:13,Highly Recommend For Daily Use,False,"The smoothly blended integration of a Daily Journal, Motivational Tool, and Meditation App serves so many purposes and keeps it fresh each day. This is a great beginners tool or expert tool as it lets you elaborate on your own reflections and responses in as much or as little depth as appropriate. Brilliant - worth the subscription.",Slotty McSlotface,stoic,1312926037,
5,2020-01-02 21:19:56,perfect.,False,"i never write reviews. this deserves one. 
everything is perfect, don’t change anything. 
i am able to vent and take time with myself at times I can foolishly spent it on stress-eating and more. i’m glad there’s also a journaling part so I don’t have to use another app. thank you. 

ivy.",IOOOVY,stoic,1312926037,
5,2020-08-27 19:07:05,"Exactly what I was looking for, but...",False,"I cant find any way to modify the font when journalling. I appreciate the app isn’t about word processing, but I can’t see the text when I’m typing. I wish I could make the font bigger and bolder.

Thanks for creating an otherwise magnificent tool.",RoroRennyR,stoic,1312926037,
5,2021-04-06 18:23:22,Amazing,False,"Enough said, unbelievable how much work was put in and for free.  Paradoxically, because of that, I see myself going for the membership just because of that.  Sales wise more developers should employ this model, let the product speak for itself",mannyAnderson,stoic,1312926037,"{'id': 22124730, 'body': '❤️', 'modified': '2021-04-08T12:17:09Z'}"
5,2020-01-28 15:20:52,Take a moment for yourself,False,"I find this app very helpful in starting my day in a positive way. It’s a healthy habit to start. I’m looking forward to more positive changes in myself.
After months of practice, it has made great changes in me. I’m much happier with myself. It’s a great way to start your day.",Jimenez52,stoic,1312926037,
5,2021-06-13 05:00:36,Overcoming,False,"Stoic is an amazing app. Throughout many of my own personal trials I’ve turned to the app for assistance. It’s helped me overcome these trials through better understanding of myself, finding the patience I need, and finding peace. Id recommend this app to anyone who’s struggling or trying to find peace.",Tyson.T,stoic,1312926037,
5,2020-07-17 05:41:16,WOW!!,False,Such a beautifully designed and aesthetically pleasing app to look at. I love trying to work on myself and improve myself and this app is a great way to give me things to work on and think about. I love the quotes and I use them to reflect on when I use my physical journal. I recommend,nikksturr22,stoic,1312926037,
5,2020-04-29 05:54:33,Very helpful,False,I never liked journaling until I tried this app it actually helps I’ve tried many journal apps and they never did anything the difference is that there are questions and quotes which make it very easy I recommend.,Mia..Crn,stoic,1312926037,
2,2020-07-14 12:10:58,"I love the concept, but the grammar is killing me.",False,"The concept of this app is perfect and I wouldn’t change anything about it. However, this morning I came across some writing prompts that were written in very broken English. I would suggest having someone proofread them. Trying to overcome the grammar issues is impacting my ability to think critically about what I am writing about. Please fix this! You have a great app going for you otherwise!",StealthDrone,stoic,1312926037,"{'id': 16666152, 'body': 'goooood timing, we are fixing copy right now :)', 'modified': '2020-07-16T08:22:05Z'}"
5,2021-05-30 20:20:20,Clean interface and easy to use,False,"I am loving this app. Especially after getting a IPad Keyboard. It is easier to Type, but now they have option to scribble in which is great! Compared to other apps, I find this much “Cleaner” and easy to use!",AJKhan21,stoic,1312926037,
5,2020-05-28 16:24:17,Brilliant,False,"Truly a wonderful app.  There’s lots of stuff out there which describes the stoic philosophy, but when you look for practical guidance on implementing the concepts, you don’t find much.  This app does it in a very easy to follow way.  Frankly it’s way underpriced for something that can truly impact your life.",Broohaha,stoic,1312926037,
5,2021-06-03 02:35:04,Amazing,False,I've only been using Stoic for a few weeks and it's amazing. I love how simplistic it is and minimal it is. It also has exercises which I also love. The prompts are great. I 100% recommend this app to people who need help sorting their life out and focusing on self-care.,cosi_kitti,stoic,1312926037,
5,2020-10-12 23:46:59,One of my favorite apps ever,False,"Honestly I never write reviews but I had to because I love it so much, they never promote ads or the paid version unlike most free apps which I love. The layout, everything is perfect. I use this app on my iPad everyday to improve my mental health. 10/10",sashabby091,stoic,1312926037,
2,2021-02-23 16:21:09,App is great besides meditation,False,"I find it really difficult and not feel frustrated when meditating with this app. It literally only has a motion graphic and thats it. Nothing that is helping to guide besides some white noise you can choose.

I often use this app and after meditating feel more frustrating because just by looking at a moving motion it drives me crazy and feel worse than before I opened the app.",Rita.Hung,stoic,1312926037,
1,2020-11-14 15:27:32,"Good concept, execution is annoying af",False,"I like the idea, but it's entirely app driven. I see no way to decide for myself what to work on. Sure, I can select what to focus on for today, but come on. Give me the list of things to do and let me select which make sense for me. Or for the exercises it's chosen for me, let me customize. For example, the breathing. Let me select the amount of time for each, in-hold-out. 

Deleted after two days. Tried to use it several times, and each time I was like eff this.",The Notorious t.i.g,stoic,1312926037,
2,2020-01-20 09:19:25,"Writing errors, bugs",False,"It took a while to get past the second screen when starting up the app, and couldn’t scroll to see the bottom of the screen.  I understand there could be many reasons for the writing errors, but it really needs to be edited by someone with a good grasp of written English.  I also get the minimalist appeal of not capitalizing the first word in each sentence, but I personally find it very irritating.",Kayte8648,stoic,1312926037,
5,2021-04-28 16:12:11,So far very helpful,False,"Much more helpful that I thought it would be

Breathing exercises have a subtle pulse. I think it would be helpful to exaggerate the pulse at the change point. Also have the time duration selection before scrolling. 

Reflection prompts are good. Some of the messaging is a bit mixed. For example a Stoic quote about being wise when you want for nothing / content with what you have, followed by goal setting. But I can see past it 

Overall - I downloaded several different apps and this is the one I’m using. 

Thank you",georgiehart88,stoic,1312926037,
5,2021-01-05 21:56:10,Great response time for Apple ID issue,False,App was asking me to sign into Apple ID every time logged in. I sent an email and immediately received a trouble shoot fix. Turned out i needed to download the newest version and everything runs smooth now.,Lmjb3000,stoic,1312926037,
5,2020-09-09 21:31:31,Great,False,I love this application and how far it has grown. It is a minimalist approach to wellness and journaling. It offers so much for free. I haven't tried the premium version but their free to use application provides resources other applications would premium you to death. 10/10 recommend.,Realbreakdown,stoic,1312926037,
5,2020-01-29 19:04:27,Very helpful,False,"I’ve embraced Stoicism as a practical system for maintaining contentment, and this app helps me do this effectively. 

Synchronicity is at play. I was not looking for this sort of thing, and I’d just started a new medication which, after two weeks of annoying side effects, has dramatically improved my chronic conditions, when I happened across this app.

I’d been considering going back to a sitting Zen group for a while, but this is working so well for me that I may put it off while my schedule is so hectic.

Thanks for the app.",Reverend Zim,stoic,1312926037,
5,2020-01-24 01:18:03,Simplified my routine,False,This app has helped me simplify my phone screen and get rid of several apps by aiding me in performing and tracking two keystone habits that I want to develop: meditation and journaling on a regular basis. I can’t wait to see where this beautifully designed app takes me!,Gingernaute,stoic,1312926037,
5,2020-09-08 20:38:35,"I was skeptical, don’t be like me.",False,"I do not write reviews. I had to with this app. 

I was tired of feeling anxious and stressed everyday. I often considered therapy for myself. Not a thing wrong with that. However, I’ve noticed in just the short amount of time I have had this app, I feel much more relaxed, more eager to do what I need to and with a much better attitude. Between work, school, a rescheduled wedding and the possibility of moving, I needed help. I have found it with the help of stoic. I’m extremely grateful for this app. For me, it is a keeper.

Sincerely, 

Relaxed and in control",quatera,stoic,1312926037,
5,2020-04-12 09:07:35,Great App,False,"Really great app. Have been enjoying it a while now and it is constantly updated, lots of functionality, very robust and useful not just for meditations but also for philosophy. Would definitely recommend it for anyone who wants to be more mindful.",Freeman85,stoic,1312926037,
3,2020-02-05 02:26:09,Great app but...,False,"I think the journal section could use some more categories. I feel like I’m being repetitious in some of the things I am writing about because the categories are all the same. 

That being sad I really like the habit of mindfulness and reflection this app has gotten me into. I definitely would recommend it - I just hope more options come soon!",Lynds07,stoic,1312926037,
5,2021-05-08 22:42:32,Good Aid in the Catholic Spiritual Life,False,"As a Traditional Catholic, I love this app, for it really has helped spend time wisely and act more Stoically so that I may advance in the spiritual life, even if it’s just by a little bit. I strongly recommend this app, especially its journalling and routine features, for Catholics. Thank you.",Kilnor1,stoic,1312926037,
5,2021-03-23 13:18:05,An important part of my day,False,"The app is easy to navigate, easy to find what I need when I need it. It’s been a life saver. It was quickly integrated into my day, morning and night. I’m grateful to have found this app. Finally finding some peace",iPod+me= <3 ,stoic,1312926037,
5,2020-08-20 20:53:07,The one thing that really works,False,I have try thousands of mental health apps and they all were just “feel better” and drink more water”. But this stoic knows what they are doing and know what works. I have been feel so much better every day.,Husk_Husky,stoic,1312926037,
5,2020-06-02 08:47:53,Helpful,False,"I’ve been super lazy for a while now, it’s only been 2 days, but these 2 days have been the most profound and productive days I’ve had in years. I hope to keep logging in and working on myself during this quarantine.",LordRezkin,stoic,1312926037,
5,2020-05-18 02:12:10,"everything ive been looking for, but better",False,"from the simplistic style and aesthetic, to all the free features, to how great i felt after my FIRST exercise. i would recommend stoic to anyone who is serious about bettering their mental health and outlook on life. just a full 10/10 :).",nincherio,stoic,1312926037,
4,2021-02-28 14:40:47,Pretty good,False,"Great app to get the brain going and reflect.  Really like it.  To the developers and/or writers, there are some grammatical errors here and there that mess up the flow...more than a few.  I recommend having someone (pay a professional editor - it’s worth it) go through and proofread the whole thing.",VA2994,stoic,1312926037,
5,2021-05-29 14:46:13,Worthwhile,False,I’ve been using Daily Stoic for over a year now. I love it. The ap keeps me focused on my growth and the things that are truly important to me. The only improvement I’d like to see is less repetition in the daily thought and writing activity.,Setrovitch,stoic,1312926037,
4,2020-02-04 01:48:17,Finally an app that makes mindfulness a reality for me,False,It’s really working for me to have the morning and evening prompts to pause and plan/reflect on my day. I love the “hand holding” approach of this app (making it easy to keep up with) and the flexibility for me to choose routines that suit where I am and what I can manage each day.,TJTH5683,stoic,1312926037,
5,2020-10-18 15:04:53,Best mental improvement app,False,"I never ever ever done reviews on any app but this app is amazing! If you looking for mental improvement this the app for you , you can meditate, journalist, learn different breathing, it has daily quotes, I mean it has everything you need to grow! 💯y'all snapped",Kviin Reyes,stoic,1312926037,
5,2020-02-04 04:16:54,My New Morning & Bedtime Routine,False,"This app is my go to when I wake up and right before I turn in for bed. It gives me a place to set my mind right. If you are looking for an app that helps with meditation, journaling, and breathing, you have found the right thing.",g.jake,stoic,1312926037,
5,2020-12-23 04:13:50,"If you feel stuck, you need this app",False,I can not express how much I love this app already and it’s only day two! I’ve felt stuck in a rut in every sense of my life for a while and this app is helping me feel better and be more productive for FREE!,VanillaRuffian,stoic,1312926037,
5,2020-07-18 01:40:46,Genius,False,To the person who created this...you’re a genius. Thank you so much! The Stoic app has made my day to day so much better. People around me who uses it loves it too. I highly recommend to anyone who is thinking about trying it out.,Tried it trice,stoic,1312926037,
5,2021-03-07 16:03:31,Amazing!!!!!!,False,"Static is the best app ever, if you don’t download it you are truly missing out, I can get all of the meditation, and relaxation exercises I want and I don’t have to pay. I don’t even know if there is a membership option. I love it so much, it is the best",𝕆𝕝𝕚𝕧𝕖 𝕀𝕣𝕖𝕟𝕖,stoic,1312926037,
5,2021-01-06 13:39:49,Excellent implementation,False,"Far better than I could have hoped. I’ve been reading and learning about stoicism for years, and this app makes the practice far more automatic, and covers far more of the practical side than I expected.",Hakib,stoic,1312926037,
5,2020-11-20 11:58:52,Incredibly helpful,False,"I don’t usually rate apps but im making the exception in this case, since this app is so useful to keep your thoughts where they should be. 

The exercises are many and each one of them is carefully designed. You can see that the team put a lot of thought behind them.

The user interface and experience are amazing, making the app easy to use.

I see myself using this app at least twice a day now, since i find it so helpful to stay focused and keeping a clear mind.",mat146,stoic,1312926037,
5,2020-10-12 13:58:50,So thought out,False,I only have the free version but I’m thinking of subscribing to premium because the app is so thought out an genuinely helps me stay proactive and keep a clear head (even the basic features are fantastic). !,StormeEla,stoic,1312926037,
5,2020-05-14 16:17:34,Lovely,False,"I appreciate the simplicity of this app. It’s an easily usable tool to begin, pause, and end my days. It makes me feel calm, it reminds me of the disposition I seek to hold, and it encourages me to keep moving forward. Thank you to the stoic. App team for this helpful tool. It’s helping. ❤️🕊",lidsobregon,stoic,1312926037,
4,2020-05-31 16:32:30,"Love the app, needs some copy editing",False,"I think the app is really promising but I find the grammatical errors to be distracting. The biggest one is during breathing exercises, the app says “breath in” rather than “breathe in”. Certain phrasing like “what good shall you do this day?” for journal prompts is also distracting; I’d prefer something more straightforward.",Kyle Richard,stoic,1312926037,
3,2020-05-19 16:40:05,good app but questionable solutions.,False,"i really enjoy this app. it takes you step by step through healthy ways of coping, thinking, etc. however; my one and only complaint is within the “visualization” exercise, the overall solution is “think about how much worse it could be :)”. this is extremely damaging. to tell people their situation could be worse invalidates their feelings and basically ruins the whole point of the app. i really hope the devs consider changing this. honestly, that one line alone has made me reconsider how useful this app really is. ://. please take this as a serious suggestion!",kenne 🦋.,stoic,1312926037,
5,2020-04-21 16:48:36,Like a personal Cognitive Behavioral Therapist,False,This helped me work through fears and cognitive distortions. I always craved homework in therapy bc I didn’t feel like talking was enough or that there were things I couldn’t say. This app really helped with perspective.,H K V M,stoic,1312926037,
5,2020-03-27 10:41:06,I never write reviews,False,"But for this app I must. It encourages me to do things that I know I should, but never made time for. I meditate daily, write gratitude journals daily, think about how I’m feeling and how fulfilled I feel daily. And I’m thriving because of it.",kristicheese,stoic,1312926037,
5,2020-02-07 15:57:11,Provides just enough framework for a daily mindfulness practice I can stick with,False,"The quotes, questions, tracking of meditation and small journaling exercises are unobtrusively giving my morning and night a little more conscious structure. Beautiful graphic design as well!",H-Kaye,stoic,1312926037,
5,2021-03-11 22:17:36,Review for the stoic app,False,"This is an amazing app in my opinion. I use it very frequently and it has helped me so much with my mental and spiritual health. The breathing exercises, quotes, reflections etc. are all amazing. I can’t wait to see this app progress in the future. 10/10!!",egggirlforlife,stoic,1312926037,
3,2021-04-17 12:31:51,Stop asking me how I feel,False,"When I open the app it always asks me how I feel and I can’t actually access or do anything until I answer with a frowny face. Why can’t I disable this? Stop throwing up roadblocks to me using the app every time I start it, it’s really irritating. 

Otherwise this is a great journaling app.",fruitypoundcake,stoic,1312926037,
