rating,date,title,isEdited,review,userName,app_name,app_id,developerResponse
5,2020-09-08 14:18:17,Best app ever❤️❤️❤️,False,"I love this app so much. It has helped when I feel stressed. I wake up every morning and look forward to doing my morning check in on the app. If you turn on notifications the app will give you a reminder to do your daily check in. Or you can do it when ever. There is not just one thing to do... there is different breathing tricks, meditation music, journaling, and you can give your day a title and how you felt. If your trying to find an app that will help with anxiety and stress... this is the app for you!❤️❤️❤️❤️❤️❤️",Xanderkattie,stoic,1312926037,
3,2021-01-28 00:33:31,Used to have more options,False,"When I first downloaded this app I loved it! It provided a variety of options to cope with my emotions on a day to day basis and I loved the different journal templates to start a journaling session and the way it would use stoicism & thinking trap meditations to help me through especially rough days. However, there must’ve been an update because I no longer have access to the wide range of journal prompts and the ones I do have layer on top of one another instead of allowing for a “at your own pace” kind of app. I’m not sure if I’m ready to abandon ship yet, but I definitely am not getting out of it what I used to.",Peacify,stoic,1312926037,"{'id': 20751864, 'body': 'hmm interesting. we have only moved guided journals to a different place (main today view -> journal).\n\nthis change will give us space to create even more guided experiences :) previous scroll inside journaling was kind of clunky.\n\nbest,\nm.', 'modified': '2021-01-30T22:22:34Z'}"
3,2020-06-18 04:04:37,Interesting concept but buggy,False,"I’ve been using the app for a couple of weeks and find it be somewhat helpful. The question/prompts do get repetitive, so I’m not sure how I will about it a few months from now.

But a few bugs really make the experience less than idea:
1. I can’t save the daily question options in settings. No matter how many times I try, the options revert to the original settings.
2. It erases entries. I just finished my evening entry - answered about 10 questions thoughtfully and then wrote a heartfelt evening essay. Suddenly the app jumped back to question 3 and all the other information after that was lost.",JPriestly,stoic,1312926037,
5,2020-08-17 23:33:55,Personal psychologist/therapist,False,"I can’t say how incredible I think this app is. From someone who has been through therapy his whole life, it really feels like a non-judgemental one-sided therapy talk. I just felt like writing this review to thank the developer.
Amusing how even when in deep lazyness and lack of time, there’s still some time and motivation to go back to the app and get everything out of your chest. 
Additionally, the different activities on the app are so complementary that you can literally spend 5 or 50 minutes on it.",Cyalv,stoic,1312926037,
5,2020-11-23 02:43:34,Great as an introduction to stoicism,False,"Great as an intro. I’d recommend reading the meditations by Marcus Aurelius. They seem to really like Seneca... while he’s good. There needs to be more variety with the quotes and maxims. Through in some Epictetus too! And even some modern day stoicis. What about some Ryan Holiday?? Come on guys. Push past what’s present and go above and beyond! lol that’s my only gripe. Very minimal, however, I do thoroughly enjoy this app. It has allowed me to destress, focus on my breathing, mediate, and practice mindfulness & gratitude. This is need. ESPECIALLY AFTER THIS CLUSTERF__K  DUMSTER FIRE YEAR we’ve had...",vibesgood,stoic,1312926037,
4,2021-05-18 03:27:09,Excellent Customer Service,True,"When an issue arose (and the issue was mine alone), the developer responded immediately and assisted me greatly. In the event other incorrectly associate this site with anything related to Ryan Holiday, as I did, they are not connected. 

One app bug I do wonder about is why the daily count randomly restarts at one. Also, thought it might be cool if there was a way to print the journals (perhaps even commercially or bound- all or as a selection). Perhaps you can and I’m just not great with tech. Anyway…. Thank you for the email and I am sorry for the incorrect association.",Mark50998926,stoic,1312926037,"{'id': 22856122, 'body': 'hej Mark,\n\nwe are not associated with mr. Holiday in any way (besides the fact that i personally admire his work)\n\nbest,\nmaciej\n\n', 'modified': '2021-05-17T15:50:36Z'}"
5,2020-05-21 12:11:41,Just incredible - less really is more,False,"I’ve never had my breath taken away by any productivity or journaling app that stoic; this app delivers incredible power in its insight, brevity, and comprehensiveness. I’ve never been able to stick to a particular morning and evening routine, but stoic wraps up everything I hope to achieve from self-reflection in a bite-sized way that is easy to take on and pays dividends throughout the day. I couldn’t recommend this more highly to anyone looking to incorporate Stoic practice and reflection into their lives.",Luv rainbows,stoic,1312926037,
5,2020-06-01 12:05:27,Best multi tool journal of all!!!,False,"I’ve been searching through so many apps to find a good multi tool journal and mental health exercise platform. Not only is this both, but it is above and beyond! So organized and so many categories of daily thought journaling you can do in simple steps. The journaling aspect of this app is amazing! I’m so pleased that the mental health exercise portion is also amazing!! Countless easy guided exercises amazing quotes don’t know what else good I could say. Highly recommended above 7 mainly used (and I’ve tested) mental health apps!",Shelby luv,stoic,1312926037,
1,2021-06-10 13:48:39,Too much negative,False,"I decided to start doing a gratitude journal after multiple books I had read preached the benefits. While the added meditation options and other add ons are nice on this app, there is a shocking amount of negativity. Activities about imaging how awful a situation can be and then being thankful it isn’t, and negative quotes. I’m a strong believer of thoughts become things and this app is completely counterproductive of what I was looking for. I tried it for a few weeks but too many examples of negative continued to arise. It is also completely black and white, pretty dark and depressing just aesthetically as well. Would not recommend for someone trying to improve your mood, definitely doesn’t hit the mark.",Mister's,stoic,1312926037,
5,2020-04-18 05:28:50,Grateful for this app.,False,"I am currently going through a massive shift and growth in my life, it is very painful in some ways. Stoicism has always been one of my favorite schools of thought. This app has allowed me to train myself in that school of thought and journal my journey through out life. I suggest anyone that is interested in Stoicism do a bit of research on your own then download this app to begin training and living life in its ideals. 

Be not afraid of life. Believe that life is worth living, and your belief will help create the fact. -- William James",Archon of the Triumvirate,stoic,1312926037,
5,2020-04-07 04:23:06,Life changing,False,"This app is by far my all time favorite. Words cannot express how meaningful this tool has been to me in my life. From the journaling feature, the quotes that allow me to reflect, meditation, and daily questions and exercises...it has it all!  Every update gets better and better and I can’t recommend it enough. Thank you so much for making such and incredible app and providing so many of the features free!  I will be a subscriber before you know it!",Strsnvirgo,stoic,1312926037,
5,2020-05-27 19:44:13,i cannot recommend this app enough !,False,"as someone with severe mental health issues and continuous therapy/psychiatry, and have tried plenty of tracking apps, this is the best one thus far.

it keeps track of your moods and shows how they’re affected over the days, gives you journaling prompts, and has excellent meditation/breathing prompts to follow. i love stoic and appreciate how focused it is on YOU, not on promoting the app, ads, or otherwise. if i could give this app 100 stars i would. stop reading this and download stoic now",ukhoshekh,stoic,1312926037,
4,2021-01-27 05:02:59,"Awesome app, tiny bit glitchy tho",False,I would rate 4.5 if I could. I really really like this app. It gives positive quotes. It give you a positive affirmation each day. It help you reflect on what you’ve accomplished and what you can do better. I helps you set goals and achieve them. And I really like the breathing exercises. The only thing I don’t like is it’s a little glitchy sometimes. It sometimes doesn’t let me get out of the breathing exercise thing so I have to close the app. Then sometimes it doesn’t know what time it is. But overall it’s a rly good app.,Scarygorlreviewer,stoic,1312926037,"{'id': 20751872, 'body': 'closing exercises fixed\n\nto adjust time/day open your profile -> personalize -> start day at :)\nit works like this because i often do the evening routine at 2 am, and technically it’s already the next day. so there needs to be an option to say when you want the day to change.\n\nbest,\nm.', 'modified': '2021-01-30T22:25:22Z'}"
5,2021-06-02 21:50:05,Worth the time and money,False,"I’ve tried most of the other apps that work on self-improvement, reflections, meditation, and metal health. Stoic is the only app that really helped me. It’s a perfect blend of gentle reminder, positivity and insight that I have come to crave. This app has increased my mood and ability to tackle life’s curve balls. In addition, this app has pushed me to some self-discovery and has opened my eyes to perspectives I’ve never considered. I’ve actually sent this app to family members and friends as a recommendation!",CosmicFlash42,stoic,1312926037,
4,2021-04-12 09:47:28,Great app; don’t hold user data hostage,False,"Absolutely love this app. It should offer paid content no doubt. The amount of activities and functionality this app offers is astounding considering its freemium. It’s just a bit disappointing that it seems mostly user data is the motivation behind getting people to pay for the app. I would like to see the freemium model shifted to having many of the great exercises as a paid feature and allow all users to sync and export data for free.
Solid app otherwise. It’s impressive.",avicente9,stoic,1312926037,
5,2020-12-07 16:01:10,Best daily app,False,"Amazing functionality, great designs, and awesome tools. Although I would love to be able to see my comments on quotes maybe as a text box below the quote box itself after I’ve written them down. I find the quotes page is a little lazy. Could have it to where you are more encouraged to write about the quote you just read. 

however I don’t think the comment page takes away from the overall experience which I’m giving a 5/5.",Syedtanveer1,stoic,1312926037,
5,2020-04-19 16:24:13,Can’t believe this resource is FREE,False,"Hands down - this has made my life so much more fulfilled !!
personally having the guided questions for getting my thinking back in the right headspace - has just been a real eye opener! I’ve turned to them in what normally would have been high stress situations - and the difference in the outcome is amazing.

The best part is that it’s naturally spilled over into my analog life and I’m more aware now of my thinking and know how to re-route that thinking if needed. -that’s something I was just never taught 

This app came into my life right when I needed it and the personal growth it’s afforded is exponential- so much so that everyone in my life started asking me what it was that I was “on” and if they could have some - lol
Be the change you wish to see! 
This app will help you along your way",Rambler99sch,stoic,1312926037,
5,2020-04-11 05:00:36,Wow. What a wonderful App,False,"Honestly I am floored by how much of a change my life has seen ever since I started this app(seriously). If, you dedicate the time and actually take this app seriously you will begin to see changes in your life good and bad. You’ll start to see where you fall short and where you are putting too much. Simple yet effective in a meticulously built app. Bravo to the developers. I will gladly pay my monthly premium for this great application.",Christian_Canlas,stoic,1312926037,
5,2020-01-31 17:09:58,One of the best self help apps for anxiety,False,"I have suffered from severe anxiety for a good part of my life and have tried numerous apps to help me overcome some of the feelings I have had. Most applications I have tried have either been to deep or long for the exercises and or just too complicated for what they are. This seems to sit right in the sweet spot where simplicity is key and you can stay as long, or as little as you like while experiencing the different exercises.",woonkey,stoic,1312926037,
5,2021-02-17 15:04:58,Aesthetically simple.,False,"Aesthetics, information, guided exercises, uplifting quotes, and spaces to reflect all meshed into this cute little app.

This is only day 2 of usage and I’m HOOKED. just what I needed to take on my journey as a Stoic. It holds me accountable and I’m so excited I get a little place to write about things regarding this philosophical realm!! I just purchased some books via kindle and now I have a little app to go right along with it. 

I’ll see how I feel after a month, so far so good for now!",Ali Lawal,stoic,1312926037,
5,2021-04-16 07:10:03,Amazing app for creating a growth mindset,False,"I’ve used several apps before that focus on improving mental health/overall well-being, but nothing compares to Stoic. 

This app has helped me become my own challenger of the negative thoughts I find myself facing, and empowers me to be the same person who takes them out. From thought-provoking prompts, to rewiring unhealthy thinking patterns - Stoic has been there for me to see myself genuinely feeling better compared to my mood prior to sessions.",park angel,stoic,1312926037,
5,2020-05-21 16:00:15,Better than pen and paper,False,"I don’t know about the rest of humanity but I really dislike journaling. I’ve tried fancy paper and nice pens, beautiful notebooks and such. I just couldn’t develop a habit of it and would dread it. Until I found this app. I am now reflecting on life almost daily. The quotes are inspiring. The exercises (hint: they’re journaling in disguise) are thought-provoking. I highly recommend this app to everyone who wants a space for thinking or writing. I’m grateful to the app developers.",Nan shell,stoic,1312926037,
5,2020-03-18 15:52:30,A perfect companion,False,"I have been using this app since it launched and love it. The reminders in the morning and night are the perfect bookends to my day to practice gratitude. It’s a thoughtful tool I use daily and has had a profound impact on my attitude towards life. Thank you!

My only request as a power user is more quotes (because I have used the app so much I get repeats) and the addition of wave sounds to the mediation exercise because I love the ocean and it matches breathing more.",thankful skeptic,stoic,1312926037,
5,2020-10-09 16:48:07,"An amazing, completely underrated app",False,"I have been looking for a habit building app and a meditation app for the longest time. Most of the apps I found charged ridiculous amounts of money for resources that in my opinion should be accessible to all. Stoic not only combines both meditation and habit building into its app, it does it all for free! This app has allowed me finally to start improving my morning habits and begin meditation. I could not be more grateful for this amazing app.",Angela R. Davis,stoic,1312926037,
3,2020-02-23 16:03:13,Morning ritual BUG,False,"I’ve been using the app for about 6 weeks now and really appreciate it.  It’s become an important part of my Stoicism study and (more importantly) my practice.  The structure and prompts it provided are very useful.  HOWEVER, an apparent BUG has appeared.  In the Start Your Day prompts, I am being fairly consistently presented prompts that are clearly intended for the End of Day.  For example, it’s hard to answer “Did you accomplish what you intended today?” at 6 am.  I assume the app draws from a pool of questions but there’s something wrong.  I hope this can be fixed in the next update.",swoop7478,stoic,1312926037,
5,2020-11-28 05:42:40,100% recommend,False,"I’ve been searching for a minimal, well designed app for journaling that allows me to write with my iPad pencil. Stoic is that and everything else I could possibly want for meditation, breath exercises, morning pages, dream journaling, goal setting, overcoming negative thoughts... it’s everything and more and it looks perfect and functions incredibly. Also it’s free! Thank you developers, you made the most perfect app I’ve been searching years for.",AnneliseAtlas,stoic,1312926037,
5,2020-09-23 01:21:50,OMG...life changing,False,I hardly take time to write reviews but this APP is something else.  I just downloaded it this morning and only a couple of minutes passed by and I was crying...it really moved my emotions.  I just filled out my evening journal and answered all its questions and I can truly say this is a blessing.  I just am so happy I found this APP.  i definitely will be setting time apart to use it daily and will consider to upgrade my subscription.  Great Job and thank you!,Sandra1218,stoic,1312926037,
5,2020-10-15 13:08:59,Excellent and Most Useful app,False,"This Stoic app is one of the most useful apps I have found for journaling and keeping one’s mind organized and self-possessed. There are several sections one can add to a journal from morning pages, daily planning, and other reflection topics.  I was trained as a counselor in Rational-Emotive Behavior Training and work now as a coach for leaders seeking to develop greater emotional-social intelligence among other things.  I give this app my highest recommendation for anyone seeking to grow as a human.",Good Habits,stoic,1312926037,
5,2020-03-17 15:24:42,Grateful,False,Stoic has made me a more thoughtful and productive person and I look forward to using it every day. I am let down by a lot of apps that have all their features behind a paywall but this one actually has the average user in mind. I would definitely pay premium to support this app when I am able to. Thank you for making a special and lovely app that doesn’t bombard the user with ads.,adelaide sol,stoic,1312926037,
4,2020-09-09 10:48:05,This works,False,"This is a thoughtfully designed, practical app that helps me to focus on my day with just prompts for reflection, action and just enough inspiration, from the Stoica, that also challenges conventional thinking about achievement. Easy to use day to day and with tracking over time available. The daily activity icons are a little lame compared to the rest of the design and I wish there was a way to customize those options. But really a quibble with an overall great experience.",Dillwall,stoic,1312926037,
4,2021-01-09 20:35:02,Close to perfection for daily reflection.,False,"An almost all-in-one app for people not only interested in stoicism, but looking to reflect on their daily lives and improvement. 

I love the daily questions, which makes it easier to journal three times a day. Instead of just a blank screen. 

The only thing that keeps me from buying lifetime access are three things:

1. A more evolved journal. Would be nice to have a more dedicated journal with calendar and tags to easily go back to what I have written or felt before. 

2. More stoicism content, like articles, podcasts, reflections, etc. 

3. More quotes by modern stoics. I usually get daily quotes by Epictetus, Seneca and Marcus Aurelius and keep repeating themselves after a couple of days. 

Hope the devs read this and can better improve the app. Other than that it’s my favorite meditation, journal, stoic app.",PMA2000,stoic,1312926037,
5,2020-01-24 20:32:28,Love love love,False,"This app is truly amazing. I enjoy the different exercises/things you can do on the app such as journaling, breathing, meditation, fear setting, etc. Checking in on the app to fill out my “morning routine” and “evening routine” has been beneficial for helping me organize my thoughts and practice gratitude. Only thing I would really like to see be a part of this app at the moment is a community feature to share thoughts, ask and answer questions, etc.",kabkimmel,stoic,1312926037,
1,2020-08-06 02:38:48,another cash grab,False,"Nothing in life is free, this includes healthcare and mental health assistance and things that should help you. Sadly we live in an era where products even simple ones like this app you have to pay for...I understand people need make a living as well but to profit on some ones mental  health situation is just wrong. at least when you go to the doctors or a therapy session, with insurance they pick up the majority of the bill.. If you want to really help someone and make a difference, a real difference don't try to hide behind an app with a dollar sign and pretend that you care.. this is another subscription service... there are tons of these things..",Lycan7rop3,stoic,1312926037,"{'id': 17116905, 'body': 'you can use stoic for free.\n\nwe charge subscription for additional features like syncing between multiple devices and app personalization.\nwe do not limit any exercises or content.\n\nm.', 'modified': '2020-08-06T08:50:04Z'}"
5,2020-01-05 06:03:23,Best App for Me Right Now,False,"I have been struggling lately remembering what happened in my past days and this app helps me remembers since it asks me to put that stuff down. The questions are so reflective and just what I want to be asked when I wake up to be more productive or when I’m about to go to sleep and I want to think about my day. I love the exercises it has to calm down. I struggle with keeping journaling habits, but this one is definitely a keeper!",anncamgri,stoic,1312926037,
5,2021-02-22 00:01:35,Almost perfect,False,It’s my favorite app to use and is great with helping me learn more about my favorite stoic philosophers and also reflect on my own personal life and health. The only thing I feel like is missing is that I would like to get notifications in the morning and during the evening of quotes that could help through the day. Like how Bible apps do with notifications of Bible verses. Great app though and I recommend everyone to try it out!,Eskettles,stoic,1312926037,
5,2020-05-31 15:32:29,Absolutely Amazing!,False,"Thankyou so much for making this wonderful app. I’ve had less panic attacks in a day then I’ve EVER had.  My stress levels recently have blown through the roof but now, I can think and not worry.    Thank you so much for bringing my attention to my mental health and the importance of taking care of your self.❤️ Bless this app.   It’s deeply appreciated. My mood has definitely changed.  Thank you so so much. This app is amazing. 5/5 ⭐️ #mentalhealthawareness",XxBlus_WatermelonXx1,stoic,1312926037,
5,2020-05-18 19:21:52,So grateful for stoic!,False,"I’m using the free version currently and I am so thankful for this product. If you can afford the paid version it will definitely be worth the cost. Stoic has helped me work through a breakup in the middle of a pandemic. It has helped me realize, rationalize, and work through stress, fear, and anxiety. I feel calmer, more centered, and much more grateful after using this app. Keep it up guys, you’ve really created something special here.",blvck rxbbit,stoic,1312926037,
5,2020-01-28 12:51:41,Actually a great journaling app,False,"GET IT. I was a little skeptical about adding a mindfulness tool into my life that was on my phone, the place I go for pacifiers, but the black and white color scheme and simple nature of the application doesn’t draw me in for graphics or other pacifying agents. It focuses on journaling, breathing, meditating, twice a day and you can pick which activity you want to do. From the quotes to the unique prompts, I wouldn’t change a thing about this app.",CollegeYogi,stoic,1312926037,
5,2020-12-01 13:50:49,"Great design, easy to use daily",False,This app has come a long way from its humble beginnings as far as design and functions. The current version is truly fantastic and easy to use. It’s great by itself and could even be using in conjunction with an app like Calm to balance out your mental health. I love the way they track your input and then offer trends so you can see progress and patterns. Would recommend to everyone.,[0.0],stoic,1312926037,
4,2021-03-12 13:14:17,Made a difference in my life.,False,"I’ve been using this app for a few months to help keep myself grounded and manage my anxiety. It has really made a difference for me and I highly recommend it. 

I only wish the options for “What it your main focus for today?” were customizable. There are many choices that I would never use and several important ones are missing. Otherwise, I don’t believe I’d change a thing about this app.",hobartimus,stoic,1312926037,
5,2020-01-28 12:05:50,Helpful if you have time,False,The app is amazing but you will need to spend a couple minutes to get the full calming effect. Just rushing through won't help you but taking time and writing stuff down really helps. I choose hourneling every morning and write what I plan to do for the day and my schedule to do it and it really takes a large amount of the stress off my shoulders. This kinda sound lame but the app works lol,Theradbradss,stoic,1312926037,
