rating,date,title,isEdited,review,userName,app_name,app_id,developerResponse
5,2020-05-15 21:12:51,A non judgmental guide to a better self,False,"This app just keeps getting better and better. While using stoicism as a framework, this app has really been a way for me to practice personal reflection and awareness, cultivating better emotional wellness. Easily accessible techniques for gratitude, journaling, meditation, and breathing exercises without the pressure of any one thing being a requirement. The app guides you to those tools through a pleasant sequence without any pressure to use specific techniques. It’s so gentle. If you want to journal, then journal. If you want to meditate, then do that. And if you don’t, that’s ok too. It’s totally up to you. I find tremendous value in the simple act of making these sequences a part of my daily morning and evening routine; from simply opening the app and assessing how I feel to what my priority for the day is to how productive I felt. The app now even guides personal reflection towards specific categories. If in the morning I say I’m going to focus on reading, in the evening the app will then guide me to reflect on recalling what I read that day. So simple, but so helpful. Excellent user experience, an essential part of my every day routine now.",CheeseNinjaIPA98,stoic,1312926037,
3,2021-04-20 12:43:19,Maybe I don't know how to use this app?,False,"I'm not really sure how I feel about this app. While it does ask you questions/give you prompts to get you talking about things, sometimes the questions are weird. I had one this morning, somewhere along the lines of ""what are you then, a mere body? a ration being."" And I'm staring at my screen like how do I even answer this if I don't understand the question? There's other ones that are similar and because I don't understand what it's asking me to write, sometimes I'll just put ""lol"" so I can move to the next page. Then when you're done with your questions it will ask if you feel better and mostly my answer has been no because the questions it gave me were weird. You can pick what questions you'd like to be asked everyday but none of them really jump out to me as something I'd want to answer daily besides the one sentence summary of your day but even that is whatever. I do like that it tracks your mood, would be cool to have another tracker for what is causing your mood instead of the sad to happy face scale. The quotes are cool too. I've been using the app for about 2 weeks now and I feel like maybe twice out of the 14 days, it's actually asked me something relevant. More often than not, I'm using the blank page entries instead but I could just write those in my actual journal. Perhaps this app isn't for me, but it seems to work for people.",Jay2DaNaay,stoic,1312926037,
3,2020-10-31 00:11:52,Good For Simple Journaling,False,"I am enjoying the free version of the app, (so this is coming from that point of view.) The daily prompts are repetitive but the paid version promises more “reflective questions” and “quotes”. (I wonder, how different could it be?) I do like the daily “choose your own/write your own ”mantra/saying/quote/etc.” There are quotes/reflections to use as journal prompts, if you just feel like typing. The daily mood/goal prompts kind of deter me away from using the app. It almost seems like a chore, mostly because not every answer for the “mood/goal” question warrants the next prompt which is usually,  the exact same question about what we plan to do about such-and-such from the previous answers. Everything is predictable. Most of the time I just find myself lumping my thoughts into the closest category, or rushing by multiple prompts to get to the writing part and find I am uninspired. This has app has potential but I feel there are two different ideas clashing here. I love inspiration when I want to write something, but if I want to journal purely for self-reflection and self/improvement I’d like a little more depth, less out-of-context quotes from other people. Either way, there was a lot of work put into this, and a need for it too!",SilenceRecited,stoic,1312926037,
5,2021-04-03 14:27:52,yuhhhhhh,False,"I downloaded this app last week and it’s been on my home page since then. I’ve only started using this app a few days ago and OMG😳 This app is so beautiful. I’m only writing a review just so I can ask if you guys can put a password for the journal part because my mom looks through my phone and I don’t want her to read the things I write in there💀 Anyways, I do actually really love this app and its perfect from the bottom of those codes and to the top of the icon. It’s iconic honestly. Not to forget the fact that it’s been lifting burdens and weights off of my back when I type everything in details. It’s like a friend that I’ve always wanted, which is sad because none of my real (alive) friends are there for me and asks me how I am like how stoic is🥲 Ever since the app asked me the first question, I’ve poured allllll of the things I wanted to say and in details too. I- this app is like that one friend that you have that’s always there for you no matter what and genuinely cares for you so deeply and that you’re comfortable being around them even though you’ve only met last week. yknow? this app is my twin flame.",kytedot,stoic,1312926037,
5,2020-11-24 01:18:05,This is an amazing app,False,"I typically do not like journaling on my phone however, I stumbled upon this app and gave it a try and I absolutely love it. I wasn’t sure if I wanted to buy a membership but I did because I wanted to have full access to the entire app to be able to really see if it was worth it. So far, I have used the app in the morning and evening. I wanted to be able to track my mood to get a good sense of what really bothers me and be able to journal. I find that it really helps me find peace and be able to find happy moments in my day when it is hard to find sometimes. I love being able to find ways to be grateful and this really helps me find those moments in the day when you’ve been so stressed and all you can think of is the negative parts and then turning it around to find those moments that stand out that are positive. Even during times of stress I have been able to see the positive. I’ve been able to take a step back and really look at each situation as a learning experience and sometimes it is hard to do when you are battling depression, anxiety and PTSD. Definitely recommend this app!!",Chryssee,stoic,1312926037,
5,2020-01-21 06:17:13,Try This App,False,"As a philosophy student and a productivity nerd, I’ve probably tried somewhere over 20 different journaling apps over the years and nothing has ever felt complete enough to make it worth the time. Within my first sit down with this app however, I actually found myself crying in some moments and smiling at others, ultimately feeling like I had done something truly productive. This app is incredibly in-depth and really delivers a guided experience that is tailored for your personal goals. It is structured enough to feel like you know what to do in order to benefit from it, and it is open-ended enough to feel like you don’t need any other app to accompany it, which makes it feel very complete and satisfying to have everything in one place. The customizable options, philosophical quotes and questions, and the array of mental exercises to choose from make this app an excellent tool to heal and grow. I have no doubt that this will continue to be a valued part of my daily routine, and I urge anyone reading this to try this for yourself!",AustinCorn,stoic,1312926037,
5,2020-04-16 12:23:18,Making a difference,False,"I’ve been struggling with depression and anxiety all my life. I don’t feel comfortable w personal counseling, which I have tried.  I’ve read multiple self help books ranging from CBT to The Power of now, all incrementally helped and gave me short term motivation but I lacked discipline.  I also have and continue to use Youper for on demand emotional assist.  Mornings are the worst for me. At times I am woken by anxiety. When it’s bad I force myself to cry before leaving the house because I don’t know what’s wrong but I know crying helps.  This app has made the most difference so far- I’ve only used it for 2 weeks.  It’s the first thing I do when I wake up. I don’t check mail or social, I brew my coffee and start w Stoic. The daily quotes are great weather I chose to reflect on them or not. Having to write/pause/set goals puts me in a whole different head space before my day actually starts. Today I woke up not anxious and looking forward to Stoic asking me -do you feel prepared for the day? So far the Answer has been Yes",nickname?geez,stoic,1312926037,
5,2020-02-23 15:46:30,I was skeptical at first.,False,"I’m trying to be a bit more aware the tone I’m thinking in. documenting my thought process throughout a time period helps me be more self aware. I tried physically writing but I can’t stand my handwriting and how inconsistent it is and then I’d accidentally switch notebooks and dates would be out of order- bleh. I tried social media but, this is rather private. yk? 
then I decided one day to just download this. I looked through the reviews, figured whatever let’s try it. 
the first two days, I wasn’t crazy about the app although once I became adjusted to the app’s algorithm and was it’s formatted: I enjoy it. I do, I would love a bit more personalization but that’s just me. it’s just a bonus I’d like. (although I love the app’s dark / soft theme. 
not all the options within the app (moods, activities, quotes) are particularly my style but the range this app gives you? with the different preset moods and activities and so on - awesome work guys. 
definitely download. plus it’s free!",InkedGalaxies,stoic,1312926037,
5,2020-06-24 17:37:07,"Life Changing App, Love It.",False,"I rarely write reviews for apps, but when I do so it’s either because I hate it and had to express that, or love it (which is the option here). I’m extremely impressed. Like seriously. I’ve been going through a lot mentally and emotionally the past several weeks, and this is like having a personal journal to jot down your ideas, thoughts, and to help silence your mind from those scrambling thoughts floating around in your head. Everything was well thought out, I love the minimalistic yet elegant approach in terms of the UI and how helpful it is to help pull any and/or every thought out of your head to help guide you to being more present and self aware of what you’re feeling, how you’re feeling, etc. I loved it so much I subscribed for the yearly plan (with the free trial of course so I can see what additional benefits I’ll get). The mantras are amazing and they help set the tone of the day! Much love, I’m a fan.",Pootoo88,stoic,1312926037,
5,2021-01-25 20:15:12,Absolutely Incredible - Better than Others,False,"Absolutely incredible. The focus breathing, the journaling, and the adaptability to each user. I have never seen such an app before. I have downloaded over 20 journaling apps, but I eventually always delete the app because I forget to journal because the app doesn’t help me. Now, this journaling app is incredible. I write 3-5 times a day and use its focus breathing exercises so much. This is the only app I want to actually support with money even though I am a stingy person.

——

Update: I do dislike the new feature where it asks you to think negatively to become grateful without being able to decline like last update. For those who are suffering depression, anxiety, and other mental issues, this is a big black hole that one can go into. I plead the developers to lock this feature away by being able to decline before the app asks you that question.",NemoTheCat,stoic,1312926037,"{'id': 20686361, 'body': 'hey,\n\ncould you please ping me at m@stoicroutine.com so we could find the issue with forcing negative visualization? \n\nthere should be an option to skip it but i worry we messed it up.\n\nbest,\nmaciej', 'modified': '2021-01-27T12:52:23Z'}"
5,2021-04-20 16:20:19,This is the app I needed.,False,"This is the app I needed. I’ve been looking for this for a long time.  What I’m here to treat: Bipolar Disorder 1, ADD, Anxiety and Relationship problems.

Why I have failed with past apps and what this one gets right

1) Clutter/Non-optimal design

Due to my extreme sensitivity and need for minimalism, other apps with their colors and complex menus were usually too much.

This one is white one black. Perfect.
Journal history view is scroll-only with effective use of emoji to efficiently encode the information. Perfect.

2) Need multiple apps

By way of illustration, prior to finding this app, I was using and paying for multiple apps featuring breathing exercises and CBT, to name a couple. A dedicated breathing exercise app may still be desirable for you, but if you’re easily overwhelmed such that the prospect of needing multiple apps will increase your chances of failure, know that this app contains breathing exercises and guided meditations alongside the best-in-class CBT, in my opinion.  Perfect.

3) Daily commitment feels to complicated or involved.

Many apps make me dizzy with what they want me to do to get better.  This one asks me to select a minimal drawing of a mouth to indicate my mood, quotes a stoic philosopher to inspire me and then gives me the option of what I want to do from there, while first gently encouraging me to journal by prompting a conversation.  Perfect.",Daniel the Greek,stoic,1312926037,
5,2021-02-10 13:08:43,High Recommend!!,True,"I’ve written a couple app reviews for this app before, but I just want to put in that after using it for about three months now, I must say that stoic is quite a wonderful app! It gives you all sorts of options for things to do that really help my everyday mentality, like breathing excersize, meditations, and fear settings/thought excersize. A high recommend! I’d say my only issue with this app is probably that the morning routines are SO long. Honestly I don’t mind doing them, but I just wish there were options to choose the amount of questions asked. People are busy, not everyone has 30 minutes each morning to answer like 10 questions. Perhaps five or six? Also I like the meditation options they have, I only wish they had a few guided ones. That’s only a request, not a complaint though! My first point was a complaint.",Raimabird,stoic,1312926037,"{'id': 20357398, 'body': 'could you check what hour you have in ‚your profile’ -> personalize -> start day at?\n\nbest,\nm.', 'modified': '2021-01-12T22:23:35Z'}"
5,2021-02-09 00:02:49,The perfect app for my daily journaling needs,False,"I feel a deep debt of gratitude to the makers of this app. I feel as if I’ve been searching for just the right journaling app and this one feels like coming home to the one made just for me. I am remembering back to the time around eleven years ago when I was jumping around between different Buddhist groups trying to find where I fit in before finally feeling at home with a Zen/Ch’an Buddhist group in Colorado. Anyways, to get back on the toping of Journaling. As I’ve been exploring my inner self through meditative practices, I’ve found journaling more and more useful. I’ve also discovered practices such as Stoicism that have been very helpful too. This app seems to combine  meditative breathing exercises, with Zen and Stoic philosophy and also to be great at guiding the individual to emotional well being. Thanks for making such a great app!",JRBel,stoic,1312926037,
4,2021-01-10 15:16:09,"Excellent, with Some Minor Things",False,"I’ve tried a lot of apps like Stoic. and it’s unquestionably the best, and the only one I’ve consistently stuck with. It’s simple but comprehensive and powerful. I love it, and use the iPhone, iPad, and Apple Watch versions daily to very positive effect.

My only critique is that sometimes the morning and evening question prompts will include questions that are very similar (“how do you plan to spend the rest of today?”, “what do you plan to do today?” in the morning) and/or outright repeat questions (often “what made you smile today?” in the evening). I suspect that I could avoid this by selecting/customizing my questions, but I like the sometimes unique questions that pop up and worry that if I don’t let the app decide, my experience with that feature of the app will stagnate. However, it is sometimes disruptive to the flow to have the same or similar question come up again.",grievedghost,stoic,1312926037,
5,2020-12-29 20:02:03,Has truly helped with my mental health,False,"This app is the best app for mental health. It’s very relaxing and truly makes me feel calm and at ease. I love how the morning questions map out your day and how the evening questions help you reflect on the good and bad that happened during your day. As for the exercises themselves, they have helped with gratefulness, fears, and stress, and have really helped with my problems.

The only problem I have is with the affirmation widget. I click on the add affirmation button on the widget and it just opens the app to the main screen. I really hope you guys can fix this as I really like the affirmation widget.

Overall, I would totally recommend this app. I have recommended it to a couple of family members, and they all enjoy it as well. I just hope the affirmation widget gets fixed.",12CatLady12,stoic,1312926037,
5,2020-07-13 17:19:16,Helpful for apathy and feeling stuck,False,"I’m feeling a general lack of motivation and low-key depression, but wasn’t sure what to do about it. I was looking at some of the virtual therapist apps at first glance they looked pretty I structured. Instead I got this app on a recommendation from a friend and I’m glad I did. 

It encourages me to reflect on what my priorities are daily and make a better plan for how to meet them. I find it gentle and non-judgemental but is still increasing my focus and sense of accomplishment because I set priorities and meet them, even if they’re very small. It also helps me celebrate days where my explicit focus is to relax. Or see friends. Or just clean the house a bit. This app helps me see that as a valid goal I met rather than “wasting time”. Would recommend for people who like a structured reflective approach.",cjspurg,stoic,1312926037,
5,2020-05-01 03:58:23,Worth it.,False,"All in all, this Stoic Journal has been very helpful for me. It’s helped me to control my anger - with the breathing and the thought exercises. I’ve been teaching these to my daughter who has seen anger modeled by me. It’s helped me to spot unhealthy thought patterns and shut them down. It’s given me the space to think about how my mind and body work together. I’ve also gained insight into myself with the trends. I’ve spotted patterns in my mood and fulfillment levels. I’ve been able to course correct. I’ve begun to build a ritual of starting and ending the day with this app. It’s honestly made my life better. Of course it is just a tool. It’s not magic. It’s just helped me to focus on my mental, emotional, and spiritual well-being. It’s worth $40 a year. I paid $120 an hour to talk to a therapist.",BloodElk,stoic,1312926037,
5,2020-09-21 13:25:40,Incredible,False,"I downloaded this app because I was feeling especially down one day, and I didn’t even take it seriously. I just thought I’d use it for a few days to journal and then forget about it like the other apps.
But then I actually opened it and used it and I kid you not, from that very next day there was a change in the way I thought about things and a change in me!
It was crazy too because those questions that it asked me made me think so deeply, that the next day when I was about to go right back to that terrible habit of thinking everyone hates me, I stopped myself.
I’ve been using it every day since and I love it. I’m so so glad I gave it a real chance too because the amount that you put into this is exactly the amount you get back.",SoliyanaW,stoic,1312926037,
5,2020-10-26 09:31:20,Incredibly helpful,False,"This app, called stoic, (based after stoicism, obvi) is genuinely helping me with my mental health. It has a lot of options for improving mental health, like journaling, focusing on goals, fear settings, meditation, etc. It’s been super helpful in helping me prioritize things in life. Also, the fear setting section, might even be the most helpful, it analysis’ your fears and helps you get to the root of it and how to solve it. Like my main fear, which I’m not going to share, but it helped after one entry. And best of all, it’s free! I realized that I have trouble sharing my feelings and internal struggles with others, which is why therapy would be difficult for me, but this app helps me cope with it on my own terms. Without having to worry about others finding out. Definitely recommend it",mijnli,stoic,1312926037,
5,2020-09-10 13:56:56,Day Boosting,False,"I heard about Stoic when someone recommended the app to me. At first I was hesitant because a lot of these kinds of apps declare that they can do this or that and make your life magical again. But despite my reservations I downloaded it anyway. To my surprise, this app has been nothing but helpful and inspiring. I use it every morning and every evening reflecting on my day and starting my morning off with positive energy. In a time like ours, it is so easy to be pessimistic about...well everything! But when I use this app first thing in the morning it reminds me to remember the small things and focus on what we DO have, rather than what we DON’T.
 I would 100% recommend this to anyone who needed clarity and tranquility.  
Thank you for being such an amazing app!",Mikiraedoss,stoic,1312926037,
5,2020-04-11 13:38:29,Im confused,True,"I’ve had it for one day and it’s already messing up. I like the app so far I really do but it is telling me that it’s still Thursday(yesterday) but today is Friday. It might be because I didn’t do my “evening routine but I did it today and still wouldn’t let me go to the next day. I’m confused and don’t know what to do, I tried deleting and re-downloading it but it didn’t work other than just giving me the same day and have to redo it over again. Someone help me please.
Edit: Never mind I got it to fix itself after quite a bit of time. I do really like the app so far after one day of use but yeah. But also thank you for the response that makes it much easier for me and now it’ll always be on the right day.",wolfgirl💙🌑🐺,stoic,1312926037,"{'id': 14596171, 'body': 'hey,\n\nmy apologies for your trouble. could you open ‘you tab’ -> personalize day -> day start -> pick 12am?\n\nbest,\nm.', 'modified': '2020-04-10T19:52:32Z'}"
5,2020-09-21 04:34:28,"Life changing, for those that use it",False,"This app, is simply a reptition of philosophy. Do everything it says, lay your thoughts out. Us millennials are so used to our smartphones that journaling in this fashion works the same way as writing our thoughts down. We feel the words we type now. And it’s amazing. This philosophy will teach you the key to happiness, and this app facilitates the philosophy efficiently. It’s straight forward and without gob. Takes real texts from real stoic philosophers, has an array of options for you to log your feelings, emotions, actions, etc. And it encourages you to question the things you do, if you follow the exercises, and stick with this app, but not only that but the PHILOSOPHY of stoicism. You will flourish, and inspire love and freedom in yourself, and others.",claset,stoic,1312926037,
5,2020-07-12 20:11:13,"Faithful use has correlated with my life changing, but I have a complaint",False,"I am a scientist so I won’t say that this app changed my life, but since I started using it routinely my ability to handle adversity and do things that are important to me has improved tremendously. 

After using it for a month, the correlation between faithfully using this app and my life changing more rapidly for the better is very strong, which is the best praise a scientist can honestly give from personal experience.

My complaint, though, is that even though both of my devices are set to sync and backup to icloud, my morning and afternoon exercises are not transferring between them. Journal entries do, apparently, but I don’t think they had even recently.",Sonicator844,stoic,1312926037,
5,2020-08-07 10:07:18,Essential to my daily routine,False,"This app is amazing. From the UX to the quotes, to the thought provoking questions. It’s caused me to slow down and reflect on my morning and the day that lies ahead while also looking at the bigger picture of life. I love that I’m able to customize my questions and can switch it up anytime. I sit and drink my coffee while I fill out my stoic journal every morning. Afterwards I mediate for 10 min with insight timer. Simple. Easy. And free. If I were to add any feedback it would be 2 things: 

1.  I would love a desktop app for this app. Sometimes I want to write a full fledge journal entry but I am deterred bc i don’t like typing a bunch on my phone. I think I would be willing to pay for a desktop version. 

2. I would also love to see some quotes from women. I know there weren’t too many stoic philosophers who were women at the time.. but I see that you also have Buddhist and Catholic quotes. There are definitely women philosophers out there who are alive and who have passed away that have great ideas and quotes.  

That is all!! I will continue to use this app and cross my fingers for the day I see a quote by a woman one morning 🥰",savannahhbananaa,stoic,1312926037,
