date,title,isEdited,rating,review,userName,app_name,app_id,developerResponse
2020-01-24 06:56:15,Pay for anything,False,1,I thought this was going to help me with sleeping and stress but you need to pay for everything if you want to use it,a dyslexic boi,breethe-meditation-sleep,920161006,"{'id': 13147574, 'body': 'Sorry for the confusion! The app has a free level that you can use for as long as you want. It allows you access to more than 90 free meditations. It\'s easy to search for the free ones. You cap the search icon on the top right, then turn on the ""Free only"" switch. You can look under single, series or playlists. The locked meditations are premium content and have the crown icon on it. We\'d be happy to assist you at support@breethe.com.\ufeff', 'modified': '2020-01-28T00:32:49Z'}"
2020-01-19 10:23:59,Not for me,False,1,You have to pay or almost everything is locked,wiisewun,breethe-meditation-sleep,920161006,"{'id': 13022135, 'body': 'Hi, We\'re saddened to hear the app is not for you. The free meditations can be easily be found by tapping the search button on the top right and then tapping the ""Free only"" switch so you only see free meditations in the app. If you\'re interested to give it another go, feel free to contact us at support@breethe.com for assistance.', 'modified': '2020-01-20T16:55:54Z'}"
2020-07-21 18:11:00,Life changing,False,5,The price I can deal with in the meditations are 100% good love it 👍👍👍🏾👍🏽👍🏾👏🏾 headphones 🎧 👂🏿,dorienrobbs,breethe-meditation-sleep,920161006,
2021-05-07 03:38:25,Cool,False,4,It’s cool but for some things you have to get premium,NXZ splash,breethe-meditation-sleep,920161006,"{'id': 22727926, 'body': 'Thank you for the review, NXZ splash! ❤️ You are correct - the free version offers a couple of hundred meditations and to enjoy thousands more you need a Premium membership. The good thing is - you can enjoy it for as little as $0.52 per month! 👍', 'modified': '2021-05-10T19:16:17Z'}"
2021-03-08 19:09:59,No Airplay Support?!?!?,False,3,"App seems beautiful, but I can’t listen on airplay to my stereo system. This makes it unusable for me.",Bad Ace!!!,breethe-meditation-sleep,920161006,"{'id': 21573624, 'body': ""We're sorry to hear about that, Bad Ace!!! If your audio system supports AirPlay than you should be able to play it. Please drop us a line at support@breethe.com and we'll be happy to assist you! 🥰"", 'modified': '2021-03-10T19:30:08Z'}"
2020-04-08 04:18:45,The best app,False,5,This app is so help full I would love it for free but it’s the best I love it,mkabbr,breethe-meditation-sleep,920161006,
2020-07-17 05:20:05,Ok,False,2,When relaxing trying to meditate I really dot want to have to hear someone talk walk me through stuff just wanna relax to calm soothing music,Emilyraccoon,breethe-meditation-sleep,920161006,"{'id': 16701941, 'body': ""Hi Emilyraccoon,\nThat's ok - not everyone has to be a guided meditations' fan! Please note that Breethe is mainly a meditation app but there is plenty of other content too. We have hundreds of calm and soothing music tracks waiting for you to enjoy. \nPlease drop us a line at support@breethe.com and we'll be happy to help you find it. We hope to hear from you soon! ❤️"", 'modified': '2020-07-17T14:16:18Z'}"
2020-06-06 05:24:13,Easy to Fall to Sleep,False,5,"This App Really Helps to Fall into a Deep Sleep and to get Me 
Destressed and to Unwind",Mikey Munchkin,breethe-meditation-sleep,920161006,
2020-11-26 07:14:19,IMPOSSIBLE to cancel this app,False,1,Horrible app!  If you subscribe to this app good luck trying to delete the subscription.  I continue to be billed monthly and can’t cancel it.  E-mails to Breathe support have gone unanswered.,PKornfeld,breethe-meditation-sleep,920161006,"{'id': 19395405, 'body': ""Hello PKornfeld! We answer every single message within a maximum of 24 hours so please make sure that you email us at support@breethe.com and check your spam folder for the reply just in case. As for the subscription itself - when you set your subscription up via Apple you also need to cancel it via Apple (through the subscriptions section of your device - we have no way to do it from our end due to Apple's rules). Please send us a message at support@breethe.com and we'll be happy to assist you with cancellation and a refund. We hope to hear from you soon! 🥰"", 'modified': '2020-11-27T15:03:17Z'}"
2020-02-15 14:41:45,Love it,False,5,Omg love this app drifted off in like five seconds this app is amazing,anithia,breethe-meditation-sleep,920161006,
2020-04-19 13:05:03,Disappointing,False,1,This app would be great if it didn’t go off when your screen times out.,TO TELL THE TRUTH....,breethe-meditation-sleep,920161006,"{'id': 14905918, 'body': ""Hello there! We're sorry to hear about the issue. It would be great if you could contact us at support@breethe.com with more details so that we can assist you with fixing it. We are working hard to make the Breethe experience as smooth and issue-free as possible and your feedback could help us achieve it! We will be also happy to provide you with free Premium access and refund, as we wouldn't want you to pay for the app if it doesn't work exactly as intended. We hope to hear from you soon!"", 'modified': '2020-04-25T14:18:24Z'}"
2020-01-15 22:01:18,Buyer Beware,False,1,"They boast a free trial. I decided to cancel well within the trial period. They still billed me and despite re emailing them, there has been no response. So if you try this, be aware there is no trial.",Jls2505,breethe-meditation-sleep,920161006,"{'id': 12979377, 'body': ""Hi Jls2505, We're sorry to hear that happened! Apple automatically processes renewals within 24 hours before it expires. The best way to check if you've successfully cancelled and to get a refund for any charges if to call Apple Support. They process payments and have access to your iTunes account and billing information, something that's not share with us to protect you privacy. You can reach them at 1 800–692–7753 between 7.00 a.m. and 11.00 p.m. If for some reason they decline you request for a refund, let us know at support@breethe.com so we can look into it for you."", 'modified': '2020-01-17T17:45:14Z'}"
2020-10-30 08:04:41,Great App,False,5,Great app. Highly recommend,Engineercivil,breethe-meditation-sleep,920161006,"{'id': 18820695, 'body': 'Thank you, Engineercivil! 🥰', 'modified': '2020-10-31T15:59:22Z'}"
2020-09-09 09:49:35,Accident,False,5,my name is kyle and im afraid i named myself an offensive name. I am so sorry ❤️,Kyletotheface,breethe-meditation-sleep,920161006,
2020-04-04 15:17:04,Worst app ever,False,1,Downloaded the app due to the reason it was free.  App does not work or provide you with any information unless you upgrade it right away.  DO NOT RECOMMEND.👎🏻,mentir63,breethe-meditation-sleep,920161006,"{'id': 14469191, 'body': ""Hi mentir63, Sorry for the confusion! The upgrade is completely optional. When you close the upgrade offer and tap the Get Started button, you can use the app right away. You may also create a free account so you can track your progress in the app. You can also go to the Library in the app and tap the search box, then tap 'Free only' to only show free meditations. We'd be happy to assist you with this at support@breethe.com. "", 'modified': '2020-04-05T16:03:12Z'}"
2020-03-02 07:55:43,Won’t let you try it cost 90 dollars,False,1,Any app that won’t let you try it until you pay 90 dollars isn’t for me.  The woman sounded too snappy.,freewriterguy12,breethe-meditation-sleep,920161006,"{'id': 13832065, 'body': ""Hi freewriterguy12, We're sorry to hear about the confusion with the optional premium membership. More than 90 free meditations are available to users. Any meditation without the lock icon on it is free to use. We'd be happy to assist you with this at support@breethe.com."", 'modified': '2020-03-03T13:23:22Z'}"
2020-01-07 03:30:58,Omg do not get,False,1,I am not paying 90dollars for this stupid app I recommend to get a different app🙂🙂  when I used this app I fell asleep in45 mins I will wish you luck to fall asleep in 5mins,Lily Lily gang gang,breethe-meditation-sleep,920161006,"{'id': 12777911, 'body': ""Hi, We're saddened to learn about your experience and thoughts about the app. It sounds like you did not see the value and we're sorry it was the right fit for you. We hope you find what you're looking for. Feel free to contact us at support@breethe.com if you have other questions or concerns."", 'modified': '2020-01-07T19:07:06Z'}"
2021-06-07 07:21:11,Not helpful,False,1,"Pretty useless. Not like the advertisements at all. Did not enjoy, and deleted app after 5 minutes",BryBry..,breethe-meditation-sleep,920161006,"{'id': 23272188, 'body': 'Hello BryBry 🤝 We\'re sorry to hear that this is how you feel! It would be great if you could contact us at support@breethe.com and let us know what do you mean by ""not like the advertisements"". We\'d love to hear your feedback! ❤️', 'modified': '2021-06-08T20:17:24Z'}"
2021-01-28 13:35:38,Worth it,False,5,Much needed,Bearearl,breethe-meditation-sleep,920161006,
2021-02-02 03:16:39,Why?,False,1,Can’t even try it without giving a credit card,Plastic queen,breethe-meditation-sleep,920161006,"{'id': 20862039, 'body': ""Hi Plastic queen ❤️ You can use the free version of Breethe without having to share any payment details! All you need to do is refuse the free trial offer (as it will automatically become a paid subscription, as explained on the free trial screen) and you can enjoy Breethe using the free account for as long as you'd like. There are hundreds of free items available and we rotate them every once in a while to make sure that users with free accounts can enjoy more content! If you need any help with that, please drop us a line at support@breethe.com and we'll be happy to help. We wish you wonderful meditations! 🧘\u200d♀️🥰🧘\u200d♂️"", 'modified': '2021-02-04T16:15:47Z'}"
2020-06-07 13:25:09,Thanks 🙏,False,5,Thank you for the free ones. Very nice 👍🏻,zvmlhseyop,breethe-meditation-sleep,920161006,
2020-02-16 06:00:20,Money,False,5,It’s worth the money ...,ohmyholyyeha,breethe-meditation-sleep,920161006,
2020-09-10 10:05:43,Money Hungry developers,False,1,Why pay a large monthly Fee when it’s free on other apps and YouTube?Dont use this app if you care about saving money,petter pipper,breethe-meditation-sleep,920161006,"{'id': 17839753, 'body': ""Hello petter pipper, please note that Breethe is a free app. You are welcome to enjoy it without paying a cent, for as long as you'd like. There is a paid Premium membership option available but it is entirely optional. It's also important to note that all of our content is unique - you won't find it anywhere else. You can, of course, find plenty of other apps if you aren't happy with the thousands of meditations, hypnotherapy, bedtime stories, talks & masterclasses, music, ASMR etc. that we've prepared. We wish you all the best and hope that you will find something just right for yourself! ❤️"", 'modified': '2020-09-12T15:23:29Z'}"
2020-05-21 02:38:05,Don’t care at all for the voices of the speakers.,False,1,Cancelled my free trial after listening to samples for less than 15min. Don’t find any of the voices relaxing or soothing.  Back to Peter Thomas and Forensic Files.,pegpenc,breethe-meditation-sleep,920161006,"{'id': 15509374, 'body': ""Hi pegpenc,\xa0\nWe're sorry to hear that that's how you feel about some of our teachers' voices. Please note that there are actually many voices to choose from - you can simply scroll down in the Library section, then tap Teachers (under Authors) and choose a teacher you prefer. If you need a free trial to browse through - please contact us at support@breethe.com and we'll set you up! "", 'modified': '2020-05-23T14:10:07Z'}"
2020-03-12 22:04:17,Cancellation,False,1,I’ve been trying to cancel and every time I do it says cannot connect. I’ve emailed to get this resolved and no response!,adowns592,breethe-meditation-sleep,920161006,"{'id': 14024571, 'body': ""Hi adowns592, We're sorry to hear you had trouble with  cancelling. You can do this in the App Store. Once in the App Store, tap the profile icon at the top right, then choose Subscriptions. Next, look for the app in the list and tap on it. Then, you can scroll to the bottom to cancel. If the only option is to resubscribe, it means you already cancelled. Regarding your email, our reply may have gone to your spam folder. If not, could you contact us at support@breethe.com referencing this review? "", 'modified': '2020-03-13T08:58:54Z'}"
2020-02-06 10:01:22,Bummer,False,1,Don’t download. U get one selection unlocked from each category. The rest is pay.,USMCMom1,breethe-meditation-sleep,920161006,"{'id': 13344717, 'body': ""Hi USMCMom1, We'd like to help you find more free meditations. When you tap the search icon on the top right of the app, then enable the switch that says 'Free only', it will display all the available free meditations arranged by type: single, series or playlist. For further assistance, please feel free to contact us at support@breethe.com."", 'modified': '2020-02-07T06:15:56Z'}"
2020-01-13 20:45:07,89 bucks a year. Not free.,False,1,Nope - that won’t make me relax. Y’all have lost your mind if you pay for this. It better come with a message for that price.,Mehkft,breethe-meditation-sleep,920161006,"{'id': 12934500, 'body': ""Hi, We're sorry you did not see the value of the app. The paid premium membership is completely optional. We have many users on the free basic level. If you need assistance with this, we're happy to help at support@breethe.com. "", 'modified': '2020-01-15T16:34:04Z'}"
2021-01-16 10:26:20,Best App ever,False,5,Will never cancel this subscription—ever....,Itgotmemoving,breethe-meditation-sleep,920161006,"{'id': 20485716, 'body': 'Thank you, Itgotmemoving! 😍', 'modified': '2021-01-18T21:21:36Z'}"
2020-05-22 08:32:58,My Nights,False,5,I love this app,Mike Fax CPA,breethe-meditation-sleep,920161006,
2020-07-21 04:40:08,Disappointed.,False,1,"The app sounds fantastic, and I’m sure it would be, but 97% of it you have to buy with a yearly subscription.",Unclepoppy,breethe-meditation-sleep,920161006,"{'id': 16789662, 'body': ""Hello Unclepoppy. Yes, Breethe does sound fantastic! ;) And yes, there is a fee (monthly, yearly or a lifetime) if you'd like to have access to the entire collection, but there are still hundreds of free meditations and other content to enjoy without having to pay anything. Please drop us a line at support@breethe.com if you'd like us to point you in the right direction. We hope to hear from you soon! 🥰"", 'modified': '2020-07-21T20:37:12Z'}"
2020-05-17 20:17:04,AMAZING AND PERFECT MEDITATION APP!,False,5,This apps really changed my life in a very positive way. Amazing coaches and Affordable. IT IS 100% WORTH IT!,ASDB4567890.,breethe-meditation-sleep,920161006,
2020-03-16 05:18:40,"Breath, Meditation & Sleep",False,1,"Looks great, would’ve sounded lovely, choices for your mood/state of mind......
Then see the fine print $89. After trial-
I’ll stick to the free rain storm sounds!!",allnamestaken!!!,breethe-meditation-sleep,920161006,"{'id': 14083840, 'body': 'Hi, Thank you for sharing your thoughts about the app. Regarding the membership, we offer different levels starting with a free membership that allows you to access more than 90 free content. Then, we also offer special pricing for the monthly, yearly and 2-year memberships. To learn more about these you can reach us at support@breethe.com.', 'modified': '2020-03-18T10:15:21Z'}"
2020-04-26 06:52:04,Stress Course,False,5,Sounds very promising!,Lee Jenkins,breethe-meditation-sleep,920161006,
2020-03-10 15:08:55,Great app,False,5,"I like the new logo, looks good.",GlorimarRivera,breethe-meditation-sleep,920161006,
2020-09-13 21:01:02,Cancel my subscription NOW,False,5,My name is Jody Halloran,jody is my nickname,breethe-meditation-sleep,920161006,"{'id': 17887255, 'body': ""Hi Jody, please drop us a line at support@breethe.com and we'll be happy to assist you with the cancellation and a refund. We hope to hear from you soon! ❤️"", 'modified': '2020-09-15T09:34:20Z'}"
2020-06-20 06:16:34,do it,False,5,"just give it a shot. seriously. if you have trouble sleeping, you won’t regret it.",lgnbrnhncck,breethe-meditation-sleep,920161006,
2020-06-04 10:41:10,Nothing new here,False,1,"If you’re looking for the exact same meditation recordings as Aura, pay for this!",TNBrizz,breethe-meditation-sleep,920161006,"{'id': 16023143, 'body': ""Hi TNBrizz,\nWe're sorry to hear that this is how you feel. I assure you that all of the meditations available on Breethe are 100% unique and you won't find them anywhere else. I invite you to check it out and give it one more go! Please keep in mind that there literally thousands of content pieces on Breethe so we're sure that you'll find something for yourself. If you need another free trial to check it out - drop us a line at support@breethe.com and we'll be happy to help you out!"", 'modified': '2020-06-16T14:05:39Z'}"
2020-01-09 09:41:44,Very difficult to cancel during the two week fee trial!!,False,1,Be careful. Spent two hours trying to cancel “free service”,Bbb330,breethe-meditation-sleep,920161006,"{'id': 12836291, 'body': ""Hi Bbb330, We're sorry that you had trouble cancelling the two-week free trial via Apple. Like other subscriptions, you can find it in the App Store > Subscription section. Then you tap the app in the list and choose cancel at the bottom. If it is telling you about resubscribing, it means you already cancelled. For anything else, you can reach us at support@breethe.com."", 'modified': '2020-01-10T06:01:42Z'}"
2020-01-09 07:52:36,Breathe,False,1,I have been trying to cancel this app for one week. I looked at it on a trial  basis and find it does not appeal to me or my life. They ignore my request for cancellation.  Not ethical!,?&!not this,breethe-meditation-sleep,920161006,"{'id': 12836499, 'body': ""Hi, We're sorry to hear that you did not find the app a good fit for you, and you did not receive our response.  Cancelling your free trial to the premium membership can be easily done by going to the App Store, tapping the profile icon, and then Subscription. You can then find the app in the list and select it and choose cancel at the bottom. If your only option is to resubscribe, it means you have already cancelled. For further assistance, you also call Apple Support who handles billing and inability to cancel for apps subscribed to on Apple iTunes. "", 'modified': '2020-01-10T06:13:08Z'}"
2020-01-01 22:22:12,Great app,False,5,This is a great app it helps me calm down destress and relax,Ryan reviews(lazershow gaming,breethe-meditation-sleep,920161006,
2020-01-04 10:33:28,$90?!,False,2,"I wanted to love this app, but seriously $90 A YEAR for a meditation app?! Uhhh yeah I think I’ll find a cheaper option but thanks",kbdubz<3music,breethe-meditation-sleep,920161006,
2020-08-25 21:51:38,Best app,False,5,love this I can’t believe it free like what 😮😍😍😍😍,AngelieSanti,breethe-meditation-sleep,920161006,
2020-12-30 12:51:29,Refund,False,1,I need a refund I had cancelled this before and they never did and it took money from my account,gay244,breethe-meditation-sleep,920161006,"{'id': 20122471, 'body': ""Hello gay244! Please note that if you made your subscription through Apple, only you (or Apple) can cancel it. Please contact us at support@breethe.com and we'll be happy to check it for you and assist you with a cancellation and a refund. We hope to hear from you soon! 😍"", 'modified': '2021-01-01T18:56:01Z'}"
2020-10-05 02:35:08,Guy won’t shut up,False,1,Downloaded the app and played a beach sound     A creepy guy keeps talking and won’t shut the hell up.  Unsettlingly,ccxxkkllpp,breethe-meditation-sleep,920161006,"{'id': 18306997, 'body': ""Hi ccxxkkllpp, it seems that you may have played a guided meditation or a whispered story instead of the music/sound track (all of our nature sounds and music are without a voiceover). Please drop us a line at support@breethe.com and we'll be happy to help you navigate the app and find the right content. We hope to hear from you soon! 🥰  "", 'modified': '2020-10-06T15:13:27Z'}"
2020-09-18 23:55:19,Great,False,4,A lot of it does cost money but plenty is free it’s great,Lydia slime Bailey,breethe-meditation-sleep,920161006,
2020-02-26 15:21:15,Use,False,5,I love this app it help me fall asleep.,EmeraldPro64,breethe-meditation-sleep,920161006,
2021-01-05 02:46:54,Amazing,False,5,"This is an amazing app it helps me relax it helps me fall asleep. It is amazing!!!!!!!!!!!!!!!!!!
            :)       ;)          ;)","surfer girl @""",breethe-meditation-sleep,920161006,"{'id': 20223307, 'body': ""We're very happy to hear that, surfer girl! ❤️"", 'modified': '2021-01-06T17:59:44Z'}"
2020-07-21 06:43:20,Not free,False,1,"I don’t know how I missed it, but I downloaded the app thinking it was free only to realize there is a monthly membership cost. Deleted app.",WildOne18,breethe-meditation-sleep,920161006,"{'id': 16789807, 'body': ""Hello WildOne18, Breethe actually is a free app and you are absolutely welcome to use the hundreds of free meditations, music tracks etc, we've prepared for you. There are a lot more (thousands) included with the premium membership but the free version will still keep you busy for a while (especially since we rotate the free content regularly, so the free users can experience the premium tracks too). We hope that you decide to download Breethe again and give it another chance! 🥰\nP.S. If you have any questions and/or need any assistance, please contact us at support@breethe.com and we'll be happy to take good care of you."", 'modified': '2020-07-21T20:49:37Z'}"
2020-03-31 02:28:41,Updates,False,1,Absolutely hate the updates. Considering canceling my subscription,hardnerhippy,breethe-meditation-sleep,920161006,"{'id': 14362352, 'body': ""Hi hardnerhippy, We're sad to hear about how you feel about the updates. We'd like to hear your thoughts about it at support@breethe.com so we can provide information if tehre's any confusion and also share your opinion to our team."", 'modified': '2020-03-31T12:32:08Z'}"
2020-04-09 17:24:10,Breethe App,False,5,"Pleasant, reaffirming tool ti continue strengthening meditation and mindfulness disciplines.",margrand1963,breethe-meditation-sleep,920161006,
2020-04-21 06:44:28,dude are you dumb,False,1,ok so literally in their ads someone says it’s so good that they feel asleep in minutes now you can just tell that that they made that cause if you didn’t know you can’t physically tell when you fall asleep so therefore this app is trash cause it writes fake reviews for its self,gayssssddss,breethe-meditation-sleep,920161006,"{'id': 14905669, 'body': ""We're sorry to hear that you feel this way. We can assure you that all of the reviews are 100% genuine and from the actual Breethe users. You're right - it's hard to tell when exactly did you fall asleep. But if it's a difference between a few minutes and a couple of hours - that's noticeable! If you'd like to test it out yourself - please contact us at support@breethe.com and we'll set you up with a free trial so that you can verify our users' opinions first hand!"", 'modified': '2020-04-25T13:50:39Z'}"
2020-04-17 12:43:56,Yay,False,5,Great meditation and I love the time options.,Alex🏳️‍🌈🏳️‍🌈,breethe-meditation-sleep,920161006,
2021-05-06 05:35:58,👎🏻,False,3,"So you have to pay monthly to fall asleep. LOL 
I don’t think so!!!",RayHewitt67,breethe-meditation-sleep,920161006,"{'id': 22687497, 'body': ""Hi RayHewitt67! 🥰 There are many people in the world who have trouble sleeping. Some people pay for pills or other remedies, while some prefer to pay for an app that will help them fall asleep through meditation, bedtime stories, hypnotherapy, soothing sounds of nature etc. The bottom line is - you don't need to pay for it and we sincerely wish that you never experience trouble sleeping. Unfortunately, though, there are those who do and we are proud to say that Breethe has helped many of them over the years! 🧘\u200d♀️😴🧘\u200d♂️ "", 'modified': '2021-05-07T21:35:11Z'}"
2020-01-04 23:45:46,The worst,False,1,It sucked once I watched something it would never let me get back,cookiebog,breethe-meditation-sleep,920161006,"{'id': 14381812, 'body': 'Hi cookiebog, Sorry we missed your comment here and for the trouble you had with the app. We recently updated the app and added a collection of free meditations called Inner Wellness During Coronavirus to help app users deal with the situation. If you would like to give it another try, email us at support@breethe.com and we would be happy to help! ', 'modified': '2020-04-01T07:49:14Z'}"
2021-03-26 21:11:21,Calming,False,5,Wonderful for body mind and soul.,Queen B AZ2,breethe-meditation-sleep,920161006,"{'id': 21934777, 'body': 'Thank you so much, Queen B AZ2! 😍', 'modified': '2021-03-29T21:01:55Z'}"
2021-04-16 01:34:43,Worthless,False,1,I’m Deaf and I thought this tools are awesome until there’s music and audio where there is no subtitle so it’s useless for native signer!,SpikeGonzo,breethe-meditation-sleep,920161006,"{'id': 22336345, 'body': ""We're sorry to hear that, SpikeGonzo! It would be great to hear what suggestions you have for us to make the app more useful for you. Could you, please, drop us a line at support@breethe.com? Thank you in advance! 🥰"", 'modified': '2021-04-19T20:47:35Z'}"
