isEdited,title,date,review,rating,userName,app_name,app_id,developerResponse
False,Why did it do this?🙁,2021-05-12 06:48:16,This app would be good if all the stuff wasn’t locked sure some of the things are useful but the thing is that almost nothing is useful for my sleep because I feel like the app don’t care on the people who need it and can’t afford it like me true to make some of the stuff not locked,2,hrhxjxgxhjxhxxjbxxkxbxkcbckc,calm,571800810,
False,Helped anxiety,2021-03-24 03:55:44,I experienced serious panic attacks and anxiety for the first time in my life during the pandemic. This app helped in a huge way to reduce those feelings. It has been a powerful healing tool for me.,5,sam in the ham,calm,571800810,
False,Very helpful app with lots to offer.,2021-01-30 02:06:16,This app has helped me so much this last year. Grateful for all the different options available to meditate and find calm.,5,Lilprinzessky,calm,571800810,
False,Great content - needs work,2021-03-04 03:44:24,"Awesome content. Sleepstories for our kids is incredible. Even the the white noise options are extremely well made. The issue I have is how awful the app is. Tons of glitches, long load times, and crashes. Really a poorly coded app. Doesn’t matter if I’m on WiFi, cellular, or an iPad Pro. Just a subpar app.",2,VCTechGuy,calm,571800810,
False,To Many Things Locked,2021-02-23 10:33:43,"I downloaded calm because I have sleeping problems, and my doctor thought it was a good idea to get calm. When I went on the sleep tab to help me sleep, almost everything in stories was locked,  everything in soundscape, and  everything in music. So I give this app a two out of five.",2,astridaxe,calm,571800810,
False,Tamara Leavitt the most annoying voice ever,2021-02-16 01:51:44,"I use and like the sleep stories, but the narrator of most of the daily content is always the same person - Tamara Leavitt. I find her voice so annoying I can’t stand to listen. She’s everywhere in the ap, so other people must love her, but for me she’s like nails on a chalkboard. I wish they would vary the narrator.",2,Snowbrdr7,calm,571800810,
False,Not calm,2021-02-13 01:59:22,"I purchased one of their puzzles and they do not make you calm while doing it and I was supposed to get a free 30 day subscription for the app by buying this puzzle, NO FREE SUBSCRIPTION! False advertisement. Will not be buying their puzzles or downloading the app again. Also everything needs the subscription so if you aren’t willing to pay $70 a year don’t buy!",1,amd429,calm,571800810,
False,Love this app!,2021-01-17 05:00:24,"Best money I ever spent to help with anxiety, and insomnia. The sleep stories are wonderful. So relaxing! I’m just learning to meditate and the classes and meditations are spot on. To the developers at Calm-well done and more sleep stories from Chiké please!!",5,Loridoma,calm,571800810,
False,Worst website,2021-01-11 04:54:12,"I am suppose to have a free year of calm, but I don’t have it. Every time I try to listen to anything, it says it is a 7 day trail. I give up!
I am very disappointed.",5,jane cb,calm,571800810,
False,Not a great app at all,2021-01-12 09:31:04,This app doing the 7 days of you deciding if you really want to keep the app does not have much helpful anything on it to help soothe you for sleep. You have to pay a full subscription just to decide if this is an app you want to keep over time. I’d never recommend this app to anyone. It’s almost like a scam.,2,dval23,calm,571800810,
False,paying,2021-01-11 04:46:52,The app is pretty good and so are the episodes but there isn’t much you can listen too unless you pay them.,5,Ana-Clair,calm,571800810,
False,In app purchases,2021-01-02 17:34:54,"So why they are trying to tell us that with in app purchases is really the only way to get calm. I think that is ridiculous, but there commercial is what got us here in the first place. Boo on this we thought this was gonna be a fun thing to use. We were wrong. My anxiety is building but I can’t get it to calm because of in app purchases, oh well it was worth a try.",1,Skinner 304,calm,571800810,
False,Going to sleep fast,2021-05-11 01:22:32,"I don’t have much time, because I have to go to sleep soon. But I can make ☝️ comment. I love that it puts me to sleep very quickly!❤️❤️❤️! Anyway, goodnight😴",5,Aalani the worker,calm,571800810,
False,App randomly starts,2021-06-20 04:11:06,"My calm app has been randomly starting without me opening the app. It starts playing my chosen background noise, and the only way to stop it is my restarting the whole app. It’s happening several times a day, and is honestly getting pretty disruptive. If they fix the bug, I would rate it at 4 stars.",2,analogkid26x12112,calm,571800810,
False,"Great app for sleep, but",2021-04-27 05:17:53,"It basically requires a payment to use. Without paying, you’ll find little to no available options, but it definitely is calming",4,Cherry blossoms 774,calm,571800810,
False,Why do I have to pay?,2021-05-10 04:10:59,So get me this strait I’m all just “ugh I can’t sleep I should get calm”BUT NOPE instead if I want the best sleep I have to pay for the best sleep like really?I want to listen to story’s and such but then I can just listen to calm music so is this helpful to me?no only people that are willing to use their money one this app will actually like this but still it’s just-why would you do this,1,Dis dued,calm,571800810,
False,Life changing,2021-04-08 00:19:10,I was never one to believe in this sort of stuff. I struggle with anxiety and the exercises on this app have helped me so much! Everyone should be using this every day!,5,yuuuggtyg,calm,571800810,
False,Free the app,2021-04-14 03:47:56,"Mental health issue apps should be free. I love this app, but you shouldn’t have to spend so much money for the experience. I feel like so many people aren’t getting the help and meditation they need because of how much it costs.",4,Bdubski88,calm,571800810,
False,Where I go to find balance,2021-04-06 10:49:11,"Love everything about the app. It’s my one stop shop to recenter and find my balance. Meditation, stories, music , and so much more...",5,jms-87,calm,571800810,
False,Great calming music,2021-03-30 02:06:03,"Will
Definitely recommend to all people even if you go to sleep easily. The music is calming and I always learn something new listening to Alan Sklar. Sorry If I spelled
It wrong.",5,A google User...,calm,571800810,
False,Amazing,2021-03-08 00:46:30,This app is the best thing two relax me so far out of the many many times I’ve tried to calm down if I was you I would 100% get it,5,dciptrain,calm,571800810,
False,Every time I can’t sleep i just put this on.,2021-02-16 20:36:21,My favorites are probably the sleep stories. Every time I put one on I never get to hear the end!,5,HP lovr,calm,571800810,
False,Disappointed,2021-02-22 09:13:33,This app used to be great they had at least some “free content” but that’s no longer the case.      Even the free content is locked now! They just want you to shell out money. They do have nice content though. It would have been nice if not everything was locked.,2,henna0392,calm,571800810,
False,App still not opening,2021-02-13 03:34:12,It takes a while for the app to open.  I waited for 5 minutes and nothing.,5,Pauloietrooo,calm,571800810,"{'id': 21407237, 'body': 'So sorry for the trouble you\'ve experienced! Please try leaving the app open on the loading screen, as this should allow the app to fully load. Upon subsequent app launches, the app should then load normally without any delay on the ""take a deep breath"" screen. If you are experiencing issues on an older version of the iOS app, please update to the latest version, then follow the steps above if you experience any loading issues.', 'modified': '2021-03-02T20:34:33Z'}"
False,The best app ever!!,2021-01-27 02:53:09,I cannot give this app enough praise.  I am a faithful user who has found it to be tremendously helpful on so many levels.  This is a great investment and I wholeheartedly recommend it!,5,MAD81574,calm,571800810,
False,Feedback,2021-01-24 05:00:48,I use to love this app it use to help me fall asleep but when I went to go use again everything was locked and I to pay premium I wish it was for free I rather have an app after very mediation than having everything locked.,3,Teenage Green Day,calm,571800810,
False,Needs variety of meditation guides,2021-01-05 11:52:39,"I love the app and use it almost daily.
I would really like to use the meditation features but they all have the same guide, Tamara something, and I *cannot* stand her voice.
Such a shame that all this meditation content was made with only one guide.",3,Marie_88_C,calm,571800810,
False,Great content. Needs work on glitches.,2021-06-26 18:27:41,"Love the content of the app, but I have a lot issues with the app kicking me out of my account and telling me it doesn’t have internet connection when all other apps work and have full bars.",3,pitpat47,calm,571800810,
False,The sleep stories alone are AMAZING,2021-05-12 11:36:42,I’ve never slept better. The sleep stories help me clear my brain and I usually drift off before it even ends. Highly recommend!!,5,helloimkim design,calm,571800810,
False,It is great,2021-04-15 01:01:51,Calm has helped me so much fall asleep and have less anxiety and I have a rush stress around my family and friends it helps me so much calm myself down when I’m angry sad or mad,5,Boop!!??,calm,571800810,
False,Fresh material,2021-05-09 19:56:46,"I really do love Calm, BUT I have now been a member for a few years and I am getting to know some of the daily meditation recordings pretty well. They are good, so not bad to listen to repetitively. But at the same time, I wish there was more new material. Same for the night sleep music.",3,*Dragonfy*,calm,571800810,
False,Forced to pay,2021-05-07 02:55:14,"You used to be able to have a free option in every category. I had to search for five minutes until I found one free option. Absolutely ridiculous that you force everyone to subscribe.  You could offer 10% of the recording and ask people to pay after that free snipit. 

Go download another app. Seriously",1,Jonest0818,calm,571800810,
False,Gratitude,2021-03-27 09:45:26,"I live alone, I enjoy all of that calm allows me to try. I take advantage of them all. I can’t afford to at to listen, I listen to the ones available to listen to.",5,sexxygranny,calm,571800810,
False,♥️ everything about this app!,2021-03-22 03:39:27,"The remixes, the daily calm, are so great in this hectic world and unusual time in history. I’m not a person who has a lot of problems with stress but it’s such an oasis!",5,AndreaAL,calm,571800810,
False,Don’t get this app,2021-03-25 05:30:44,I would give this app 0 stars but I can’t 🙄 this whole thing is stupid anyways. I had gotten an ad about this app and I have trouble sleeping and also have anxiety so I thought this would be a good app for me but turns out ITS A COMPLETE SCAM you have to pay for everything and I’m broke so guess how that turned out. Just don’t get this it’s a waste of time.,1,the_baker08,calm,571800810,
False,Calm meditation app,2021-03-08 11:20:54,"Each day the Calm app is my first item on my daily routine because it Inspires me to meet the challenges of the day. Even though I am retired and relatively healthy, there are challenges.",5,Bill of Annapolis,calm,571800810,
False,Changes,2021-03-06 21:59:20,"Why am I being asked to sign in each time? I miss clicking, making notes without the hassle. Just saying.",5,New Mountain Girl,calm,571800810,
False,Love❤️Calm app,2021-02-17 03:57:36,"Have purchase the Calm app 2yrs ago and absolutely love everything they have on this app. The music, meditation on emergency anxiety relief, and more.. yes I recommend you download Calm it’s worth the price you pay.",5,bookned76,calm,571800810,
False,Worth the investment,2021-01-19 04:37:33,Amazing app I can use anywhere! It’s always with me and can be used at a moments notice.  I was hesitant about purchasing and now I don’t have any regrets doing so.,5,Mando0510,calm,571800810,
False,I give it. 3/5,2021-01-19 07:01:19,It’s ok it’s just everything you have to have premium or it has to be unlocked and it just like it very hard for me to find free stop because most of the are locked but overall it’s good and I like how you can change the narrator’s but yea it’s ok,3,miyah シ,calm,571800810,
False,"Great sleep stories, always fall asleep",2021-01-11 04:04:05,I rly like the men narrated stories especially Stephen Lyons he has such a calming and soothing voice almost like a grandpa reading from childhood always puts me to sleep,5,kokoraven,calm,571800810,
False,Grateful,2021-06-12 01:16:03,"I tried the Calm app over a year ago and love it so much that I continued my subscription. It is so worth it.
I learned many ways to meditate with Jeff Warren in 30 days! 
Tamara Levitt is so inspirational with her calming voice.
The “Sleep Stories” helps you fall asleep! There are many ways to use Calm and at my convenience.
I use this app every day!!!
Thank you to all the wonderful beings at Calm for your contribution in making lives better! XO",5,NatureBeing,calm,571800810,
False,Great if you want to go to bed and you can’t,2021-06-06 11:31:13,Just listen to one of the story’s or a song after buying the subscription,5,LJWheels26,calm,571800810,
False,Legitimately Helpful,2021-04-20 12:33:44,"Tamara Levite’s meditations are always truly useful to me. She doesn’t talk too much, and what she does say really helps a newbie understand the point and practice of meditation. This has helped me immensely.",5,moyerml,calm,571800810,
False,I gave 1 star because only way to write review!,2021-04-30 02:32:30,"I wanted to try something to help my sleep performance with a so called free app, but to use it I need to send email, phone number and or more things that stress me out, things I have to do during my job all day long, my opinion, if it's free trial or what ever you say, make it free,(stress free), at least for the first time use!!!!! Thanks for nothing!!",1,BOBBYVMAN,calm,571800810,
False,Love this app!,2021-03-24 08:06:02,The first story I listened to really put me to sleep. I feel like I should’ve started using this app a long time ago. I’m confident and positive that this app will help me in the long run.,5,Dynasty108,calm,571800810,
False,Love the calm app,2021-03-19 06:03:59,Ever since I started using calm it has made me feel better I recommend this app especially when you need a moment to meditate🧘🏾‍♂️,5,Mikesmooth89,calm,571800810,
False,Sleep Storiee,2021-03-08 13:53:58,I have to say that I never thought of bedtime stories as something that would put me to sleep but these stories work magic on me! I am sold!,5,ClaudiaFJSac,calm,571800810,
False,Affiliated with Disney?,2021-02-14 15:42:08,"Is Calm affiliated with Disney? If so, I’ll be cancelling my Calm app. Disney is engaging in activities to quell free speech and force employees to step in line with their philosophies. I see Disney music on your app and I enjoy it, but I enjoy American freedom more.",5,Disney/Calm?,calm,571800810,
False,Great stuff,2021-02-13 14:13:08,I’ve been having trouble sleeping and so has my child.  We put on sleep meditation and we both were out of it.,5,Big Dog who sat,calm,571800810,
False,Powerful,2021-02-05 14:41:37,I have used the Calm app and daily meditation throughout the Pandemic. I am grateful for this resource. I have grown a great deal during this time. The app is easy to use and I enjoy the narration. Thanks Calm,5,Enzo_Paroline,calm,571800810,
False,Transforming,2021-01-09 11:56:41,I use this app every morning to start my day. The sessions help to guide me with a new perspective on my busy schedule. I have even incorporated the sessions on Nearpod to use with my students💕,5,awesomeprince888,calm,571800810,
False,Needs more options,2021-01-13 04:09:23,"It helps me sleep a lot except I would really like some more ASMR. Also it would be nice if  they added another Bella and the bedtime blanket or something like that, my children really like it",4,qwerty1635482,calm,571800810,
False,"Daily meditation,Tamara,Jeff",2021-06-12 21:56:16,"Daily meditation, several times a day has changed my life and improved my coping skills. So much improvement with depression. I am so grateful. Thank you",5,nice2bcalm,calm,571800810,
False,Good,2021-06-29 09:01:58,"Although this is a big game changer. It does annoy me and probably other people, on how you need the premium version to have most of the items. Other than that one downfall very useful app.",4,BamBamRocke24,calm,571800810,
False,Thankful,2021-05-25 16:18:49,Usually 5 star descriptions are about how great the app is. Which it is! However I just want to thank you for creating this app. I am beyond thankful! As this app has brought me peace.,5,alexxxalwxalwx,calm,571800810,
False,I love this app,2021-05-16 06:03:04,I love this app it helps me fall asleep and I usually can’t fall asleep till 3 am or something but this app makes me fall asleep in an hour tops and that’s great for me (I know I sound like an ad),5,lovely name but bugs,calm,571800810,
False,Great with helping me manage anxiety,2021-05-15 23:16:54,"I signed up to learn how to meditate, but I actually found it helpful in dealing with the anxiety I experience from time to time. I am very great full I signed up.",5,S. Myles,calm,571800810,
False,The best meditation app ever!!,2021-03-07 22:07:26,I was a beginner with meditation and mindfulness and this app helped my depression and anxiety diminish. I listen to the white noise to help my sleep issues and it helps greatly. Bottom line this app is worth it.,5,Gleeghostgirl,calm,571800810,
False,Worst app ever,2021-03-27 07:13:22,I have had many apps that allow help but this app won’t allow you to listen to anything without spending a single dollar. I’m all about contributing but this app is not worth the download because every single thing will cost you. Better off just going on imusic and just listening to soothing sounds. It’s FREE. If I could give 0 stars I would.,1,naldo.ortiz,calm,571800810,
False,Great for relaxation,2021-02-14 16:01:56,Calm has helped me become more aware of life. I feel more awake and present. Convenient to listen to it while going for a walk or driving.,5,Santafashionista,calm,571800810,
False,The Voice🤦🏻‍♀️,2021-02-28 18:47:41,"This app is overall pretty decent. Soundscapes are relaxing. Stories are great for relaxing. BUT and this is huge. I just can’t take Tamara’s voice.  It’s unfortunate and maybe just a personal problem for me but I wish you could choose another voice. So while the app has benefits and nice features, this is a big problem for me",1,Dunwithis,calm,571800810,
False,Eyes wide open,2021-02-01 11:51:25,I started this this morning and it was a very interesting way of meditation. I will continue to do it more often. I truly enjoyed this meditation.,5,Miltenhar,calm,571800810,
False,Make daily calms free,2021-01-17 18:38:32,Love the app but it is obvious that they want you to pay. Understandable but the daily calms are free on my Apple Watch but not my phone? It doesn’t make sense. Everything else makes sense to pay but the disconnect between what is free on certain devices is weird.,3,Bdl2001,calm,571800810,
False,Really great app,2021-06-27 06:02:34,Really great app! Love the different sounds you can choose through meditations. I’ve recently tried other apps and nothing compares.,5,MattBinTX,calm,571800810,
False,Sleep ahead,2021-06-13 11:04:58,Calm provides me with diverse stories from around the globe to soften all “busy” thoughts and gets me to sleep well ahead of the end of the stories. The voices of the narrators are the best.,5,Austria light,calm,571800810,
False,Life altering,2021-05-22 04:03:39,"This app has truly saved my sanity.  Now only just only if we could get some MORE Mathew McConaughey, would this then be the all the time PERFECT app. Please bring us more Mathew!",5,GooliaTeach4,calm,571800810,
False,Crickets in Cranberry Bogs,2021-04-03 05:01:00,"I grew up on a Cranberry Bog located in Manitowish Waters
Summer evenings were usually so hot that windows were left wide open to catch any breezes to cool me and the crickets to serenade me to a peaceful sleep just as when I was young child.",5,Bog Babby,calm,571800810,
False,Paying!?,2021-05-02 06:32:00,You have to pay which I didn’t pay attention to but you have to pay I got to listen to one book and it made me really relaxed I almost feel asleep so if you don’t mind paying then I would get this app!!,3,jossie fan,calm,571800810,
False,Cricket Explained,2021-05-21 07:32:55,"I have listened to this almost every night for months, and have only gotten to the end twice.  It is truly soporific.",5,Dowserjaney,calm,571800810,
False,Wonderful way to end my day,2021-05-20 05:52:37,"I like to do Jeff Warren’s The Daily Trip before bedtime. I love his casual, easy to understand guidance. Following this routine helps me to end my day with a relaxed, positive feeling.",5,JoyfulinLA,calm,571800810,
False,Calm is inspirational,2021-05-09 12:54:56,This app teaches you meditation skills in a way that everyone can understand. The lessons are incredible and the content in the app is so useful for everyday life.,5,Huskadore,calm,571800810,
False,Calm Awesome,2021-03-25 15:00:24,Calm is one of the best apps I have ever gotten the first time I heard what amazing music was on it was on my moms phone. And I was like I need to have this app. This app is so good in so many different ways!!😍,5,Lilly123$$,calm,571800810,
False,Sleep stories,2021-04-19 03:58:23,"The Sleep Stories are good but male voices are easier to listen to. Many of the stories are very long, around 40 min. I prefer the shorter ones, around 20 minutes but very few of those.

I don’t use any of the meditation or music.",3,zcreaquip,calm,571800810,
False,Poor Looping,2021-03-30 03:38:03,"I enjoy the various soundscapes to sleep to. Unfortunately, when the track loops, sound cuts out with a hard stop-restart which can jolt me out of my very light sleeping. This isn’t a problem when using my Apple home pod’s built in soundscapes, which are more limited but perfectly executed.",2,CraigL603,calm,571800810,
False,My pocket of peace,2021-03-23 12:40:34,The Calm app has changed my life. The practical and gentle teachings have strengthened my meditation practice more than I could have ever imagined. It’s my little pocket of peace each day. I am grateful.,5,55Dash,calm,571800810,
False,Sleep stories are great!,2021-03-22 14:59:57,"Started with the sleepstories and, so far, I have not gotten through ANY of them.  My sleep quality is better, too!",5,Marygflute,calm,571800810,
False,Thankful for this app,2021-03-15 17:54:36,I am so happy to have made the choice to download this app. It is and will continue to be apart of my daily life as it has already brought me a sense of peace and calm.,5,Lue.101,calm,571800810,
False,Life changing,2021-03-12 12:45:17,Calm has been life changing for me. I have anxiety and trouble sleeping. Meditating with Calm has helped me in so many ways. I am more thoughtful and gentle with myself. I am so grateful for this app.,5,❤️🙌🏼🙏🏼💕,calm,571800810,
False,Beachgymnast,2021-02-09 12:02:53,The app calm has helped me fall asleep. The meditations are very soothing and I think that if your goal is to relive stress then you should  definitely should try out this app!,5,Beachgymnast,calm,571800810,
False,Uhh good app but,2021-02-04 01:00:35,So I got calm but I didn’t use it because you have to pay for almost everything so please change it now,5,lego. harry potter lover 12,calm,571800810,
False,Daily mindfulness,2021-01-30 02:48:03,Glad I decided to try Calm. One of the best purchases for keeping me centered and relaxed. I have depression and anxiety that I deal with every day. This app is a blessing for me. Thank you so much.,5,Moondaiz,calm,571800810,
False,Bringing peace to chaos,2021-01-28 17:03:15,"I love how I can squeeze some calm into every day, in my car, in the kitchen, In front of my computer.  It has transformed how quickly I can let go of the stress.  Love it!!",5,MamaOfMonkeys,calm,571800810,
False,Sleep stories,2021-01-22 15:08:41,I absolutely love these stories!  If I fall asleep (which happens most of the time) I keep listening other times. Their fascinating!,5,jej2019,calm,571800810,
False,Calm,2021-01-18 19:27:49,Been using this app for over two years now...I absolutely love it. Every year I treat myself to a years subscription...best thing I do for myself!,5,suzybot,calm,571800810,
False,Umm great but on issue😬,2021-06-17 05:33:24,Ok so I thought this was a great app cause I was looking for hippo therapy to sleep so I found this I think it is a good app but when I did it it said try premium but I am ten and broke so I can barely do any thing and I am so annoyed but other than that it is a great idea,3,cheese 09422010,calm,571800810,
False,Language,2021-06-06 19:03:01,Always the message needed at the right time. Love Tamara Levitt's daily calm. Also grateful for categories of focus that include tools for stress and anxiety. Special shout out to Kaiser for providing this to all members.,5,thatskriswithak,calm,571800810,
False,Best sleep ever,2021-04-11 13:43:19,"I look forward to picking out a sleep story at night. Even more so, I look forward to not having any idea how the story ends.",5,Mrs Joe T,calm,571800810,
