isEdited,title,date,review,rating,userName,app_name,app_id,developerResponse
False,I am a teenager,2021-06-16 20:42:58,I am a teenager who would go to sleep after staring at the ceiling for about 30-45 minutes. I heard from somebody that I look up to that meditation was really good for you and that it helped her. Well for me I no longer just lay looking at the ceiling for more than half an hour. I did the sleep meditations and they really helped me and those are what I started with which is probably not how you’re “supposed” to do it but there is no wrong or right way. I then got a little tired of the sleep meditations because I’d done them so much so then I used the soundscapes. I put a soundscape on every night before I go to sleep. I love them and love the fact that there is a sleep timer so that I can set a timer for like an hour which is well over the amount of time it takes me to fall asleep now but it’s nice to fall asleep to the sound and not have to worry about turning it off. I am also all about a healthy mindset and self care haha. So I did so many of the meditations on the little self care area (Which I love that they have that). I just recently started the “how to meditate” just to further understand what I’ve been doing. I love it so far. I 1000% recommend this app for sleep problems or even if you’re bored in the summer and want to learn how to do something beneficial and something that could definitely help you in the long run. This was kinda a whole story but whatever hahaha. Anyways yea totally recommend this app!!!,5,#Princess 👑,calm,571800810,
False,"App is in accessible for blind user, buttons unlabeled",2021-04-29 00:01:18,"Hello, I really like the content on your app and it has really helped me to develop my practice. However because of the issues described in the title I probably will no longer subscribe to calm next year. I am blind, and use the screen reader voiceover. I can play the videos for the content well enough with play pause, fastforward but the biggest barrier I am facing is that the mountains which you tap on in the for you tab  to bring up the settings are unlabeled. I was trying to turn off the babbling Brook sound, accessible apps need to have text labels to accompany any clickable items. I would love to resubscribe once you have resolved these issues, buttons for the mood check-in feature are also unlabeled or nonexistent. The box breathing technique does not speak anything aloud or refresh on its own. A better way to accomplish that might be to use a metronome with 44 times signature. I am happy to speak to a developer more about my feedback and suggestions for how to resolve these issues, but I think that especially since healthcare providers are starting to recommend your service to their users, many of them who use Medicaid and Medicare and are disabled the app absolutely should be more accessible. Thank you for your timely consideration and namaste. I look forward to working with you in making the meditation community more inclusive.",2,Apelli0727,calm,571800810,
False,My doctor recommended it to me and I love it,2021-02-06 05:53:07,"I’ve always struggled with anxiety and not being able to calm down. All of the features which this app has to offer really help me when I’m studying (I like having soundscapes or music on), relaxing (breathing exercises or meditation), and getting ready for bed (sleep stories and body scans). It is so worth it to pay for the subscription, and even before I paid for the subscription (my doctor recommended the app to me not knowing I had the free version of it for about 3 years already) there was a lot of content available. I love the calendar features as well, and the check-ins are a great way for me to reflect on my day and practice gratitude. 

One suggestion I have though are podcasts! I like to listen to people talking about any subject while I’m doing tasks around the house or just trying to sleep (sometimes the silence is a lot and I can’t focus on sleeping with my thoughts). If you guys made some soft spoken or any kind of podcast in which there wasn’t a lot of yelling and loud talking, I’d totally listen in. (I know there are some masterclasses and lesson type things available on the app already, but they’re just not podcasts)",5,Hobokittycat,calm,571800810,
False,My opinion about the calm app.,2021-03-24 04:42:49,"Dear-Publisher,I have had this app for year and I love it so much, it helps me a lot but I deleted the app and downloaded it back and I’m glad I did. I know you may not have the some opinion as me but I think this app is outstanding. If the creator or person that published this app sees this, I just wanna tell how thankful I am that you made this all because it helps a lot. I know that some of the stories cost money but it’s still worth downloading the app. I recommend listening to “sleep paws” and “the secret lagoon” they are both amazing bedtime stories for all ages! There is no age policy for this app if you ask me I just think that there is only one thing that could make the app better which is making the stories a lower price or just making it cost 0 dollars itself because some of the stories look very interesting but I cannot read them because I have to do a trial and that’s the reason why umm giving this app 4 starts! So if the person who published this app sees this review I just wanna say thanks for making my life so much more easier but please Mack some of the stories more reasonable of price because I have read all of the stories which are the ones that don’t cost money.",4,nehdhdhennej,calm,571800810,
False,Love the app just one recommendation!,2021-05-01 16:02:25,"There’s so much to this app there’s bed time stories, breathing exercises, music, sessions to help relax, meditate, and help u sleep, there’s also (one of my favorites) where u can have a calming background when on or off your phone, they have quotes to help motivate you, there’s daily check in’s you can do, you can set timers and reminders for things and so much more! There is a free app trial but you do have to pay after the trial ends but I think in my opinion it’s worth buying the app! My one recommendation though is that I think the calm app should add some more journaling to the app something more than the check ins because I think journaling is a great way to help you feel your releasing your past or just writing how happy you are if that makes sense plus if it’s not to much maybe add something to remind you to get off your phone and go outside or do some focusing hour on school work or something like that. Overall the calm app is a great app and I totally recommend if you have anxiety, or are having trouble sleeping! 
-if your reading this have a good day/night/rest of your day/night!",5,DanceMomHolly,calm,571800810,
False,Great App-Needs a few little tweaks,2021-05-10 06:19:36,"Calm has great stories, meditations and more. I love it and have the full version. I love Anna Acton, Eric Braa, and other soothing voices. Some of them, however, are just a bit...jarring. I know everyone has different tastes but I like to listen to voices directing me during meditation or towards sleep that don’t jump out at me. Please, Calm, add more voices like Eduardo Ballerini, Ramon Tikaram, Chiké Okonkwo, May Charters and Jerome Flynn. Cillian Murphy is a great guest sleep story teller but please don’t just use celebrities because of name value. They don’t all make good storytellers/meditation guides. Some write the stories and I am grateful to those who come up with such wonderful sleep stories for adults. The ones that travel back in time, especially aboard old trains are outstanding! Just curate the voices a little better because some of us are too sensitive to the nuances of voice to listen to many of the meditations/stories. That’s kind of a waste. I end up listening to the same ones over and over. Please make the sleep stories at least 35 minutes, too. For those of us who need longer to drift away. Thanks so much!",5,JoyfulBookDragon,calm,571800810,
False,I don’t feel alone,2021-01-20 03:30:19,"During this time of isolation due to the pandemic, my daughter suggested I download this app. She’s been using it for a while and has premium. I downloaded it and I’m using the free service for now. This usually is not my “cup of tea“ and thought I would just try it. I have had a lot of anxiety and feel isolated and alone. I signed up and they have a very nice welcome letter. I tried one of the meditations and it is current with the times, it’s very relatable and because of that it has helped a lot. When I received the second long letter which I’m sure is a form letter but very well done, it has made me feel as if I am part of a community and a family which I do not have. Thank you from the bottom my heart for this wonderful app. There are plenty of meditations to choose from when you are first starting out and don’t understand the reviews about not having free meditations. This is a great stepping stone for someone who is new to meditation and I for one am very grateful. Great app. The meditations really are working for me and I recommend this to anyone who needs a little calm in their life.",5,Lynne11,calm,571800810,
False,Awesome app!! Few Suggestions,2021-05-19 00:53:11,"I absolutely love your app! To the calm creators, I think they worked hard on this app..but there are some suggestions. For example, I know that these things and apps cost a lot to make..but please don’t squeeze the person who doesn’t want to buy or doesn’t have the money to buy supreme,(to listen to everything/everyone) it really isn’t that nice. People who need to relieve stress or anxiety or listen to the voices/stories they want to. I personally think there is quite a lot of things to listen on calm..for free. But not even close to premium. But just remember, I love your app, and a lot of people do too!! But just please raise the stories for the people who can’t pay..especially animal ones!! (Those are my favorite). I’m just giving some helpful feedback on your app..hope you use this advice and put it in an update! But if you don’t and don’t take a lot of the viewers advice or mine..some people might start deleting your app. Sincerely from a Calm User to the Calm Creators.",5,OceanLoverCalm,calm,571800810,
False,Helpful beyond description,2021-01-20 20:52:18,"I am very reluctant to use this type of apps. However, this one always called my attention and during my last insomnia crisis I decided to explore. Oh my God, this app is not just a help to sleep better but to Live better! It has been about 10 days since I started and I am in love with it. I am 58 y.o. Venezuelan Female, Medical Doctor, married to a Wonderful Woman - my Soul Mate- living in a foreign country. She is deep into meditation and I feel so behind but I met Jeff and he has  introduced me to meditation in such an easy and accessible way. I have attempted for many many year with others but I always fell asleep. Besides and like now, I am at work and have some boring stuff to do. I just have to look for some new music on the app to switch my mood and be able to “keep walking”. So, Thanks Jeff! and thanks the lady with the sweet voice- can’t remember her name!- and thanks to all the talented people that make possible this unbelievable tool. My year subscription is really worthy to be paid!",5,Venzuelan55yearOld,calm,571800810,
False,Great app! Would love to see a mood tracker added,2021-03-24 10:18:27,"This app is great! I love that I can customize the background picture and sounds. The background and sounds can still be present during the meditation if you set the settings to allow it. Otherwise, you could set the background sounds to silent during meditations. I love the daily calm and various meditations and sound scapes! I really appreciate that I can even set the length of calm sessions or body scans to fit my work day. The one thing I would add to make this app perfect is a mood tracker! They do have one but it doesn’t give good statistical data. I like to keep track of my mood and compare it weekly, monthly, and yearly. Having a line graph of sorts would help me track my mood better for my mental health goals. The lack of this one feature is why I still have a mood journal app that I keep forgetting to use. If the mood tracker in Calm was better at displaying patterns then I would just use this app for all my mindfulness, gratitude, reflection, and mood tracking. I really would like to see that feature added!",4,Smolliver,calm,571800810,
False,EXPENSIVE- AND WORTH EVERY PENNY,2021-05-09 10:08:53,"I’ve bought and listened to at least twenty of these “SleepyTime Apps” and I’ve learned a few things. Most of them are pretty cheeseball. Looping, cheap sound recordings that sound like they were recorded by your father’s cassette tape recorder from Sears, circa 1976. If those are the Chevrolets of the industry this is the Cadillac that they are ALL trying to rip off. I could go on about sound quality or originality but the real thing that sets CALM apart is that they never stop making themselves better, hiring more and more celebrity pros to come in and create their own new sleep songs, narrate their own bedtime stories. What makes CALM different is that they take most of that extra money you pay for their service and immediately re-invest it in the app, snowballing it, making it better every day. The CALM app that I will have a month from now will be better than the one I enjoy today. And they’ve kept this simple formula for as long as they’ve been in business. It works.",5,Dogman7x,calm,571800810,
False,Found my center and my sleep,2021-01-06 20:42:57,"First let me say that while some reviews have requested more diverse voices for the daily meditations, In my case, I wish Tamara’s voice was used for everything including sleep stories as it’s the perfect formula to center me. I don’t know what it is, but her sleep stories put me to sleep in seconds.

I could write a lengthy review, but to summarize, this app brings me to center when I use it every time. I am someone who is always analyzing everything, wakes up in the middle of the night stressed about work or bills or family things, and misses the quiet within myself. I generally have difficulty sleeping through the night. But when I commit to mediations and sleep stories, it completely does the trick. It’s unbelievable, and I was a disbeliever before a friend recommended meditation with a different app which led me to Calm. It has so many tools to calm and center me so that I can sleep, be more effective at work, be happier in relationships, and be at peace within myself.",5,Maarum,calm,571800810,
False,100% YES!!,2021-01-08 04:51:57,"So, I have had a difficult time sleeping ALL👏 MY👏 LIFE! When I decided to try Calm, I was a bit skeptical because I had tried so many different apps, skills, and techniques in the past, and NOTHING worked. I was still up for HOURS at a time each and every night, and waking up with 5-6 hours of sleep each and every morning. When I downloaded Calm, I did not have the membership. I was a bit disappointed with how little I could do, and how expensive the membership was. But the investment was worth it! The sleep stories and meditations have me asleep in 30 minutes TOPS (with the help of some anti-anxiety and sleep pills). I also have depression and anxiety, and the guided meditations are amazing! Every morning, I stretch with the guided stretches, and I do the Daily Calm and check-ins each day. No matter how dedicated to mindfulness and meditation you would like to be, this app is worth your time and money. I feel so much happier and more well-rested. I give an 11/10!",5,Alexa Pascal,calm,571800810,
False,Great but missing some features,2021-01-06 05:19:49,"I like the app and have had it for a week so far and the layout is easy to navigate. The only downside is that you can’t put anything in your queue to play. For instance if you do a 15 minute mediation and want sleep sounds to play during the night, you have to go back in your phone after meditation to choose the sleep sound and manually start it. It seems counter productive to me to have to go back into your phone after a sleep meditation to play sleep sounds. If this app would allow users to put things in a queue to play more than one meditation without having to break the practice or to play a sleep sound after meditation without breaking practice by allowing users to use a queue, it would be perfect. Especially since we’re paying so much for this app and it’s not necessarily cheap. Otherwise has
great features and numerous different options for a tranquil experience",5,Samlovesiphone,calm,571800810,
False,So disappointed lately,2021-04-02 14:07:37,"This app was fabulous originally, but they have “improved” some functions so they are not easy to use any more.  For example, we listen to the same Eric Braa episodes every night, but now they have moved them out of the instant display of my faves and buried them so I have to search for them in the middle of the night.  They no longer have new Eric Braa episodes and his voice is so soothing.  The recently used episodes should appear near the top of the category list so we can find them easily, not on the home page!  Give us a way to make our own category(s). Give us a way to remove all the children’s stories from the adult content.  Give us a way to totally delete content that is a trigger for us.  And finally, in the middle of the night, a dialog sometimes pops up that I have to put my glasses on to read so I can dismiss it!  That should NEVER happen.  I wish someone would listen.  I used to give feedback on each new story, but it never did any good so I stopped.  I don’t feel they listen anymore and I’m disappointed.",3,tanglepuffs,calm,571800810,
False,Charging me premium twice despite requests to stop,2021-01-25 05:22:50,"My toddler likes the Thomas the tank meditations. I got the premium subscription for $70 a year out of desperation to get my kiddo to sleep. Apparently I was pretty sleep deprived myself because I bought it twice, as explained by the company representative. One under the App Store and one online with an email. When I asked if she could stop one of them, she ghosted me. I still can’t seem to cancel one of them, and the other had been paid for the year anyway. It was one day until the free trial ended, and the rep refused to help me. Regardless of the content, which I don’t personally find helpful, I think ethically the company should not take advantage of people like that. I’ve led groups on mindfulness meditation for years as a therapist, and I think this content is just okay. Search for mindfulness meditations and lots of free videos will pop up. Or try reading or listening to real mindfulness like jon kabat-zin. Glad some people find this app useful, but I wish I’d never signed up. Paying for two premium subscriptions I barely use (and the one I can’t find auto renews!), feeling duped.",2,mandifa419,calm,571800810,
False,Love Calm - can we have more anthologies please?,2021-04-16 16:27:29,"I’ve had a couple of different doctors recommend Calm and finally decided to try it. I’ve had chronic insomnia since childhood and was very skeptical, so I was pleasantly surprised with the results. The sleep stories are my favorite feature, but I often find that the story ends just as I’m drifting off, so I have to start another one, which completely wakes me up again. The anthologies have been great since they are longer and I’m more likely to be fully asleep when they end. Can we please have more long stories or anthologies?? Or could you develop a feature that allows me to queue several stories so I don’t have to manually start another?? If that feature already exists, please tell me how to find it and use it!! To those who complain about the cost...if you really cared about good sleep and how it benefits your health, you would think $5 a month is a bargain!! That’s what most of us pay for a generic prescription med to help us sleep!",4,Wmm0114,calm,571800810,
False,Calm to the rescue!,2021-02-16 06:06:33,"I don’t know what I’d do without this app. I’m a life long somewhat insomniac that cannot fall asleep unless I have something that “occupies” my brain, so I can turn off all the junk I worry about. These stories are highly entertaining, and very interesting, yet calming at the same time. They’re also educational! I’ve learned many things from around the world that I didn’t know before. Most nights I’m out after 2-5 minutes, but some take longer. If I wake up during the night, I simply start a new story and I’m asleep again. I have my favorite narrators too. I find that male voices with accents other than American (with the exception of Erik Brah and Alan Sklar) really lull me to sleep. I need a deep voice lol. Females with British, Asian, Indian accents are great for me too. There’s also calming nature sounds and spa music. I’ve been using the Calm app for 2 years now and it never disappoints! Now I don’t have to reach for the Xanax anymore!",5,*uckthisapp,calm,571800810,
False,"Fewer Intrusive Pop-Ups, Please",2021-02-15 11:52:29,"I have the paid version, and particularly like the sleep stories. They work so well, I usually fall asleep before the story ends. Problem is, I might wake up again a few hours later and want to pick up the story where I left off. But instead, I see the “Still Awake?” pop-up window suggesting other stories I might try, or maybe a meditation, and a pop-up asking if I’d like to rate that session, keep track of streaks and stats, etc. No, I’d really just like to find the sleep story I was listening to, but it has vanished from my screen. Now I’ve got to sit up in bed, grab my reading glasses, X out of the intrusive pop-ups, and scroll through to re-find the sleep story that was snatched away from me....leaving me not at all calm, but instead, annoyed and anxious, and now unable to fall back to sleep. Can you please provide a way to turn off these very unhelpful “helpful suggestions” and gamification features? For me, they are defeating the entire purpose of this app, to CALMLY fall asleep.",3,GloriaCue,calm,571800810,
False,Helps with sleep & stress [attn devs],2021-01-28 13:22:39,"This is the best meditation app I’ve tried. I use it 1–2 times a day. Great mix of content and teachers for different moods, goals, and time commitments. While the sleep meditations work for me, I find the sleep stories with celebrity narration too distracting and gimmicky to fall asleep to, but I know others users for whom this is their favorite feature. Calm offers a series of sequential programs for mindfulness skill-building: “7 Days of ______,” where the next day’s content unlocks with the completion of the previous day’s. As a paying user, I wish there were a way to override this. I once exited a minute early, when the wrap-up was nearly over, because I had to leave, and the app made me redo that day to access the next meditation. Similarly, I just updated versions and lost three days’ progress in a program. I think the only way to catch up is to let them play out with the volume off, which is a waste of time and energy.",4,JacquelynNaomiNYC,calm,571800810,
False,Wish I could buy some episodes,2021-03-02 11:22:43,"Has some lovely calming images and sounds, and the unlocked bedtime story to which I listened had a a soothing voice. There many unlocked sessions I would like to hear and wish the owners would at least give a sample of the voice and then allow me to purchase the episode to own it, rather than requiring  a pricey (for me) yearly  subscription, for which the product is forever gone when it runs out. I know subscriptions are becoming the way of the world, but still I resist!  I do believe people should be paid for their work; I’d just like to be able to actually purchase a product; I would rate five stars if they would allow this. 

“Calm” has a nice daily feature (one of the few push notifications I allow on my phone) which reminds me to stay in the moment, breathe, etc.   The app has some generous free offerings and I thank thank the developers for sharing these!",4,Hangingpictures,calm,571800810,
False,thank you Kaiser,2021-01-25 03:44:01,"I get premium content through Kaiser insurance (which has been the best part of their mental health services, but that’s a different review....). 

I am so incredibly grateful for it because I’ve been using it for the past two months and it took me out a depressive episode. 

Jeff Warren’s content keeps me around. It’s because of his 30 day course that I’ve finally established a meditation practice after years of sincere attempts. His approach is very human and relatable; I find sessions with his recordings much more fruitful since he sandwiches the nuggets of clarity between quiet moments. I’m able to ease into the session, instead of being urged into quietness then being lectured by Tamara..maybe that works for other people but it’s inaccessible to me. 

I also use the children’s meditations with my five year old daughter and the sleep stories when she’s having a hard time sleeping. I’m glad to share this experience and skill with her. I was fortunate to have an elementary school teacher show me how powerful meditation and journaling was at an early age, but didn’t have a way to reintroduce it into my adult life AND share it with my daughter till now. 

I used Insight Timer for awhile but was overwhelmed by the features and endless options. I like that this is more curated and it’s lucky Jeff Warren’s content is so appealing to me.",5,shnazzyyabbii,calm,571800810,
