isEdited,title,date,review,rating,userName,app_name,app_id,developerResponse
False,Just trying to steal your money,2021-06-23 20:35:05,Hello I am currently nine years old right now and this is just a waste of time and I do not like it for starters everything wants you to buy anything and everything I hate it it’s a waste of time and I would not like to ask my mom for all of this crap but on the bright side it did kind of help me understand meditation more but none of my anxiety has been released at all so please take this in and help me out here by stopping all this money I don’t wanna give you any of my money but I’m just mad at this app I am mad at whoever made this,2,Toca Boca's Glitch,calm,571800810,
False,One Hypnotist for majority of Sleep ones,2021-06-22 05:16:09,"I use Guided Meditations almost exclusively for sleep. All but a few of Calm’s offerings of sleep meditations are with one hypnotist, whose voice is grating to me. It may as well be nails on a chalkboard when I hear her voice. I had the premium subscription but will be canceling it. After 2 years of it, I hoped they would expand their offerings but it hasn’t happened and doesn’t look like they’re changing that anytime soon. Switched over to the Slumber app instead and much happier with that one. So far, they add guided meditations weekly.",2,D9101350,calm,571800810,
False,Best App,2021-04-08 14:35:00,Literally has in my opinion saved me!Even though this sounds ridiculous I overdosed on marijuana on April 2020 and since then I have found meditation because what happened was it threw me into panic and anxiety attacks. And before I had a diagnosis from a doctor I found meditation and have been doing it since and it has saved my life I’ve been a blessing in every sense of the word,5,broc4200,calm,571800810,
False,Research before purchasing!,2021-06-14 07:24:01,"I really wish I had done more research on all the meditation apps before I purchased Calm. The majority of the guided meditations are from Tamara, the “Head of Mindfulness at Calm.” I personally do not find her voice soothing, and have had difficulty finding other meditations on the app that are not guided by her. It is such a well known platform, I would expect it to be more expansive, and have more teachers available on it. I have found other platforms way better. Very disappointed in the app overall",2,RckyMtnHigh970,calm,571800810,
False,App is worth the paid version,2021-02-16 00:01:38,"I found more and more from Calm each year I’ve used it.  Had it for 2 years now.  Last 2 years my work has been stressful with travel and family.  The daily managing of stress alone has helped mind, plus body.  Body in so much of assisting in quality of sleep, heartburn, etc,...  Hidden anxiety taking a toll on the physical self.",5,MBS-journey,calm,571800810,
False,I pay for crashes??,2021-02-23 06:07:41,I pay for this app and it’s expensive. I try to use it all the time but the last two updates have been absolutely horrific. It crashes on me multiple times a night so I just gave up and went to another site. Now after this latest update it won’t even open past the “take a deep breath” screen 😡😡😡  I’m REALLY dissatisfied with how glitchy and slow it is. I pay a lot of money for this app but if they don’t fix the crashing issues I’m canceling. It’s appalling that my 80+ dollars app won’t work. 😡😡😡😡,2,Rkf2,calm,571800810,
False,"Way, way , way tooo short stories",2021-02-08 06:52:44,"The voices are calming, very soothing but ONLY around 30 mins long. You have to KEEP coming out of your rest to look for a new story. 
  I find after 2 or 3 times doing this, I am frustrated and now fully awake turning to something else to put me to sleep. Now I also have the problem dealing with the anger of not getting TO SLEEP.
 Make the stories a minimum of an hour please.",4,wder15243,calm,571800810,
False,Lifesaver,2021-06-26 14:11:54,"This app was a lifesaver for me. As a registered nurse working on a Covid unit I was pretty much at the end of my rope. I used Calm all day every day!!! I used it to get me through my day and to help me sleep. It was worth every penny. I had never been much for meditation, but just putting the screen on the ocean with soothing sounds while I charted helped me immensely. I could go on and on, highly recommend this app.",5,aprilhullrn,calm,571800810,
False,Meditation,2021-02-07 13:39:25,"I’ve had this wonderful app for over a year. I have practice yoga most of my life with meditation at different times of my life but more regularly now. 

My only thought regarding Calm is sometimes I wish the meditations were a little longer.... the silence and the breathing. Of course this is something I do on my own but I enjoy the Calm guided meditations with words of wisdom! 
Thank you!",5,Gameson,calm,571800810,
False,Tamara Levitt is What’s Wrong With The World,2021-04-10 17:57:28,"If you’re looking for a patronizing wu-wu ramble to make you question meditation all together, you’ve come to the right place. Inane fast-food wisdom combined with the effected, breathy voice of the narrator, Tamara, is sure to cause the listener to be less calm and more annoyed than when they started. A session on this app feels less like meditation than it does a solo-podcast with an air headed host looking to sell her line of healing crystals.  The app would be improved by replacing Tamara with literally anyone that doesn’t sound like they’re trying to push salvia on elementary school kids.",1,CWalzel,calm,571800810,
False,I feel i can trust LeBron James,2021-02-05 00:24:56,"Bringing up two sons who idolize any sport with a ball in it I would also need to learn the super stars they would follow mentally as well as physically.  LeBron James can also help this 71 year old caucasian woman who would like to channel her
energy in a more positive way.  it’s difficult to get older and not have those two boys to chase all over God green earth.  Thank you for your words.",5,Diane Jo,calm,571800810,
False,Great new additions!,2021-04-05 06:00:00,"With the addition of the amazing Jeff Warren, on the daily trip I am now back to listening to my calm app every night!When I started listening to the calm app I did his 30 days of meditation along with several sleep teachings and meditations, and have made great strides in my ability to relax, focus, sleep better. I am a therapist who highly recommends this app to all my clients.",5,vbreland,calm,571800810,
False,Great App,2021-01-31 13:58:50,"This app helped me through a true hard time worth the money in my opinion, the music is great sleep stories, self help readings by all different people help lift moods and get you thinking on a new perspective. There are also children options with stories music and meditation, I used the sleep stories with my kids a few times and it definitely did the trick.",5,MeggyMomOf3,calm,571800810,
False,Love this app,2021-01-04 21:44:58,"My meditation practice needs improvement & so working with CALM is very helpful.  Like the self check-in, the tracker I can use to “plan” and assess my mediation practice and the content of the 10-12 minute sessions.  I really miss going to live yoga classes during COVID & listening to a real person guide through mediation via CALM in the comfort of my own home is great.  Thank you for creating these sessions!",5,ccg20176,calm,571800810,
False,Life Changing,2021-03-27 09:12:18,I use the daily meditation to start my day. It’s made a huge difference in my mental well-being. Tamara has a soothing voice - makes it easy to listen. My kids and I love the sleep stories - we listen to one almost every night. I have also used the meditations related to calming anxiety - they’ve been especially helpful during this pandemic.,5,jenhajj,calm,571800810,
False,Absolutely perfect for stressful moments,2021-01-25 03:39:01,I used to have a lot of trouble sleeping and calming my thoughts during stressful moments. Now Calm is my GO TO the second I’m feeling anxious or in need of some calming comforting breaths. They have an incredible selection of content and I’m particularly a fan of their bedtime stories :) their bedtime stories make you feel like a kid again but in the most adult way possible☺️,5,Ashland Stansbury,calm,571800810,
False,Constantly needs to be reinstalled,2021-02-05 06:26:41,"My iPhone screen will shut off and normally music will still play but with this app, nope. It will for two days then I have to reinstall it to get it to work again. I googled it and this is a common problem with no fix other than reinstalling the app. The developers have some serious kinks to work out. This is a fabulous app and to have it work so poorly is sad considering my insurance is providing this to me for anxiety. Get it together calm!",3,mannpower03,calm,571800810,
False,Daily Mindfulness,2021-01-27 13:16:03,"I’m enjoying the app so far. I’ve tried the free trials and trying to justify the price tag of daily use. 

As I dig deeper into the app, I am finding it more useful and finding more ways to be present and experience mindfulness. 

I’m giving it four stars because I see where it could use more content, however, that could change over time. I’m very pleased with the content that I have explored so far.",4,Coach_Bee,calm,571800810,
False,Total rip off,2021-01-06 05:44:22,"I went to the website and tried to sign up for a basic membership or trial but the site literally will not let you 
It skips over basic membership and charges you $65 for a year to try it and then  says it won’t refund Any of your money and that you have to contact apple support and beg them for a refund and maybe apple will refund and Maybe not 

The same two ppl narrate pretty much everything I tried on the app and the woman Tamara’s voice is extremely annoying 
I can’t meditate to that 
I tried to get a refund and there’s no way to contact anyone so think twice before you spend 65 dollars to try something because YOU CAN NOT GET REFUND 
I will be calling credit card company tomorrow to do a charge back 
I used the app for about 30 minutes so I think a month charge would be fair but nope it’s $65 . It’s a scam to force you into a year membership and that tells ne the company is dishonest",1,drsforcats,calm,571800810,
False,Helps with sleep and stress,2021-06-23 13:58:18,I love this app. The only thing to improve is that I use it with my headphones and all my text notifications are read by Siri while I’m meditating. I wish this app had the ability to block notifications while in use because some people like to send five texts in a row and keep pestering until they get a reply.,5,anotherhomosapien,calm,571800810,
False,Changed My Life,2021-04-10 17:14:35,"I saw a Calm advertisement on TV at the beginning of the pandemic. I’d been feeling the need to center myself in general so it appealed to me. Little did I know how much it would affect my life in such a powerful way physically (lower blood pressure), mentally and spiritually! This app offers so much. I recommend it to anyone who is willing to sit with themselves and grow. Tamara Levitt is awesome!! I am grateful that I discovered Calm!💐",5,Bumble Bee 818,calm,571800810,
False,No but no,2021-06-10 07:07:08,When I first saw an ad on calm saying that it could help me fall asleep I said I’ll check it out when I got onto the app I saw that I had to pay for some thing and I was like OK I’m not gonna pay for it when I got to fully into the app all of the things were locked and only miniature items were not and that was very stressful now I have to pay $70 for me to unlock all of the things on the app and makes no sense and then you only gave us 7 days  to have it free I give a bad review because that is entirely messed up.,2,2 stars sorry,calm,571800810,
False,Relaxation,2021-01-10 20:03:54,"I am always feeling stressed and have lots of anxiety but when I come on to this app it just releases it and put it in a jar and ship far away forever and that feeling is just so inspiring and amazing so I want to bless all of you and I want to be able to wish that this app will help you just like it is helping me. I hope you have a wonderful day  

God bless you🙏😊",5,candy gitl,calm,571800810,
False,Just a Few Moments of Each Day,2021-06-10 00:17:44,"To be able to stop and see what I have done throughout the day, and stop. Where did I start, where am I, and where am I headed?

It really is rather simple, and can bring much joy to the day. So rather than letting myself become tense, angry, or unhappy; just let me take a few moments of the day, and rebalance the rest of today.",5,F. Hopeful,calm,571800810,
False,Calm,2021-02-16 09:22:49,"Just on site for a few hours..the most calming videos, pictures, beautiful scenery, fascinating content throughout. Insightful to the extreme . Never seen such amazing clarity flying above clouds, incredible waterfalls, waves, storms, lakes, beautiful raindrops gently falling on reacting leaves, enough already. I’ve almost reached transcendence , just want to spread the wisdom and love to family and trusted friends. Enjoy, best investment I’ve ever made.",5,Pain Empath,calm,571800810,
False,Want $$ to try it,2021-02-22 06:33:53,I wanted to try it but I can’t  because no matter what I try to listen to in any category I get a message to try it free for 7 days BUT I have to submit my credit card to even try it.  It’s very expensive at $70 a year for a student or a senior on a fixed income.  I’m not willing to give my credit card and get stuck with an auto bill. If they really were willing to try a free trial they would offer free access and at end of 7 days let person know they have to purchase to continue to use the app. Developer won’t even do monthly fee just a year.,1,Sun cat 76,calm,571800810,
False,Essential,2021-02-15 22:35:40,"I don’t write reviews but I needed to for this. Tamara and the rest of the readers they have on here are just phenomenal. They’ve truly saved me during the pandemic and have helped make me a better, more aware individual. The Daily Calm is an essential daily ritual and the payoff for those few minutes is invaluable. Couldn’t recommend this with any more enthusiasm.",5,Pennsylvania Rattlesnake,calm,571800810,
False,Love it but Tamara’s voice  has changed and has adopted a weird accent now,2021-01-08 12:46:54,"I don’t know if Tamara changed her audio equipment, but her voice is more tinny and burgeoning on vocal fry.  Tamara had a very relaxing, velvety smooth voice when the app started.  I don’t like to be critical and say this only to be constructive...we know the British accent sounds cool and all, but please also stop the newly acquired weird accent. It is distracting and you don’t need to do it. Be yourself.",4,Irishgrl7,calm,571800810,
False,You have to pay to use the app,2021-04-26 05:49:09,I downloaded this app to help me sleep and it didn’t help at all because you are aloud to listen to one story without the premium and with the premium you have some of them it is so stupid that calm has done this don’t download this app!!!!!! I only gave it five stars so then you would be able to see this comment! DON’T DOWNLOAD THIS APP IT’S A RIPOFF,5,lllleeeee🤗,calm,571800810,
False,Hard to gift,2021-04-08 14:45:18,I purchased a gift subscription for a family member. It has been a nightmare to then actually be able to gift it to her! The” Help and Support “ tab steps as how to do this isn’t what actually happened. And trying to find an actual phone number to speak to someone with Calm on the app is impossible. Not happy.,5,Michedann,calm,571800810,
False,More 40+min stories & poems please,2021-03-22 07:25:16,I love this app! It’s such a game changer. My favorite sleep story is the one with Harry Styles. I love the music and poem style story - also it’s pretty long (40+ min) which is great. I really would like to see more poems like this one on the app. There’s something soothing about drifting off to sleep with the rhythm of the rhyming. Hopefully Calm can keep growing and expanding their story styles/genres.,5,frannyval,calm,571800810,
False,Can an app be life changing?,2021-01-09 09:25:49,"The answer is yes. I swear this app is 80% responsible for my ability to function during this pandemic. I love the sleep stories, soundscapes, and music to work to. The pink noise is like a massage for your brain. 10/10 recommend. I will definitely continue paying for this app once my year of a free trial through Kaiser Permanente has been completed.",5,neemo487,calm,571800810,
False,Good but not great.,2021-03-01 17:20:51,"I used to work for a wellness app and I’ve been searching for another app to replace it with. I tried Calm in hopes it would meet my needs but it’s not a great fit. Mainly because I want to listen to programs while I’m multitasking. I want to listen in the car, or on a walk, or while I’m working but every program asks you to close your eyes and clear your mind which is probably great for a lot of people but it isn’t what I need. I want to use my time to get self-care while I’m doing some other often mundane task.",2,WriterMomAngela,calm,571800810,
False,Playing sounds when app is closed,2021-03-22 19:23:42,"I’ve had this app for a few years and I like the variety of sounds and the fact that they turn off after a few hours, which is why I would give in 4 starts. Lately it’s been going off in the middle of the day or over night randomly. The app is closed and my phone will say I’m playing nothing, super weird.",4,!Nat,calm,571800810,
False,Paid subscription not eligible for Family Sharing,2021-03-31 00:18:19,"I just subscribed today and was surprised to see that they’ve opted out of making their subscription eligible for Family Sharing.  In their FAQ they give the reason for this as they “are still working to develop the best experience possible for families who share Calm with each other.”  Family Sharing works pretty well, Calm.  Just go with that.  There’s no way we’re purchasing multiple $70 annual subscriptions, so I may not commit after my free trial is up.",2,Zippityz,calm,571800810,
False,Takes all the stress out of meditating,2021-03-13 05:57:01,"Just what I needed to start making daily habits of the healthy practices I’d been dabbling in. It’s beautiful, soothing and inviting. Gives me gentle prompts to meditate and reflect. Suggests meditations so I don’t have to go scrolling through a menu or remember to set things up in advance. It provides the structure and encouragement I needed to make a daily habit of meditation.",5,bigauddie,calm,571800810,
False,More options,2021-01-20 05:10:28,"I really wish there was more options for people using calm that do not have the subscription, because most of my favorites are locked. Sometimes when I want to listen to a body scan or a meditation session, it’s locked and I can’t enjoy the things I like about the app. Nevertheless this app is truly a wonderful release after a long day of school or work.",4,calm kitty cat,calm,571800810,
False,Love this app!,2021-02-16 17:19:48,"I use the CALM app for sleep stories at night and daily morning meditation. I also love the focus music options during work periods. Just recently I lost a colleague and the grief stories were so helpful. I have also enjoyed the daily reflections snd quotes. In a fit of anxiety , the emergency breaths are an indispensable resource. I don’t know what I would do without the CALM app!",5,JenSmith1985,calm,571800810,
False,Pretty good,2021-02-22 13:14:24,"I mostly use Calm for the Sleep Stories.  They really do help with my sleep.  I don’t like the daily Calm, for some reason I find the narrators voice really irritating   I’ve tried over and over and can’t stand her voice and delivery (Tamara) 
I have listened to some of the visitor meditations and like them better. 
I would like more new sleep stories.  I really like the ones about travel.  Eric Braa is my favorite his voice is soothing.  
I’d like to hear more chapters of Treasure Island!  
Lynne W",3,Gaga Lynne,calm,571800810,
False,Calm helps,2021-02-16 05:21:03,"I’m finding artists and collections of sounds that surpass classical music when the spirit needs rest. The visuals are done well for an app. In one app I find relaxing instrumentals with and without nature’s music, meditations and peace. I am enjoying your selections.
 
    Artists that I am familiar with are putting music on Calm that reveal how much they resonate with the new age. Thanks for all your efforts.",5,Caretaker48,calm,571800810,
False,Total fraudulent trial program: once you click yes they bill you for a year and you cannot get out!,2021-01-12 02:07:02,"I found the site did not provide enough substance for the cost; so then I tried to cancel before the trial date ended; The site made it absolutely impossible to cancel and then immediately charged me a FULL year subscription without any notice. I think this is the most fraudulent set up and con job imaginable. Lure people in, make it impossible to stop and then bill them for a year of service with absolutely no way to get out of their fraudulent contract. Such a scam.",1,STUCABAX,calm,571800810,
False,Nice App,2021-04-05 18:03:04,"I like this app a lot. It has nice features such as being able to set reminders for different things (daily check-ins). The worst part about this app is that almost all of the really cool features and options you must “unlock” by paying for a subscription. I do not pay for it, and therefore have limited access to what I can actually do on the app. I’d much rather the app just have a one-time-fee to access all parts of the app.",3,Poluticorn02,calm,571800810,
False,I tried.,2021-02-17 12:18:03,"This was the 3rd app I downloaded for relieving stress and I was crossing my fingers. But sadly, everything you have to buy. Most of the things are locked.🔒 I really wished this wasn’t another app that gauges you for money, I was very disappointed. It looked like a very useful app. I just don’t wanna pay more money for a stress reliever app. I still gave it four stars, but I won’t continue to use this app. 😕",4,žçį,calm,571800810,
False,Need a Sleep Stories app!,2021-01-28 05:59:04,"I only use Calm for the sleep stories for which I would give almost 5 stars. I’ve tried the meditation and some of the other things, but find them grating and triggering. I don’t care for the main woman’s voice all over the app, but love the diversity of the stories voices. I have some favorites who have deep, soothing voices. The price is a bit steep for just stories that are only updated maybe twice a month, so I’d love a Sleep Stories only app.",3,Courellie,calm,571800810,
False,Love this app,2021-03-31 00:15:43,"Love this app, it has helped me very very much.  The only thing I would like to see different is the ability to have unlimited favorites.  When I keep adding favorites it knocks some of them out of my list cause there is a limited number you can use.  Other than that, I could not be without this app.  Love it!!!",5,Sara9,calm,571800810,
False,Sleep stories,2021-01-06 03:05:33,"I love love love calm. It helps me sleep every night and I love all of the guided meditations. I would like to suggest being able to queue up sleep stories, and sort by length. It takes me a while to settle in, and sometimes I need to put on a second sleep story, but the light from my phone/ interaction with the app takes me out of my sleepiness.",5,Poppjggvfwey,calm,571800810,
False,Delightful variety of resources,2021-01-03 20:56:31,Daily Calm provides many teachers and many modes of working one’s awareness.  It would be impossible to spend enough time to explore it all and still do one’s regular life! The graphics and photos are gorgeous and the music also.  I’m especially grateful for the basics taught by Jeff Warren which got me to set a habit and stay curious.,5,BirdWatcherinMaine,calm,571800810,
False,No more free content,2021-01-05 04:47:40,"I used this app for free when my baby was born to play lullabies, help with post partum insomnia and keep our sanity. I used to listen to one of the tracks called Milky Way- it was my favorite. These were free and required no trial or purchase. It’s all I wanted and guess what, those are LOCKED now. Very disappointed. Some people have a budget and can’t afford the full version but now there is nothing left at all to use -even for free- even things that were once free within the app. Will be uninstalling and hoping Bored Panda will be enough for me and the baby to sleep.",1,La la Runner,calm,571800810,
False,Great able / please fix ableist context,2021-02-12 18:51:08,"I do really love this app. Just wanted to point out that in your 7 days of gratitude meditation there is a part about being grateful for your eye sight because not everyone has it. Please be aware that blind folks are able to access/use this app and it’s inappropriate ableist language. Maybe update the language in that one. Otherwise fantastic and calming, grounding app.",4,Ramona FC,calm,571800810,
False,App is overwhelming,2021-06-02 15:18:53,"Calm is a very overwhelming app. For a place that one is supposed to go to for relaxing, it has caused me anxiety on several occasions because I'm not sure where to go within the app. There are too many things going on and too many categories.
The content is the best in the world but there is so much to sift through before picking something.
I really wish the app gets re organized into simpler categories for someone to easily navigate and find what they need.",2,vvsdemon,calm,571800810,
