isEdited,title,date,review,rating,userName,app_name,app_id,developerResponse
False,My all-time favorite App,2021-03-24 19:37:45,I love this app. It brings me joy. Thank you!,5,misu2002,calm,571800810,
False,Awesome App,2021-03-19 13:12:07,"I love calm. I have introduced it to several people, and they all love it, too!",5,littlelomommy,calm,571800810,
False,Time out of Mind,2021-02-14 15:50:42,Keep up the good work,5,Raider ..... Ram,calm,571800810,
False,Is the system down?,2021-02-19 12:18:05,I have been using the app over a year.  It has not worked since the hard freeze Sunday night.  Is the system down?,1,Skmiddleton1,calm,571800810,"{'id': 21407286, 'body': 'So sorry for the trouble you\'ve experienced! Please try leaving the app open on the loading screen, as this should allow the app to fully load. Upon subsequent app launches, the app should then load normally without any delay on the ""take a deep breath"" screen. If you are experiencing issues on an older version of the iOS app, please update to the latest version, then follow the steps above if you experience any loading issues.', 'modified': '2021-03-02T20:37:38Z'}"
False,Calm,2021-01-27 01:16:08,It helped me stay calm and more happy and I love all the choices there are!,5,Karen Archabald,calm,571800810,
False,Beautiful app but...,2021-01-31 02:20:05,This is an amazing app well hilt and very useful but I would suggest slightly more free content to engage new users on the fence about spending 60$ for a luxury app.,3,Justin LP,calm,571800810,
False,If you can afford it,2021-01-08 07:46:36,It works,5,dumfoo,calm,571800810,
False,Charged for something I didn’t sign up for,2021-01-14 19:53:34,I downloaded this app in its free version. Found out almost a year later it’s been charging my account each month.,1,Fulumple,calm,571800810,
False,I mean... the free version has nothing available any more,2021-01-06 03:37:26,"Ive been using this app for years and suddenly this week, all the free soundscapes and stories I’ve used are locked for subscription only. It’s a pandemic. Come on.",1,ggscnjg. hj,calm,571800810,
False,Listened to Lebrun James,2021-01-04 17:08:33,"I had a feeling of hope and motivation. 
I’m very interested and excited to what this 
experience will do for me! Let’s go!",3,lunalisatic,calm,571800810,
False,No new stories for free,2021-06-22 11:20:15,"I am disappointed that rather than adding sleep stories, Calm LOCKS stories 
Now there’s one sleep story fro ther free version. But it is true, I don’t hear the end. Sleep story works. 

😢",2,CF240,calm,571800810,
False,Love it.,2021-04-26 02:46:59,I love the calm sleep stories . My whole family listens to it at bedtime .,5,KooKooJigbish,calm,571800810,
False,Subscription is dumb,2021-05-22 02:36:53,I like everything about it except for the 70 dollars a year subscription,3,qwvhd,calm,571800810,
False,"Wow, surprised at how good this is!",2021-04-08 04:39:25,"Great background music, amazing content and so relaxing and peaceful with the perfect timeframes!",5,jacperkjoy,calm,571800810,
False,Great app!,2021-03-20 21:11:07,I rate this app 5 stars it’s the best app ever it actually helps with things!,5,idnsjnsnejd,calm,571800810,
False,I LOVE CALM.,2021-03-16 04:03:47,I turn on a sleep story and fall asleep in 15 minutes or less.,5,savvic1,calm,571800810,
False,So good,2021-01-18 06:19:42,Me and my son love love this and use it every evening.  You can cancel anytime!,5,LinzPeachy,calm,571800810,
False,Good but....,2021-03-09 04:25:53,Not sure what the problem is but I can’t get into any of the tracks without having my phone time out and screen go black. One it’s in sleep mode I lose the track.,1,pennypower101,calm,571800810,
False,Love it- when it works,2021-02-13 16:55:15,I am also getting stuck at the opening “breathe” message. This is terribly frustrating. Please fix this ASAP!,2,osito and copper,calm,571800810,
False,More stressed now,2021-02-04 05:36:50,"Something is wrong with the volume control. I wanted to go to sleep so I tried a sleep meditation. The volume was stuck on full blast absolutely no way to decrease it. Obviously a bug, but man I’m mad. All of a sudden I’m very awake. Thanks Calm....",1,Sflower92,calm,571800810,
False,Tb,2021-05-04 05:22:49,I never write reviews but I LOVE Tabitha Brown! This is really one of the best decisions calm could’ve made honestly. This is great ty,5,donielletwashington5,calm,571800810,
False,Ugh,2021-05-04 21:04:05,I hate that y’all dont have more unlocked for forever because some people’s parents don’t want to pay!,2,bestctrftftn,calm,571800810,
False,Helpful for mental health & worth paying for too,2021-03-15 21:26:37,"This app really helped my mental health with meditating twice a day, thanks!",4,chamcloud🦄,calm,571800810,
False,Unhappy customer!,2021-03-25 03:12:29,"I paid $70 for a year of Calm app. I can’t use anything!! Everything I click on tells me to sign for $7.99 “free trial” ! First of all, $7.99 is NOT free and I’ve already paid $70! What is up with this? I can’t even use it. Sooo upset!",1,calmdislike,calm,571800810,
False,Comment,2021-01-27 01:24:10,I expected the meditation to start immoderately. I would rather to hear the introduction in a separate track!,3,sherry6600,calm,571800810,
False,Bait & Switch!,2021-03-04 15:08:05,Everything requires that you upgrade to Calm Premium and pay a fee.  This app offers no help whatsoever unless you upgrade and pay.  Shame on you!,1,4567rtyu,calm,571800810,
False,This is horrible,2021-02-25 00:42:54,"All the stuff is locked and anything worth it and even the stuff that isn’t worth it is locked. Relaxed melodies is waaayyyy better and more stiff free,and soothing. This was crap and I deleted it in under an hour.",1,m2damay,calm,571800810,
False,Notifications don’t lead to app opening,2021-02-19 16:18:04,When I’m notified to check in for how I’m feeling and I click the notification it doesn’t go to the app nothing happens this is a paid app fix it!,1,jas_if,calm,571800810,
False,Ehhhh,2021-01-25 03:52:16,Ehhhhh said it’s iffy everything is locked and I can’t afford this right now there is like one thing that does not cost money:(,3,Lemonbalm Soap,calm,571800810,
False,Preparing to sleep.,2021-05-19 05:00:47,I use 20-30 minutes to concentrate and-relax with Tamara wilt,5,Patriotic Liz,calm,571800810,
False,Waste of time,2021-06-07 11:56:43,I downloaded this “free” app thinking it might help me sleep better only to find out that without a subscription there is only one 14 minute video you can select!,1,Hfnbnghghghfchchgfcfh,calm,571800810,
False,Not connected?,2021-05-23 10:51:07,After recent update the app claims there is no connection. Pretty good before that.,3,touchmebabe,calm,571800810,
False,Really good app for sleep,2021-03-28 15:57:21,Really good app but a little slow to load. Overall really great app 😊,4,Stella Grace.S,calm,571800810,
False,Overpriced,2021-03-09 06:28:07,"A meditation app with constant in-app purchases is sort of an oxymoron. Maybe good if you’re willing to pay $70/year, but that seems extremely steep for what should be free knowledge.",2,Trew4745,calm,571800810,
False,Jean Rinaldi,2021-03-06 21:15:11,"I’m an anxious, obsessive codependent!! Daily Calm is my savior! Very helpful and meditations very satisfying!! Tamara is the best!! Just her voice ralaxes me!!",5,popewchack,calm,571800810,
False,Annoying narrators...,2021-03-09 04:37:49,"The story and meditation narrators sound full of angst.  Not soothing at ALL!!!
I like to hear stories to help me relax and these were just annoying!!!  Need more soothing, relaxing, calming voices!!!!
Yuck!!!!  Seriously can’t get better voices????!!  Tamara Levin....OMG!! The worst!!!👎",1,eliann,calm,571800810,
False,Stress Reliever,2021-02-08 19:50:55,"The Calm App helped relieve me immediately of my distress, I highly recommend the app.",5,DrFeelGood32,calm,571800810,
False,Stress finding daily thing!,2021-02-18 22:21:03,Yesterday I found a daily meditation or 15 minute calming piece. Today I can’t find it. It a stressful stressful just to look for it. Where is it?,2,jkb rn,calm,571800810,
False,Get this app now!!!!!!,2021-01-29 02:56:41,This app does a fantastic job calming you and relieving stress.,5,griffinbloom,calm,571800810,
False,Lay,2021-02-01 09:29:01,I like it it’s just that it’s a lot of them locked because of premium and I can’t find others that’s not locked and I need to sleep,2,Lay_lay3311,calm,571800810,
False,Not enough diversity,2021-01-27 16:36:18,I like it but there are hardly any people of color. Most of the instructors are white. Haven’t seen a single Asian person. Hardly any diversity. Disappointing,2,..needs more diversity..,calm,571800810,
False,Ridiculous,2021-01-27 10:30:48,"I hate that you have to pay to access any part of this app, what was the point in it even being free if you can’t do or listen to anything",1,Morandah D,calm,571800810,
False,Good start,2021-03-08 03:19:08,I’m committed to change,5,CJBeliveau,calm,571800810,
False,Sleep,2021-06-26 10:37:52,I’m usually sound asleep before the story ends. Thanks,4,anniespod,calm,571800810,
False,Basically unusable,2021-05-11 19:57:01,This piece of garbage app is almost entirely locked unless you’re paying $60 a year. Don’t even bother installing it unless you want to fork over an unreasonable amount of money.,1,Boblongschlong,calm,571800810,
False,Too Expensive,2021-05-02 13:07:23,"They used to have some free content. No longer. Nothing is accessible without a $70/year subscription, which is way overpriced.",1,hp42,calm,571800810,
False,Calm really helps me!,2021-03-07 23:33:40,Calm really helps me relax and bring down my anxiety! ❤️,5,Tania Azevedo,calm,571800810,
False,Piece and awareness,2021-03-04 13:37:24,I love this app because it helps me with meditation and focus,5,lisa yolanda,calm,571800810,
False,Calm,2021-02-21 22:25:49,It made me feel better,5,LuciferPrime,calm,571800810,
False,Love the app...but,2021-02-10 02:56:42,I’m not able to open the app tonight... 😕,5,Bethann : ),calm,571800810,
False,No stories for adults,2021-02-17 06:11:46,"Would love to see them some great tales for adults to listen to, to fall asleep - instead it’s children’s stories or infomercials for travel destinations",2,Ontheroad2much,calm,571800810,
False,Great for everybody in the family,2021-01-31 14:46:47,I love it. My 9 years old loves it.,5,Marce1969-,calm,571800810,
False,Music,2021-01-29 00:44:46,Nice background vibe while I work.,5,T. Lee C,calm,571800810,
False,Calm Music Breathing,2021-01-22 09:49:30,This app so far is truly amazing! I know it will help me tonight.,5,By the blood of God,calm,571800810,
False,Life changing,2021-01-17 15:44:03,"With the addition of calm to my life, it has steadily and progressively bettered.",5,This app is siq dude,calm,571800810,
False,This app is very calming...,2021-01-09 06:29:03,This app is the only app that will help me relax. I think that this app is a Very good app! 🙂,5,LMK022077,calm,571800810,
False,Feedback,2021-01-13 17:54:56,Have more stuff available for free,4,alexis whitten,calm,571800810,
False,Mrs. Loving,2021-01-08 00:23:38,The music is calming and relaxing. It helps me out a lot when I’m stressed and anxious.,5,ParadiseRestored,calm,571800810,
False,AMAZING,2021-06-27 13:04:45,I love this app I use the moshi story to help myself go to sleep and I fall asleep on cloud 9,5,mayabeen,calm,571800810,
False,Fantastic program,2021-05-22 14:48:11,Truly a Blessing to me,5,tnkewl,calm,571800810,
False,Celebrities,2021-06-27 03:31:05,It seems like this app is overpriced to pay for all the celebrities. You can’t even check it out without agreeing to a one year subscription after a 1 week trial.,1, crazyblue,calm,571800810,
False,Download Calm app,2021-04-18 06:10:50,I am unable to download the app from the store! 🤷‍♀️⭕️☮️,5,Lindarlin,calm,571800810,
False,Calm plus,2021-05-09 15:04:03,I’m sad that most of the stuff is for people who pay I wish it wasn’t,3,grace donut,calm,571800810,
False,Everything is Lock,2021-05-03 07:52:10,Literally everything is lock like I get it you gotta make money but couldn’t you leave one thing unlock? I just wanted to use this for tonight...,1,Nella10018,calm,571800810,
False,Needs more deeper relaxation sessions,2021-04-30 14:03:43,I like your app but it needs more deeper relaxation sessions. I need deep relaxation sessions for a good nights sleep.,4,Dean Carlisle,calm,571800810,
False,Shoulda bought the lifetime subscription in January,2021-04-08 14:52:35,Money well spent.  Invest in yourself.  Treatchyoself.,5,third77,calm,571800810,
False,Good App...But...,2021-04-18 01:03:14,"Great app, it functions well, but be aware that they will charge you for an annual subscription for Calm premium the day before your trial ends.",3,Jtmann5000,calm,571800810,
False,Daily trip,2021-02-22 18:40:52,Renewed my subscription just for the new Daily Trip series with Jeff Warren.,4,ahjop,calm,571800810,
False,Not that good,2021-03-10 02:48:22,I love it it had good meditations but it said “7 day free trial” and it says “you can cancel at anytime but when I wanted to cancel it it didn’t let me they are like saying that you can’t cancel it and it made a year trial and it was NOT FREE!!!,1,ji loe,calm,571800810,
False,Amazing,2021-02-05 14:57:42,It really helps me go to bed at night and calm my stress,5,Addison Eckroth,calm,571800810,
False,Amazing,2021-01-27 10:49:39,This app has been life changing,5,Bhamira,calm,571800810,
False,Why does it cost so much.,2021-02-02 06:21:34,If you are trying to make an app that helps people mentally. Why in the world would you make it cost so much.,2,High noon is asome,calm,571800810,
False,Confused and Curious,2021-02-01 04:46:05,I like the app honestly but why make it free if you going to charge for most of the content?,3,Dropknowledgenotstupidity,calm,571800810,
False,Zzz,2021-01-27 03:32:50,This a really good app! I’m about to go to sleep but it really helps!,5,MMM777777777,calm,571800810,
False,Best App Ever!,2021-01-16 15:19:07,"Amazing app, only thing missing is athletic meditations for teams and for kids. Please, please, please 🙏🙏🙏 TIA",5,Juiceemsp,calm,571800810,
False,Tonight 1st day week fee trai,2021-01-18 04:52:09,1st night I just followed the instructions he said and it was okay,4,b ball goat,calm,571800810,
False,Invasive advertising,2021-01-03 20:15:55,I have been shown an ad to download this at least 50 times during the last few months. The ads are creepy and invasive. Horrible! AVOID!!!,1,threver,calm,571800810,
False,Very very good,2021-04-20 06:13:06,I got so calmed down that I left earth,5,icantuseanickname,calm,571800810,
False,Save your time,2021-06-14 02:46:23,You can’t do anything unless you agree to a 7 day trial in which they then charge you $70. So no options at all work other than the crickets chirping noise. No thanks,1,Cybereyes,calm,571800810,
False,"stressful, hard to find free stuff",2021-05-16 08:46:11,"you literally have to pay for almost everything on this app and its very stressful and frustrating. why do i have to pay to just not feel depressed? don't make the app free if you have to pay for what’s inside. don't download this unless you have patients, money, and you don’t get angry/stressed easily.",2,Kyutie Uni,calm,571800810,
False,Oh well,2021-05-10 16:17:53,Seems like it could be a good app but it’s just too expensive for me. I guess us poorer folks are destined for destruction,3,Tugger and Bunches,calm,571800810,
False,Peaceful good for mind and focus improvement,2021-03-28 20:45:27,Great app daughter gave to me,5,peacefulstoic,calm,571800810,
False,Worthless without paying,2021-04-13 03:04:56,Absolutely terrible product if you don’t  pay them $70. Good luck scrolling through miles of locked content,1,Ld2799356,calm,571800810,
False,Experience,2021-03-27 04:47:45,"It’s just the best app for meditation, stress release and sleep",5,broken804,calm,571800810,
False,THIS IS GREAT,2021-03-04 02:23:00,This app is amazing I couldn’t sleep at night so I was Tierd at school but now I am great,5,maddie🧐🧐🥳🥳🤯,calm,571800810,
False,I don’t know what this is for,2021-01-17 18:27:04,This app is pretty good I got good sleep,5,wolf boi89,calm,571800810,
False,Glitch,2021-01-19 02:45:56,Every time I download this app my phone stops functioning correctly. I’ve cleared out most of my apps and tried again several times.,1,Nichole Eagy,calm,571800810,
False,How I love it,2021-01-14 04:20:23,Calm is so calming and relaxing I use it mostly it for bed,5,Perri irmer,calm,571800810,
False,It’s great relaxation,2021-01-07 14:19:23,It was very helpful in helping me relax and live in the moment.,5,thestuffedteddybear78,calm,571800810,
False,Why do you have to pay for everything?,2021-06-26 16:13:29,Calm really wants you to pay for stuff. Feels like they’re trying to make money over mindfulness.,1,Jjjjaaarrreeedddd,calm,571800810,
False,You will love this!,2021-05-08 16:36:39,Wonderful and mood changing. I love this!,5,ph03b38HH,calm,571800810,
False,Mad,2021-06-01 03:52:59,No one told me you have to pay for the sleep book,3,hi sxb ty xb,calm,571800810,
False,Tacky. Repetitive,2021-05-11 03:37:24,"The sessions on stress are exactly the same as the sessions on anxiety (with the words anxiety and stress exchanged). All in all, not very engaging. The “calm” nature images feel artificial and way over the top. 

Nice background noises.",2,sherwood dweller,calm,571800810,
False,Simple,2021-04-26 05:15:33,Sounds and help with breathing,5,Ihatemothersday,calm,571800810,
False,Ellen’s Calm,2021-04-08 15:03:12,It looks like a very pretty and cool app I’m enjoying it so far,5,Ellen Engelhorn,calm,571800810,
False,Calm,2021-04-07 02:11:50,In my mind i think this is the best relax thing ever,5,Monsuir frei ze sha,calm,571800810,
False,Love this app,2021-03-23 11:14:48,I love the wisdom and peacefulness that occurs when I stop and listen to Tamara ❤️,5,Sammyscan,calm,571800810,
False,Why should I pay for good sleep,2021-03-28 21:38:32,I downloaded this app for the sleeping stories and I saw that I had to pay to watch/listen to them this is app is bad and I don't recommend downloading it.,1,great game but bad bugs,calm,571800810,
False,Great Variety,2021-03-15 10:50:48,Excellent variety of content.,5,Lina1015,calm,571800810,
False,Thank you Harry,2021-01-24 16:19:36,That worked,5,Aveocado,calm,571800810,
False,Paying,2021-02-07 00:07:29,You have to pay for some stuff and subscribe but i dont want to do that i just want to be happy and not deppresed,2,pjghcxfhjjnkiddxcvbwwafjookn,calm,571800810,
False,best app to improve your life,2021-01-12 19:14:33,to my opinion this is the best app that contributes to you life instead of taking away your time that most people spend on social media app,5,bufson,calm,571800810,
False,Love it!,2021-01-10 14:28:39,Great app that I use almost every day!,5,Mini_Mal_Yep,calm,571800810,
False,"Love it but $70 after a week, really?!??",2021-01-09 11:13:33,"I love my small taste of Calm.  And I would take advantage of the 7 day trail, but $70 a year?!?!  Need to have a monthly installment plan.",3,Campitpoolboi,calm,571800810,
False,Best Ever,2021-06-28 01:43:22,Best meditation app ever. Has helped me deal with my depression and anxiety. Thank you 🙏,5,Simmy Johnson,calm,571800810,
False,So soothing,2021-06-19 01:39:20,I am so pleased with the meditations on this app. Helps so much with anxiety.,5,Mandy Rose41,calm,571800810,
False,Useless,2021-06-23 20:35:08,There’s absolutely no reason to download this if you don’t plan on spending money. You can’t do anything on the app without making purchases.,1,jddufsaatyi,calm,571800810,
False,Grateful,2021-01-22 18:56:03,This is an amazing application. It helps to reduce stress and also calms the mind.,5,SAI AND SHY,calm,571800810,
False,Way too much talking,2021-03-26 06:37:38,The narrator barely pauses. I cant  even begin to do whatever she is describing before she is already talking again. Definitely not relaxing.,1,KimBCar,calm,571800810,
False,Calm app review,2021-03-20 18:15:55,"Love this app, I just wish there were more free options!",4,HarmnyLVePce,calm,571800810,
False,¯\_(ツ)_/¯,2021-02-25 04:35:48,"Idk really, I’m only able to get to story’s 
And I basically can’t do anything ☹︎(;´༎ຶ_༎ຶ`)",4,nova_wolfie,calm,571800810,
False,Very disappointed,2021-02-21 09:25:11,I was very disappointed that I couldn’t open any of the content in the app without paying. This’s is NOT a free app. I deleted it 5 mins after downloading.,1,Butterbean1981,calm,571800810,
False,Worth every penny I spent.,2021-01-01 22:36:00,"Seriously, it’s worth it.",5,Kari Wari,calm,571800810,
False,Calm review,2021-01-03 23:55:40,"I love this app, it calms me down, but I want more sleep stories without the premium version I have to pay for.I still LOVE IT!!!!",3,Keomie,calm,571800810,
False,Helpful,2021-06-07 01:25:53,Good perspective to help calm the mind. I’m new to Calm and anxious to continue the journey.,5,Peaceful Searcher,calm,571800810,
True,Update crashed the whole app,2021-06-18 02:34:43,Was working fine. Now it says take a breath…. And crashes. How long am I supposed to hold my breath? Just curious…… 🤷‍♂️,2,Giddionkane,calm,571800810,"{'id': 4199734, 'body': ""Hi Giddionkane, thanks for the message! We offer 100+ meditations as well as over 100 sleep stories on the full version of the app. Feel free to send any questions to support@calm.com and we'd be happy to help you out!"", 'modified': '2018-07-11T23:21:36Z'}"
False,Nothing is free,2021-06-07 10:59:18,"Only downloaded because I saw what they did for Naomi Osaka. But the app isn’t free. It’s free to download, but not free to use. Every single thing is locked. You’d have to subscribe to utilize the app ($70/year). Deleted immediately.",1,Annoyed34828283,calm,571800810,
False,good,2021-05-13 03:18:08,i think calm is an amazing app with nice stories. it has helped me fall asleep many times. the only issue is the price. i is so costly! i dont think the price is the best but overall a good app.,5,jdhdjwb,calm,571800810,
False,Calm acceptance,2021-04-23 21:59:22,This mediation was exactly what I needed today. Thank you.,5,Snowboardwoman,calm,571800810,
False,Kinda pointless,2021-05-11 06:31:15,The whole thing costs money.  Takes away the point of reducing stress if you have to pay for it.  Kinda dumb in my opinion.,1,Hdnxhsl,calm,571800810,
False,Meditation,2021-03-10 23:41:48,Helps always helps in these COVID days,5,marathonman6,calm,571800810,
False,I have to say I didn’t really like calm because everything is Locked 😖😖,2021-04-18 00:59:00,🥺🥺,3,hahsnsjjssyta,calm,571800810,
False,Uhhhhhhh,2021-04-02 15:23:19,It’s a Great app but half the things I can’t unlock because I don’t want to pay money,3,coco puff star snooki menace,calm,571800810,
False,Disappointed,2021-03-13 19:23:56,I got this app thinking it would be good. It’s not what I expected. You have to pay for everything and it’s not worth it.,1,LedgendaryFox13,calm,571800810,
False,Peter Pan,2021-02-19 04:18:16,This really helped me sleep and I liked it too,5,Jmoney junk,calm,571800810,
False,Download Calm,2021-01-10 19:08:12,Calm is such a good app it has help me fall asleep and remove stress and anxiety,5,cupcakepuppy32322,calm,571800810,
False,Don’t buy this app,2021-02-03 18:05:58,Ok so I got the app and I was like here we go I’m going to have songs stories like the add said and I get it.......... I was so mad YOU LITERALLY HAVE NOTHING if your willing to pay for everything you can but I’m not sorry,1,bubblechick2006,calm,571800810,
False,Love this app,2021-06-22 13:31:08,I love this app I go to sleep in 3 or 4 minutes I love it,5,take a deep breth,calm,571800810,
False,Love this app,2021-04-10 02:41:23,Best 10/10 but wish there was more of bob ross,5,cookie brookie 🤬🤬🤬,calm,571800810,
False,Terrible,2021-06-16 04:43:29,The sound and everything thing sounded really cooling I didn’t want to spend 70 dollars every year for it. Plus it didn’t have any that weren’t premium.,1,john reiser,calm,571800810,
False,Disappointed 😞,2021-05-27 08:32:46,Where are the visuals Calm uses in their advertisements? I bought premium thinking I would have access to visuals like that. There’s none!!,1,sixpennykelo,calm,571800810,
False,Apple Watch App Incomplete,2021-05-02 11:41:52,"Watch app does not update your stats! I like to listen to daily calm via watch+AirPods, but it does not update stats.  It makes no sense to  develop a watch app, but leave off stats update?!?!",1,dhwuh,calm,571800810,
False,Calm app,2021-02-15 22:07:55,Is the 50% off available ?,5,2Walnuts,calm,571800810,
False,To many prompts for reviews,2021-03-17 13:01:53,Decent meditation sessions but it really interrupts the flow when the app prints me for a review every time I use it.,3,oasis to be,calm,571800810,
False,I wish there were more free sleep stories,2021-01-29 20:37:14,I wish there were more free ones.,3,kaleseedshealthyeats,calm,571800810,
False,Worst,2021-02-15 02:25:03,Don’t get the app it’s the worst app ever please don’t get it they are trying to make you get the app and they make it all free but win you get it you haft to by everything please don’t get it please.,1,Lilmandare,calm,571800810,
False,Stress inducing,2021-02-10 00:10:38,"Finally decided to try this app as I am having a lot of stress due to money matters... it won’t do anything without requiring payment! Needless to say, it increased my stress level.

Not helpful at all!",1,CAVelarde,calm,571800810,
False,It’s great,2021-01-08 05:23:20,I just love it help so so much to sleep and anxiety,5,crazy45276252627517,calm,571800810,
