isEdited,developerResponse,userName,review,date,title,rating,app_name,app_id
False,,Ricky_27,I struggle with way too much sometimes and this app helps you calm down and feel better with having chat rooms and videos it’s so great!,2020-07-04 06:06:24,Helps.,5,sanvello-anxiety-depression,922968861
False,,uuuuuuuuuuuuum,I love how you get tons of courses to do and it makes it more easy to meditate I have only been using it for a week but I love it only 1 problem the tour through Sanvello app doesn’t work! If you could fix that I will rate a five,2020-04-01 20:34:41,Sanvello,4,sanvello-anxiety-depression,922968861
False,"{'id': 17897286, 'body': ' THANK YOU!  We are so pleased you are enjoying the app!', 'modified': '2020-09-15T20:40:29Z'}",LC Horton,"This is a great program, and I would recommend it if you are seriously wanting to revamp your mental health and are wanting a different perspective on emotions.",2020-09-09 23:30:28,Worth everything!,5,sanvello-anxiety-depression,922968861
False,"{'id': 18088286, 'body': 'Please contact us at info@sanvello.com.  We thrive on opportunities to engage and assist.  If you are confused by the steps or tools, we can help.  ', 'modified': '2020-09-25T03:37:46Z'}",Chaticus,"I’m finding this app very confusing. Difficult to understand graphs.  Too many options for activities, with very little direction on what to do based on assessments. Many of the chat groups are not very active, with people not responding for days or not at all. Haven’t signed up to pay for coaching or therapy, so cannot speak to those offerings. But the free app just isn’t very helpful.",2020-09-11 21:27:04,Confusing,1,sanvello-anxiety-depression,922968861
False,"{'id': 17266646, 'body': 'Thank you for the feedback. I will share this with our development team.  You are always welcome to reach us at info@sanvello.com.', 'modified': '2020-08-13T16:12:58Z'}",SAS1389,"It would be great if the message boards had a dark theme (this would be especially appreciated by the insomnia community). 

Your in-app “give feedback” button doesn’t work.",2020-08-03 05:53:07,Lots of features,4,sanvello-anxiety-depression,922968861
False,,Megaextra,I have been struggling with anxiety for quite awhile now and this is exactly the tool I needed to feel like I’m taking steps towards positive change,2021-04-12 02:13:44,This app is life changing,5,sanvello-anxiety-depression,922968861
False,"{'id': 17767241, 'body': 'I am so glad that Sanvello has been a positive part of your journey!  Thank you for your feedback.  \nBe well! ', 'modified': '2020-09-08T22:24:10Z'}",jejehensnsus,"I have really bad depression and this is helped me so much and I have come so far in my journey it’s just an amazing app and it’s taught me self confidence,positivity,and many more things for me to grow on",2020-09-05 19:58:35,Amazing app,5,sanvello-anxiety-depression,922968861
False,"{'id': 22469728, 'body': 'Fabulous!  Notifications provide helpful reminders to stay consistent with self care routines. So glad you are taking advantage of this tool.  ⏰', 'modified': '2021-04-26T19:40:03Z'}",the1andonly_helena,I find the reminders helpful. Sometimes I get so tied up in my day-to-day routine that I forget to carve out a little time to myself. The reminders help me remember that it’s ok to make my mental health a priority.,2021-04-22 12:02:13,Reminders,5,sanvello-anxiety-depression,922968861
False,"{'id': 20792657, 'body': 'Thanks for your review, we are so glad to hear that you are enjoying Sanvello!😊 Please contact us at info@sanvello.com if you ever have any questions or feedback on how we can improve your experience even more!', 'modified': '2021-02-01T22:49:00Z'}",Bill Backbone,"This app is simple to use. Engaging and informative on a number of ways to make life more pleasant. I use it all the time to help limit and eventually stop, “catastrophizing my world.”",2021-01-28 13:20:11,Sanvello pocket therapy,5,sanvello-anxiety-depression,922968861
False,,avocado princess,This is am amazing app it's my favorite it really helped me with my anixtey like I don't know what I would do with out this app I needed. It and it does not cost any money it'd free this is the best app ever,2021-03-03 00:01:20,This is amazing 👍,5,sanvello-anxiety-depression,922968861
False,,Joey804,"I literally love this app. All I have to do is go to my chart, record my moods, from time to time and do some deep breaths and also, do some exercises! Great app! Recommend this for everyone!!",2021-02-19 09:02:54,I love this app.,5,sanvello-anxiety-depression,922968861
False,,CupcakeNY,Great selection of activities for one to do to enhance quality of life.  There’s so much variety and there’s even community support.  One of my favorite apps.  Very empowering.  Thanks Sanvello! :),2020-06-11 15:18:44,One of My Favorite Apps,5,sanvello-anxiety-depression,922968861
False,"{'id': 13970187, 'body': 'Thank you for purchasing the premium version. We are truly honored you have chosen Sanvello. Please do not hesitate to reach out to us at info@sanvello.com if you ever have any questions. Have a great day! ', 'modified': '2020-03-10T18:13:46Z'}",OBarreras,I have the premium version and this app is so helpful with coping with my anxiety. The meditations and other tools on the app are so great. I also love how the app checks in throughout the day.,2020-03-10 02:25:48,Super helpful,5,sanvello-anxiety-depression,922968861
False,,RosyRawmos,"I don’t know why I didn’t know about it sooner. This is day one, and I am so glad I have this. I’ve been hunting for help for so long, and I have found my fit.",2021-04-07 19:23:19,God-send.,5,sanvello-anxiety-depression,922968861
False,"{'id': 16964017, 'body': 'Hope is a wonderful thing!  Thank you for your feedback. ', 'modified': '2020-07-29T22:20:05Z'}",Magsmundt,"This is the first app that has given me hope for my future and my present. Gentle and simple, yet honest and helpful. I would highly recommend!!!",2020-07-29 16:53:49,Amazing!!!,5,sanvello-anxiety-depression,922968861
False,,Jay West 22212122,I adore this app. They have great videos to watch to slow your mind and heart rate down. You can add your own personal touch to what background noises are on the video.,2020-05-10 14:30:34,Anxiety Relief,5,sanvello-anxiety-depression,922968861
False,,Giomon808,"I’m alone so when nobody else cares, this app asks me how I’m doing and when I need it it really helps. Thank you. And the questions make me think and stay positive",2020-04-09 06:25:01,Thanks,5,sanvello-anxiety-depression,922968861
False,,Bmeir123,Absolutely wonderful app. Every single exercise and meditation has gotten me through such hardships in my life and has made me look at things so much better. THANK YOU SANVELLO TEAM  AND COMMUNITY!,2021-03-09 23:41:04,This App Saved My Life,5,sanvello-anxiety-depression,922968861
False,,jenenanel11,"This app makes me accountable for my feelings and I can use it any time.  I haven’t upgraded it yet, waiting for a paycheck.  But as far as I can tell this is great",2020-12-23 06:14:03,This is good,5,sanvello-anxiety-depression,922968861
False,,Massive Revolver,This app is really good to help me keep track of positive and negative changes in my mental health. I really like the meditation feature they have.,2020-02-10 14:24:41,Great to keep track of my emotional progress,5,sanvello-anxiety-depression,922968861
False,"{'id': 16834951, 'body': 'Hi! Sanvello uses weekly assessments within the app to help users measure their progress. These are clinical assessments that have not been modified by us, so the language can be stark. We completely understand where you are coming from, and will take your feedback to the team.', 'modified': '2020-07-23T14:49:40Z'}",confusednotcrazy,"The app sounded great when recommended by our company as a way to cope and stay focused through the pandemic.  I love meditation, so I thought this would be great! The problem is, the app keeps asking me the strangest questions about how I am dealing with my illness and behavioral health issues. Like, what!?  I’m a healthy, happy woman who loves yoga and mindfulness.  Since when did that qualify me as ill?",2020-06-13 21:04:31,This app is so crazy!,1,sanvello-anxiety-depression,922968861
False,,Sandra Christin 1953,I’m hopeful to reach goals I’ve set for myself and find the right path to it and not let my health issues block me,2021-06-25 18:32:22,Want to treat myself better,5,sanvello-anxiety-depression,922968861
False,,♡︎ ellie ♡︎,"I love this app, I always look forward to filling out the everyday form! It makes me feel accomplished. It has also helped my self confidence and self esteem a lot!",2021-02-02 21:11:37,Awesome app :),5,sanvello-anxiety-depression,922968861
False,"{'id': 18201466, 'body': '🙌 Very useful review!  Thank you. ', 'modified': '2020-09-30T16:58:25Z'}",Notreallyareviewwriter,I’ve only been using for 3 days but I find the ability to address negative thoughts and ways of thinking great.,2020-09-29 12:42:19,Very useful tool,5,sanvello-anxiety-depression,922968861
False,,spham14,"I don’t think of my self as super anxious or depressed, but I love that this app helps me monitor and think about that. It can be easy for me to get into a rut and ignore my mental health. Fortunately, this app checks in with me :)",2021-03-25 02:02:54,Cool App,5,sanvello-anxiety-depression,922968861
False,"{'id': 22200226, 'body': 'Thank you for your feedback, we apologize that the scoring metrics for the weekly assessments were not helpful for you. I will share this feedback with our product team for them to look into further. Please contact us at info@sanvello.com if you have any other recommendations on how we can improve.', 'modified': '2021-04-12T19:27:51Z'}",75748291,"Being primed for achievement-centered thinking since I was a small child is probably part of why I have anxiety in the first place. As a result, I found the scored assessments very triggering. I know that I’m depressed and have low resilience — but seeing it as a numeric score on an app I’m using to feel better was not helpful for me.",2021-04-09 12:29:32,The scoring is upsetting,2,sanvello-anxiety-depression,922968861
False,,preeti tibrewala,I was very anxious few days ago. This app helped me navigate my low feelings and turn them into positive feelings. I’m so happy I have this a try.,2020-04-22 23:51:10,Amazing advice in the app,5,sanvello-anxiety-depression,922968861
False,"{'id': 13696647, 'body': 'Thank you for taking the time to write this review. We are truly honored you have chosen Sanvello. Please do not hesitate to reach out to us at info@sanvello.com if you ever have any questions. Have a great day!', 'modified': '2020-02-25T15:43:09Z'}",Maggot #1414,Im normally doubtful about trusting an app with helping with my depression but it helps me communicate with my wife like i could never do on my own and the meditation really helped me,2020-02-25 02:19:23,Im a doubtful person,5,sanvello-anxiety-depression,922968861
False,"{'id': 13162362, 'body': ""Thank you for your 5-star review! We are grateful you love that it is easy to use the app. If you have any questions or additional feedback please don't hesitate to reach out to us at info@sanvello.com. Have a great day!"", 'modified': '2020-01-28T15:24:35Z'}",Barlito95,What I love about this app is how easy it is to use. The tools I want to use are all there and clear and I don’t get lost tapping screens.,2020-01-27 22:07:25,Very sleek and amazing interface,5,sanvello-anxiety-depression,922968861
False,,fun about this app,I have been using Sanvello for a few months now and it helped me a lot with my depression and anxiety so I recommend downloading this app :),2021-01-19 17:02:10,Download this app :),5,sanvello-anxiety-depression,922968861
False,,x Rachel Rae x,"My mental health has always been rocky but I feel like I’ve been losing my mind, locked away like an animal. Thank you.",2020-04-03 04:27:34,Thank you for the free premium during the CORVID crisis.,5,sanvello-anxiety-depression,922968861
False,,"USAF pilot, Steve","Looking forward to the days activities and opportunities.
In fact, I m already feeling a bit better by just being",2020-07-24 18:00:06,thankful for Mary is trying to help me do!.,4,sanvello-anxiety-depression,922968861
False,,suziev23,I  having a hard time with the app. It doesn’t seem to have explanations of how to use it properly. I would like to utilize all its features but I can not figure it out. Is there any instructions?,2020-05-01 20:28:53,I’m sure how to utilize all it’s features,3,sanvello-anxiety-depression,922968861
False,"{'id': 18651713, 'body': 'Great review!  Thank you.😃', 'modified': '2020-10-22T21:58:12Z'}",O really now,"i really like this app so far. it can help with mental health if you are going through stuff, or just need to get your things in order! great app!",2020-10-18 23:32:16,Great!,5,sanvello-anxiety-depression,922968861
True,"{'id': 19252597, 'body': 'Thank you for the feedback, we are sorry that it was not the experience you were looking for. The good news is that we are currently working on updates and a web release that will address some of these concerns, and that should be announced very soon! ', 'modified': '2020-11-20T21:20:46Z'}",budm108,"Simply put, this app will increase anxiety and depression - not reduce it. Customer Service is horrible and fees are very high for telehealth. They never provided me the promised psychiatrist, charged me for sessions I never had, and there technology is loaded with bugs. Too many other helpful options than dealing with this money-hungry corporation who cheat their clients.",2021-03-11 18:17:32,Fast food of mental health,1,sanvello-anxiety-depression,922968861
False,,Heduhh,This app helps me when nothing else can. I am so thankful I found this and so happy that premium is free because of covid right now.,2020-07-04 19:54:11,My go to,5,sanvello-anxiety-depression,922968861
False,,hog dad,"For someone who has worked on their mental health a long time, this app is perfect as a middle ground between therapy and having no professional support.",2020-06-30 03:43:14,Life saver,5,sanvello-anxiety-depression,922968861
False,,RoseandKellie,"This app is beautiful.
I love that it gives articles, you can chat in communities  and you can check in to monitor your feelings and so much more! Love it!",2020-06-06 03:36:53,Utopia,5,sanvello-anxiety-depression,922968861
False,,Jdjdbdbdudxnxndndnnd,Only two days in and already feel so much more relaxed as I have so much stress and depression. Highly recommend,2021-05-22 15:13:18,Amazing,5,sanvello-anxiety-depression,922968861
False,,keylan7,"Love it so far, been using it just today and already can see it becoming a part of my daily life.",2020-06-08 21:40:12,Great first impression,5,sanvello-anxiety-depression,922968861
False,"{'id': 19759763, 'body': 'Hi there, thank you for your review. We apologize that you are having trouble setting up your insurance for a telehealth visit, please do contact us at info@sanvello.com so we can look into this for you!', 'modified': '2020-12-14T19:23:18Z'}",Mtee23,It asked for all my insurance details to request a therapy appointment but doesn’t load the list of therapists even after I removed all filters,2020-12-12 13:15:07,Great but I’m concerned it doesn’t update,4,sanvello-anxiety-depression,922968861
False,,realreview1010,The app helps me relax and take control of my anxiety. I have noticed a difference in the few days I I have used the app.,2021-03-05 17:16:31,Helps A Lot,5,sanvello-anxiety-depression,922968861
False,,Marie_sol,It hasn’t been a week since I started using the Sanvello App.  I absolutely love it!  I feel better about myself and enthusiastic about using the app.  THANK YOU SANVELLO!,2020-04-26 04:07:04,Life Changing App,5,sanvello-anxiety-depression,922968861
False,,MorSun1031,"It taught me a lot of things and how to overcome, most of my issues. Still working to improve them. I",2020-03-29 02:30:01,Excellent app. You won’t regretted,5,sanvello-anxiety-depression,922968861
False,,JazzyFrazz,Everything is great. Only ask is that you can go back during a journey to reread the info.,2020-12-25 16:02:49,Well laid out app,5,sanvello-anxiety-depression,922968861
False,,Pocky hen,"My current therapist recommended this app. It provides a structure and clear plan to helping you become more mindful, happy, and present.",2020-08-03 22:14:53,Therapeutic and Helpful,5,sanvello-anxiety-depression,922968861
False,,zainabmaliki,"The app was great as it is. I never had premium and now with COVID, the app providing premium for FREE is beyond me. I’m so thankful! You are all doing a phenomenal job with the creation of this app. Thank you so much!",2020-06-22 18:12:17,Free Premium,5,sanvello-anxiety-depression,922968861
False,"{'id': 22287715, 'body': ""Thanks for your review, we really appreciate your kind words and we're so glad to hear that Sanvello has been beneficial in handling your depression! Please contact us at info@sanvello.com if you ever have any questions or feedback on how we can improve even more going forward."", 'modified': '2021-04-16T15:31:52Z'}","Hello, peoples!",Sanvello is absolutely wonderful. I would definitely recommend. Sanvello has really helped my depression and I feel like I have someone.,2021-04-12 17:52:45,Sanvello,5,sanvello-anxiety-depression,922968861
False,"{'id': 18651630, 'body': 'Thank you for your ⭐⭐⭐⭐⭐review. We are happy to be a part of your journey. ', 'modified': '2020-10-22T21:50:32Z'}",cat and dog player,Honestly the everyone in the community chats are so kind I have bad anxiety and everyone on the app helps me with it a lot I highly suggest downloading,2020-10-12 03:45:56,Amazing app!,5,sanvello-anxiety-depression,922968861
False,"{'id': 22269456, 'body': 'Coaching is currently offered in the United States, however, our Guided Journeys and self-help resources are available to everyone! Please check out the robust selection of tools, meditations, and content in the app. We can be reached at info@sanvello.com if you have any questions about these features, or feedback.', 'modified': '2021-04-15T21:05:49Z'}",Kikoface123,It seems that because coaching is not available in my area a large part of the application is not relevant,2021-04-05 05:30:57,Coaching doesn’t work in my area,4,sanvello-anxiety-depression,922968861
False,,ehsjfjfhsus,Customizable with coaching and community available if/when you need them.,2020-02-11 12:32:33,Useful Tools,5,sanvello-anxiety-depression,922968861
False,"{'id': 16963752, 'body': 'Thank you for the feedback!  Our team is taking notes. ', 'modified': '2020-07-29T21:51:23Z'}",cris🤙,"I love using the app, but I think it would be better if you allowed the users to be able to have more then just 3 assessments.",2020-07-26 03:30:03,Suggestion,4,sanvello-anxiety-depression,922968861
False,,1234567890qwertyfan,I’ve only used it for  like an hour but I already really like it. I don’t have premium but it is still great,2021-01-29 18:00:08,Great,5,sanvello-anxiety-depression,922968861
False,,frilic,"Keeps getting stuck, some videos have issues playing with sound. Content is good though. I had to restart it multiple times.",2020-07-24 12:49:45,The App is very glitchy,3,sanvello-anxiety-depression,922968861
False,,mac_geek50,The app it’s great it guides you and makes you feel at relax and more concentrated. Once in a while you find glitches not a big deal...,2020-04-21 13:34:54,"Great app, but little glitchy",4,sanvello-anxiety-depression,922968861
False,,Braingametryer,"So far it’s been pretty good for me. It’s a place to go to find relaxation and clarity of mind. The meditations have been pleasant and effective. Am pretty new to it, like a couple of weeks, but it has helped.",2020-04-15 19:33:46,Supplemental Health Aid,4,sanvello-anxiety-depression,922968861
False,,IsaySoFirstBorn,Thoughts are just thoughts and we don’t have to get attached to them was just one example of a simple insight gained from this app.,2020-06-26 12:52:18,Thoughts are just thoughts,5,sanvello-anxiety-depression,922968861
False,,Nickironii,Relaxed me with first experience after a harsh breakup. Would recommend to my younger self!,2021-04-02 05:33:44,"Best free service so far, would recommend",5,sanvello-anxiety-depression,922968861
False,,feco#5,"This app is going to get me though COVID-19 I’ve been on it for a couple days but I feel 
Better some. Your not alone here.",2021-02-28 03:46:44,Depression,5,sanvello-anxiety-depression,922968861
False,,Dgirlunderurbed,i feel,2020-05-22 08:16:50,Great job i feel like i’m finally getting over my mental health thank you so so much for this app,5,sanvello-anxiety-depression,922968861
False,"{'id': 17406523, 'body': 'That is strange!  We would love to help.  Please contact us at info@sanvello.com for assistance.  (Also,  please make sure you have the latest iOS version on your iPad.)  😊  ', 'modified': '2020-08-20T22:17:04Z'}",Lilac Mess,I’ve had this app for 5 minutes and keep getting error messages when trying to take the weekly survey and the iPad version doesn’t rotate to landscape view. Wow. What a poorly designed app. I can’t even speak to the services because I can’t even get it the app to work properly.,2020-08-18 20:56:21,Glitchy. No landscape view.,1,sanvello-anxiety-depression,922968861
False,"{'id': 13230087, 'body': 'Wow! Thank you for taking time to provide feedback with just your initial usage. We really appreciate it. We are thankful you find it very helpful so far too. If you ever have any questions, please reach out to us at: info@sanvello.com. Thank you! ', 'modified': '2020-01-31T22:47:51Z'}",Rosie6345,"I’ve only just recently started using this, but find it very helpful so far.",2020-01-31 16:13:33,Very enjoyable and helpful!,5,sanvello-anxiety-depression,922968861
False,,Sbakon,I like that the app asks me how I’m feeling and gives me the opportunity to check in. But the videos rarely play correctly. And it’s a bit unclear what I am supposed to be doing,2020-04-15 13:18:32,"Great for logging, but videos don’t work",3,sanvello-anxiety-depression,922968861
False,,neptune 8,I have only been using this app a couple days and it’s helped me deescalate from panic attacks.,2020-12-11 01:40:15,10/10,5,sanvello-anxiety-depression,922968861
False,"{'id': 23204200, 'body': 'At Sanvello we really believe in the right level of care at the right time. If we find that a client would benefit from services outside our scope of practice, we communicate our recommendations and discontinue services. We do apologize for these sometimes unexpected and abrupt changes. 📌Based upon your feedback, our team will certainly examine ways to improve the transition process moving forward. Thank you for sharing your thoughts.  Please email us at info@sanvello.com if you have additional questions or if you would like to discuss this situation in more detail.', 'modified': '2021-06-04T18:59:31Z'}",BAD45ACP,My employer pays for this service. I just had them pause my coaching and completely turn it off in the app without telling me. I had to email them to find out. They said they were pausing coaching while I sought treatment. It’s ridiculous to think I can’t manage both.,2021-06-03 01:08:07,It’s like chat bots,1,sanvello-anxiety-depression,922968861
False,"{'id': 22539803, 'body': ""We're so glad to hear Sanvello is helping to make you more aware of your emotions!😃 If you ever have any feedback or questions about those features, or the app itself, please reach out to us at info@sanvello.com."", 'modified': '2021-04-29T18:21:28Z'}",Gkthrock,This app asks me how I am doing several times a day which makes me aware of how I am dkoand can then hang onto the feeling or change it. Lots of good features.,2021-04-26 01:35:58,Good reminder,4,sanvello-anxiety-depression,922968861
False,"{'id': 19860457, 'body': 'Hi there, thank you for your review! We appreciate the feedback, however there actually is a ""Journal"" feature within the app! Please do contact us at info@sanvello.com and we can walk you through the process of accessing that feature.', 'modified': '2020-12-18T17:59:33Z'}",TJ_24E,I like the app I just wish there was like a place to vent like a journal and i dont like how you have to like pay or sign up for stuff and there should be games.,2020-12-17 04:35:18,Review,4,sanvello-anxiety-depression,922968861
False,,breanna faye,This app is so helpful when my depression sets in. It has some good tips and techniques to use if you are very anxious like me. This app really works!!❤️❤️,2020-12-02 13:11:45,Review,5,sanvello-anxiety-depression,922968861
False,"{'id': 18651643, 'body': '😎  Thank you for your review. ', 'modified': '2020-10-22T21:51:31Z'}",Seacdk,Sanvello provides easy and practical steps that make a difference,2020-10-12 13:27:43,"Easy, practical steps",5,sanvello-anxiety-depression,922968861
False,,Kupborgdebos,This app has helped me so much with anxiety and it has no cost I love it so much and I highly recommend it to anyone 13 and older,2020-03-28 13:17:02,Awesome,5,sanvello-anxiety-depression,922968861
False,,Blakester71,This app has a great layout and makes it easy to get into small and simple steps to improve your mental wellness,2021-05-25 03:26:15,Great Mental Wellness App,5,sanvello-anxiety-depression,922968861
False,"{'id': 18357243, 'body': 'Thank you for your ⭐⭐⭐⭐⭐review.   If you have suggestions for how we can improve, please reach out to info@sanvello.com', 'modified': '2020-10-08T19:06:27Z'}",Lthompson101,I’ve been going through a lot and this app has a lot of tools to help me get through the tough times,2020-10-03 20:38:29,Best Therapy Ever,5,sanvello-anxiety-depression,922968861
