isEdited,developerResponse,userName,review,date,title,rating,app_name,app_id
True,"{'id': 16836415, 'body': ""Hi there! We're not quite sure what you mean by unclickable. If you don't mind contacting us at info@sanvello.com, we'll make sure we apply our recent free premium promotion to your account to extend your free premium access through 1/1/21."", 'modified': '2020-07-23T16:46:00Z'}",Alice Valkyrie,"The option is un-clickable. I’m assuming it’s because I don’t have a credit card on file. And it isn’t offered through my heath insurance. I cannot afford to pay for it.  I don’t think access should be restricted in this way during this time. I’m very disappointed.

Edit: Thanks for the quick response and for solving my problem. Have changed my rating.",2020-07-25 05:27:40,Can’t get free premium for the rest of the year :(,5,sanvello-anxiety-depression,922968861
False,"{'id': 18088194, 'body': ""👋 Hi there! Thank you for your review. \n\nWill you reach out to info@sanvello.com so the we can investigate 🔍 the issues you mentioned.  This doesn't sound right and we want to get it addressed right away. ✅ "", 'modified': '2020-09-25T03:32:42Z'}",ViiEllie,This app has definitely helped me a lot since I’ve started using this app. Only thing that disappointed me is after a few times using it now I’m struggling to even get the app open. I’ve missed days checking in or I’ve had to download the app again and lose all my data because the app failed to open or it had an error message wish they’d fix that part other than that I really find this application helpful.,2020-09-20 04:07:26,It’s helped me a lot,4,sanvello-anxiety-depression,922968861
False,,SarahSmileJ,"This was an app that was given as a free service through my work due to the stresses of the pandemic.  I have found to be extremely useful in tracking, reframing and unpacking my feelings, moods and self talk to a better more productive and realistic place.  You can use as much or as little of the app as you’d like. It’s your journey and this app allows you to make it truly beneficial for your unique needs.",2020-08-20 14:32:11,Great refocusing tool for depression or anxiety,5,sanvello-anxiety-depression,922968861
False,,SHEIN_addict,"Sanvello is literally the best decision I ever made. It’s totally free and very helpful. There is a premium option that costs but the free option works great as well. Each day you can journal how you’re feeling, set goals, meditate, do breathing exercises, and so much more. With tons of options sanvello is personally tailored to help you and fit your needs. If you have any type of mental illness no matter how severe sanvello will change how you live day to day life.",2020-07-05 12:58:05,BEST DECISION I EVER MADE,5,sanvello-anxiety-depression,922968861
False,,Pro is amazing,"I use this app every day and it’s amazing! It helps me track my mood swings with a lot of detail and is super helpful when I talk to my therapist because sometimes I can’t remember what’s been happening! It’s a great way for me to journal and set goals for myself and has a ton of resources, especially with the free premium version for COVID. Would highly recommend for anyone who is struggling with mental health and needs an easy to use app!",2020-06-08 20:53:59,LOVE this app!,5,sanvello-anxiety-depression,922968861
False,,Jamcc390,"This app has so many great features. If you’re trying to embrace new habits, like I am, then it’s super helpful. Lots of “feeling word” prompts to learn to identify feelings. Daily reminders are great. Simple and short mindfulness recordings make it easy to start out and get comfortable with it. I haven’t paid for the full version, but I can see that in time I might want to establish more goals. Even so, it’s a full tool in the free version.",2020-02-25 17:44:52,Such a cool tool,5,sanvello-anxiety-depression,922968861
False,,unoriginal-something,"A lot of apps for anxiety are frustratingly behind a pay wall. This is one of the few apps that are very helpful and mostly free. It lets you track how you’re feeling throughout the day, set your health goals to your own personal needs, and has a community for you to talk to.

There’s also the option for a therapist or coach, although I haven’t used that yet. So, I can’t vouch for how good that is.",2021-01-24 21:24:33,Great app for anxiety,5,sanvello-anxiety-depression,922968861
False,,6snakes,Amidst the chaos this is helping me find calm. Thank you so much. Having health complications due to my anxiety. This app is holding me over until I find the right fit with a therapist though I’ll still be using the app after. I hope it’s not too expensive as I’ll be paying for it once the storm has settled. Anyways this is just what I needed literally almost exactly what my doctor recommended.,2020-04-09 07:03:38,Find calm,5,sanvello-anxiety-depression,922968861
False,"{'id': 19327006, 'body': 'Hi there, thank you for your feedback!😊 Unique nicknames are useful in differentiating users in the community feature of the app (that way users aren\'t responding to several different members named ""Bella""). \n\nFor assistance with the video issues, or any additional questions in general, please do reach out to us at info@sanvello.com so we can dive in a little deeper to find a resolution. Thanks again! ', 'modified': '2020-11-24T17:32:17Z'}",Lssaoi,"1: why do we have to have a “unique” nickname like if I wanna be called Bella then I want me nickname to be Bella, I’m sorry but it bugs me when I want to put in my name and it’s says “This is not a unique nickname” like what do you want me to put it as “Iwannadie”?

2:The videos don’t load, now this doesn’t bug me that bad but when I complete the first step and move on to the video it glitches out and makes the screen go black, and it won’t let me get out of the video either!

But overall that it is a good game.",2020-11-23 05:51:31,Problems,3,sanvello-anxiety-depression,922968861
False,,Haoaoaoaoa,"I’ve been sitting on this review for quite some time. I used the app occasionally, but with five kids (including a new baby), working full-time, and attending an online university full-time, I never made it through a full lesson. Since the COVID-19 pandemic, I’ve felt additional stress and needed a release. I pair this app with my bible devotional every morning and can tell a major difference in my mood. Thank you Sanvello!!",2020-04-02 13:26:19,Total-game-changer,5,sanvello-anxiety-depression,922968861
False,,Nelley47,It’s hard trying to remember a feeling when you’re such in a dark place or when you’re surrounded by people that drain you and themselves. This app gave me a step by step into into helping know that everyone has emotions and it’s okay to feel like you’re in the dark as long as you keep looking for the light,2020-04-07 22:04:41,I’m actually finding myself again,5,sanvello-anxiety-depression,922968861
False,,Sim86,"I’m just the short few days that I have been using the app, I’ve already felt a difference in how I’m approaching my day and different situations. It has helped me to stop negative triggers and unpack the accompanying emotions, thoughts, and feelings. I hope to continue to build upon the tools being provided and think this is certainly placing me on the right path.",2020-05-02 11:27:24,Helpful During A Trying Time,5,sanvello-anxiety-depression,922968861
True,"{'id': 17767425, 'body': 'Hi there!  Did this get resolved for you?  Please reach out to info@sanvello.com. Our team would be happy to assist with this!  ', 'modified': '2020-09-08T22:50:23Z'}",Dcs1116,"I really like the concept of this application and use the mood tracker but I am truly bothered that the first thing I see on the landing page are the in app purchases of getting a coach or therapist. I have emailed them several times to find a way to hide this information because the therapist isn’t even available in my state. The coaching is more than I want to spend a month for the service. Please make that go away because my insurance is paying for the premium service and we should not be blasted with more options of purchasing something else. 

That said the mindfulness exercises work and I have got a handle on my anxiety because of the app. 

Almost perfect and if you make coaching and therapy disappear it will be perfect.

Thank you.",2020-09-29 10:10:43,Helpful but ....,4,sanvello-anxiety-depression,922968861
False,"{'id': 14144283, 'body': 'You are so very welcome! Thank you for being a part of this community. Remember, alone we are strong, but together we are Sanvello Strong. Never hesitate to shoot us a note at: info@sanvello.com. All the best, your Sanvello Team.', 'modified': '2020-03-20T14:39:30Z'}",adawnthompson,"I just received your email that you are offering your app with premium features for free. Although I have never used your app, I definitely will be. Thank you for offering something that could potentially help those of us dealing with added stress and anxiety because of the pandemic we are all dealing with right now. People like you are making a difference!!!",2020-03-19 23:50:53,Wow! Thank you!!!,5,sanvello-anxiety-depression,922968861
False,"{'id': 16837116, 'body': ""Hi! Have you tried ensuring that your phone is not in silent mode for the video audio? We've seen this a few times and this has been the problem in each case so far. "", 'modified': '2020-07-23T18:11:00Z'}",Kypris333,I like the way it's customizable but there are some bugs. Aound won't play in the videos even tho set to play at highest volume and to the correct device. At least on my iphone. Not sure if anyone else is having issues and couldn't easily fine any way to get help with this issue. I'm running the premium version so this seems like a pretty bug flaw to me.,2020-07-21 16:53:55,"Nice app, but sound doesn't play in videos",4,sanvello-anxiety-depression,922968861
False,,Jamie62info,"I have been wanting to incorporate more CBT into my life without having to see a therapist.  I live in Minnesota and it the winter is filled with dark, dreary days and it’s a challenge to overcome my depressive tendencies.  This app has been an excellent tool that provides guidance on how to use CBT to manage my mood.  I also love that it includes a visual, textual, audio, meditation and journaling techniques.  Brilliant!!!",2020-11-15 18:01:59,Just what I was looking for!,5,sanvello-anxiety-depression,922968861
False,,TeneiseCara,"Honestly this is one of the most stressful times of my life. Of many lives. Being pregnant living during a pandemic with an anxiety disorder is tough, I can’t take my medications for my anxiety attacks. So the fact that you have this app premium for free during this pandemic is probably one of the best things for me right now! Thank you so much! Thank you for caring about all of us!",2020-06-14 12:01:04,Thank you!,5,sanvello-anxiety-depression,922968861
False,,RaquelRachelLen,"This is a great app. Has several options for working on mental health, and I am enjoying the guided meditations. My only complaint is, I cannot seem to add my insurance info in order to receive the additional benefits of this app. Whenever I put in my information, I cannot scroll down to the bottom of the screen to complete the application.",2020-06-05 11:17:08,"Great app, one issue",5,sanvello-anxiety-depression,922968861
False,"{'id': 17767445, 'body': 'I love that you called this your ""daily friend"".  FABULOUS description.  Thank you for your ⭐⭐⭐⭐⭐review! ', 'modified': '2020-09-08T22:53:37Z'}",Captain Tripz,This app is your daily friend. Does all the things you should be doing daily.  This may turn out a bit odd as it shows no characters. If you just follow along with this app it it will really help you untangle some feelings. I don’t have the expanded version but I am considering it.  Five stars from this scrambled soul.,2020-08-26 17:40:12,What you should be doing only far better,5,sanvello-anxiety-depression,922968861
False,,Da6en'ka,"I like the questions asked during sign up, the free registration with good basic features and a very reasonable upgrade cost. I’m looking forward to putting this app to good use. I always appreciate when developers put in the time and consideration into make something that helps others and that is easy to use. Thank you!",2020-02-01 04:41:11,Easy sign up and gorgeous UI,5,sanvello-anxiety-depression,922968861
False,"{'id': 16834998, 'body': ""Hey there. We're so sorry to hear you've been experiencing this issue and would love to look into it further and help get back on track. Please contact us at info@sanvello.com so we can help."", 'modified': '2020-07-23T14:51:16Z'}",ZoZose,"For the last few weeks the app keeps changing my daily entries. I’ll enter water for instance as ‘10 cups or more’, close the app, reopen it and it has returned water intake to zero. It’ll do that for several entries. Right now, for today, I haven’t entered a single thing yet it’s reading as 30 mins of exercise and five hours of sleep. 

So at the end if the week I’m getting wildly inaccurate and monumentally unhelpful data as to which were my best and worst days. Took me a little while to spot it because I’ve never had this issue with the app. Anyway it was once good, now it’s garbage.",2020-06-21 13:48:30,Used to be so good,1,sanvello-anxiety-depression,922968861
False,"{'id': 13225905, 'body': 'Thank you so very much for this review and for your detailed comments. We are delighted to hear this is helping you! Did you know Sanvello also offers virtual visits with live therapists?  For more information, feel free to contact us at: info@sanvello.com. Have a great day!', 'modified': '2020-01-31T15:41:02Z'}",Janica Torres,"This app has been a heaven sent for my depression and anxiety. It’s like having a personal therapist in your pocket at all times. You track your feelings, identifying them and breaking them down to understand the WHY behind them. It has so many different options for learning, meditating, journaling, etc. It’s an excellent app and I recommend it to everyone!",2020-01-30 22:11:32,Pocket Therapist,5,sanvello-anxiety-depression,922968861
False,,TinkTyna,"This helps me keep track of my moods and behavioral patterns in between my sessions. There are ~5 min questionnaires that will help you determine if you’re experiencing anxiety and/or depression. Also, there’s space for journal entries to expand on feelings, meditations and other exercises that will help if you don’t have immediate access to a therapist or psychiatrist. Definitely recommend.",2020-12-18 01:39:54,Helpful Companion w/ Therapy Sessions,5,sanvello-anxiety-depression,922968861
False,,MarshmallowUnincorn,"I haven’t used this app to its full capacity yet, but so far I love it. I’ve it set up to send me reminders to log my mood. Just the act of logging my mood and creating awareness of how I’m feeling has been so beneficial for me. Putting feelings into words is hard, and by using this app I’m starting to learn how to do that. 10/10 would recommend",2021-04-19 17:17:23,Love this app,5,sanvello-anxiety-depression,922968861
False,,DonnaPinCT,I started using Sanvello when I had a bad downturn in my life and it has been a big help to me. Now they have unlocked premium features for us to help cope with coronavirus pandemic anxiety. That’s a really great thing! The tools here and the community are therapeutic and the app is free and easy to use. You won’t regret trying it.,2020-03-24 11:55:24,"So much more than I expected, a big help tool",5,sanvello-anxiety-depression,922968861
False,,Xohaylieox,"This app is so amazing and has helped me so much with my stress, anxiety, and depression!!! I love it so much and it has so much to offer, even with COVID-19 they r offering free premium and it is so amazing. The only thing I would recommend (unless I just haven’t looked hard enough) would be to add calming scenes and their sounds. I think it would also help. Thank you to the creators of this app I really appreciate all your hard work.",2020-03-24 21:36:35,Music,4,sanvello-anxiety-depression,922968861
False,,Ala1234space,"I would like to say that I have not been using this app for too long, but so far, the ability for it to be free while giving users the choice to pay (but it’s not required) is the absolute best thing and genuinely, this app has been very good for me and I know it would be good for any others who are in need of something like it.",2020-02-18 05:29:30,I love this.,5,sanvello-anxiety-depression,922968861
False,"{'id': 16963942, 'body': 'Thank you for feedback.  We are thrilled that you found our app ""quite helpful"".  \n\nWe recently removed our paywall for four months to provide relief during Covid-19.  It is now back up to help us continue to innovate.  We are proud to offer more unlocked CBT tools, meditations, and self-care content than any other mental health app - because accessibility is important to us.  \nPlease reach out to info@sanvello.com for questions or  information on Premium access during Covid-19.', 'modified': '2020-07-29T22:06:18Z'}",mbar1,"Sanvello Initially offered free use of their premium app “during the pandemic and blm upheaval/protests”.  I’ve found it quite helpful so far, but sadly they recently stopped premium use.  I cannot afford premium use since I’m on SSD and I know my insurance will not cover premium use of the app(some people’s insurances will pay some portion of the premium.  Worth checking your insurance.).  Initially would have rated it 5 stars, but since losing the premium use, I had to reduce to 3 stars.",2020-07-29 03:02:52,Sanvello App,3,sanvello-anxiety-depression,922968861
False,,Cambam515,"I have had many different apps for mindfulness and self help. This app by far is extremely helpful and realistic. These tools will help center you but the biggest thing is it helps you become the change u have always wanted. Give it a try, we all have some extra time now a days.",2020-04-29 04:44:54,Best self help app yet,5,sanvello-anxiety-depression,922968861
False,"{'id': 20329629, 'body': 'Thank you for your feedback. We apologize that there is not yet a landscape mode for use on the iPad, but I will share this feedback with our product team for them to work on in future releases of the app. In the meantime, please do contact us at info@sanvello.com if you ever have any questions or additional feedback.', 'modified': '2021-01-11T22:57:52Z'}",wasdfrd,"I have the app on an iPod, and find it helpful. But looking at the tiny screen is annoying, taking away from the experience. Plus, it’s one more device. So, I thought I’d simplify things: recycle the iPod and use the app on my iPad. Except that the app doesn’t rotate to landscape, which is how practically everyone uses iPads. It only displays in portrait. If an app doesn’t display on an iPad the way iPads are used, then it’s not an iPad app, just an iPhone/iPod app.",2021-01-09 22:32:17,Don’t say it’s an iPad app,3,sanvello-anxiety-depression,922968861
True,"{'id': 19759789, 'body': 'Hi there, thank you for your feedback. We are always looking for ways to support people in their mental health journey and we appreciate you sharing your experience. We encourage you to reach out to us at info@sanvello.com so we can discuss potential options for you going forward.\r\n', 'modified': '2020-12-14T19:24:55Z'}",LeittCici,"I got a brick wall in my guided journeys, apparently you can only do a few before they lock them out. My insurance isn’t available in my state to cover the cost of the app, so now I feel lost as to what to do.

I know it’s just 8 bucks a month for premium, but when you take someone working part time to pay for full time college and rent and insurance and phone bills and everything else... it’s just overwhelming to think that the one place I felt better now makes me feel worse.

If they were more upfront as to what you get for free, that would make a world of difference. Seriously.

Just tell me what I get in clear terms. If I decide I need more, I’ll pay for more.

For it to just spring on me “OH SORRY THATS FOR PREMIUM MEMBERS ONLY!!!! SO GLAD YOU LIKED YOUR SAMPLE.” When I didn’t even know it was a sample to begin with...",2020-12-15 15:22:42,Loved this app...,2,sanvello-anxiety-depression,922968861
False,,Man_druuu,"I used to have the “self-help” mentality when it comes to all this mental health stuff. I understand the guard, unease, and drag of thinking about that in an app but I’m convinced this one definitely knows what it’s doing. Had a slow start to it but as I became more engaged, it became natural. Highly recommend during this time of hardship.",2020-03-30 07:44:14,Be open. Be amazed.,5,sanvello-anxiety-depression,922968861
False,"{'id': 22469742, 'body': 'Great feedback!  We are thrilled that the customizable approach and recommendation engine are proving helpful on your journey. ', 'modified': '2021-04-26T19:41:18Z'}",dturgent,I’ve only used this app for a few days but it has already been so helpful. The information has been important and relevant to what I am going through since it is customized to me. I’ve also found that I have been more self aware of my feelings since using this as well.,2021-04-20 15:12:31,Fantastic!,5,sanvello-anxiety-depression,922968861
False,,Fieldhand,"It does take some getting use too but once you take the time and engage with the programs I found it to be a quick relief tool. There are the reminder check ups that give prompts to take time for your self and provide encouragement, to the direct personal help from the coaches. 
 Thank you",2020-05-20 16:10:42,Little app lots help,5,sanvello-anxiety-depression,922968861
False,"{'id': 18485240, 'body': 'Hi Joe! 👋 I am sorry the app has not provided the support you needed. If you have any suggestions on how we can improve or if you have feature ideas that would have been beneficial for you,  please reach out to info@sanvello.com.  We welcome your feedback. ', 'modified': '2020-10-14T21:20:36Z'}",Long dick joe,It hasn’t helped me. You chart your feelings just let’s me see how sad I am all the time over long periods of time. The lessons are nice but really didn’t help.  I’m past the point of deep breaths and refinishing traps but for someone with mild anxiety or depression I think this would be good for them. As always there is a subscription which I don’t like but I guess you have to make money someone on these things. I just just don’t be sad and poor,2020-10-09 21:05:17,Worth a try,3,sanvello-anxiety-depression,922968861
False,"{'id': 18485178, 'body': 'Hi there!  Thank you for your feedback and your suggestion.  We hear you loud and clear!    🔊This functionality is actually on our product roadmap. 😎', 'modified': '2020-10-14T21:14:40Z'}",GCZach182,"I really like the sound options it has, however I wish the length of time to have them play was longer. I like to have the rain sounds play when I go to sleep but if my anxiety wakes me up I have to turn it back on. That requires me to wake up more to grab my phone to restart it and then try to relax again to go back to sleep. It would be nice if the sounds could play for at least 8 hours.",2020-10-09 18:52:04,Length of time,3,sanvello-anxiety-depression,922968861
False,,Fr8t,"Thank you to the makers of this app especially during these strange times we’re experiencing right now . It is helping me to decompress from anxiety & stress during this time .
Thank you for your generosity in allowing us all to access this app and it’s exercises during the pandemic. It is a blessing!!!",2020-04-02 02:13:51,Great app to get you through all times,5,sanvello-anxiety-depression,922968861
False,,DC756,I was looking through Pinterest for apps to help with anxiety and came across this one. It has been such a blessing for me so far. I am better able to identify when I begin to feel anxious and use techniques learned in the app to cope. This happened after using it only 3 times. I’m so thankful!,2021-04-02 00:42:48,Extremely helpful,5,sanvello-anxiety-depression,922968861
False,,eleven011strangerthings,This app is helping me through a lot such as anxiety depression etc. and it’s very helpful when I’m going through a hard time and this app gives you ways to calm yourself that I would’ve never known if I didn’t get this app and I would recommend it to anyone who’s going through anything.,2021-03-04 16:18:51,Great app 👍,5,sanvello-anxiety-depression,922968861
False,,Kshumwa5,"I started using Sanvello to track my mood, and it has helped so much! It helps me know when I’m on the verge of an anxiety attack bc I’ve been leading up to it for the past few days. It also sends reminders asking how I am, which remind me to take a step back and take care of myself that day.",2020-12-14 01:20:48,Mood tracking,5,sanvello-anxiety-depression,922968861
False,,jessi-ann,"I’ve used this app for years and it’s helped me through my entire journey of realizing I need help to getting in a good place. I still use it from time to time when I feel stuck, and it still always helps! My favorite features are the meditations and the thought trap journals.",2020-08-17 03:13:39,An essential tool for mental illness,5,sanvello-anxiety-depression,922968861
