isEdited,developerResponse,userName,review,date,title,rating,app_name,app_id
False,"{'id': 16835143, 'body': ""Thank you so much for your thoughtful, detailed review. The prompts for a unique name in the community are to encourage anonymity, so names that are abstract and contain numbers work well–something like your user name here on the review.:) As for the assessments, these are clinical assessments that we've put in the app to allow users to measure their progress. We haven't modified the language of these assessments, and understand where you're coming from with sensitivity to some of the terms used. That's great feedback we'll take back to the team. Thanks again."", 'modified': '2020-07-23T14:56:46Z'}",MoMo220011,This app is nice to have to keep track of your daily thoughts and feelings and track your progress and the meditations are nice but some of the wording used throughout the app makes me a little uncomfortable. When I tried to put in my name for the community posts or whatever it said “this name is not unique” and I assume that’s because it was already taken but it’s a really weird way to say it and for me at least it kind of turns it into a negative thought which is stupid but that was just my initial response and I think it could have been prevented with better wording. I also took the assessment for the first time and one of the questions asked if I still feel good about myself even when others look down on my illness which to me is kinda weird. I don’t think anyone feels good about themselves when someone looks down on them for something they can’t really control and especially not someone with anxiety/depression/self-image issues so that’s never really gonna be an “i feel great” moment but whatever. Another question referred to mental illness as “behavioral health issues” which seems inaccurate and kind of negative for someone who’s trying to better their mental health. Overall it’s a good app but some things are just a little weird and I think it could be improved by being a little more sensitive especially since it’s advertised as a tool to help people deal with and improve their mental illness.,2020-07-02 04:31:57,overall a good app,4,sanvello-anxiety-depression,922968861
False,"{'id': 21713015, 'body': ""Thanks for your review, we're very glad to hear that Sanvello has been beneficial for you!😊 Please reach out to us at info@sanvello.com so we can go over some of the options for getting your account upgraded to Premium. We can also answer any additional questions you may have about the app."", 'modified': '2021-03-17T16:28:49Z'}",HeyYallItsKawaiiKun👻,"This review is not bot-made, I just am so much better thanks to this app. When I started skipping hygiene, personal health, social health, and only being on screens, I convinced myself to make a change. And the first step was using Sanvello. My anxiety is getting so much better, and I’ve completely engaged in social activities and started dabbling in minimalism for my sake of OCD.
Next, the committee section. I have made so many allies and good advice givers here. The report section is top-notch, and I can find people with fellow interests without being afraid of internet bullying, homophobic people, and etc. I seriously don’t deserve the kindness here. 
Lastly, the shorts. I personally enjoy Garden Mark, where he talks about plans, moving on, and other things while you see him tending to his plants. It keeps me focused but also calm! 
The only thing I dislike is I’m not able to pay 10$ a month for more lessons. Please either lower the price or stop premium! People with mental health issues should have less expensive options! 
Overall, mostly fantastic app, and anyone, and I mean ANYONE, who has stress should get this app.",2021-03-16 01:10:11,I cannot believe the impact on my mental health.,5,sanvello-anxiety-depression,922968861
False,,Brooke Stump,"This app is a one stop shop! It offers so many helpful techniques for people with all different mental disorders. I am a person who has a lot of anxious tendencies, and I found this app helped to calm both my thoughts and my breathing. For people that suffer from anxiety disorders, this app offers a deep breathing exercise like I learned in my PYS250 class. This technique prevents one from having an anxiety attack/eases one while having an anxiety attack. To perform the breathing exercise simply count to 4 while slowly breathing in, hold your breath for a moment, and then slowly breath out to 4. This exercise should last for 2 minutes. Slowing one’s breathing allows the parasympathetic nervous system to be activated, calming the body. Another technique the app uses is in vivo exposure for those with social anxiety. It has one imagine a social situation that makes them anxious but then walks them through the process of imagining a positive outcome to that situation. I am so glad I was able to find this app and take advantage of all it has to offer!",2020-11-06 23:42:40,This App Actually Helps!,5,sanvello-anxiety-depression,922968861
False,"{'id': 16836466, 'body': 'Hi there. Thanks so much for your candid feedback here. The team is always looking for ways to be improving member experience, and we can see how these conversations are beneficial for some. We will be taking a closer look at our community rules.', 'modified': '2020-07-23T16:50:02Z'}",Snowe509275,"I keep being banned from posting when I don’t even say anything wrong. I’m respectful toward others in the community. I’ve had so many good conversations with people in this app. The community rules don’t say you’re not supposed to talk about suicide yet people are constantly being banned from posting when they get flagged for talking about suicide or self harm. I’ve told the staff how harmful it is to treat suicidal people the same as spammers and trolls multiple times, and they haven’t listened. The one response I’ve had was something along the lines of “this isn’t a place that can help with suicide”. Actually yes, being able to talk about suicidal thoughts or ideations freely does help people even though they should still seek professional help. Also, the unhelpful response I got doesn’t address the lack of clarity in your terms and conditions. It also doesn’t change the fact that you are making people who already feel marginalized and insecure feel WAY worse and like there is no community for them in this world. How does an app that doesn’t even clearly state that suicidal and self harm posts are taboo, then bans people for the slightest infraction against this unspoken and unnecessary taboo have so many good reviews?",2020-07-04 08:01:16,Constantly Banned for Absolutely No Good Reason,1,sanvello-anxiety-depression,922968861
False,"{'id': 17767391, 'body': 'Thank you for the feedback. When users share insightful comments, it helps us grow and improve.  I will make sure our team hears about this. ', 'modified': '2020-09-08T22:45:14Z'}",godelincomplete,"I would recommend this app to anyone. It is truly a wholesome experience. I am very surprised that some health insurance coverage applies, thats amazing! 

 I have a personal caveat. While I appreciate what “Sanvello” does for the community, I would like to suggest that you do not speak of Sanvello as third-person during meditations or use the name during audios or text. Maybe just stick to “we are here for you” instead of “you can always come back to Sanvello”. While meditating, you are probably in a very sensitive and exposed time in your life, when I hear “You can always come back to Sanvello” I feel like I am being advertised to DURING that exposed time and it can be quite sour. So far I have been able to let it go, I am hoping it doesn't continue because the decision to move to an annual sub depends on it. I am already paying the monthly fee, please leave it without names, it feels
More honest and beautifully personal when you just stick to “we are here for you” since I know who “we” is.",2020-09-03 17:09:06,"Amazing app, just a quick caveat.",4,sanvello-anxiety-depression,922968861
False,,Heral0204,"Sanvello (previously Pacifica) is the perfect app for improving mood, CBT, and anger management. I have used this app for nearly 6 years (since I was 12 or 13) and I have had a positive experience with it every year of use. 

The best unique features of this app currently include: (in order of what I like most)

•In-Depth Mood Tracking and feelings log
•Health Habit Tracking (Sleep, meals, exercise, etc.) and this even has the option to make custom bad habits like nail biting or smoking.
•Specified anonymous forums/group chats for peer-to-peer support with many different struggles 
•Automatic weekly check ins (short quiz to determine levels of anxiety, depression, etc.)
•Small library of great meditations for various situations you might be facing. 

... and as usual, more premium features are available for a subscription. Even though subscriptions are available and recommend, I have used this app for six whole years and never felt like I was lacking the tools that this app provides to help improve my life. So this app definitely gets the award of ‘best option for free mental health services’ by a LONG shot. 

SAnvello is just sooooo much better than other apps like it, because it seems like they genuinely care about your mental health by making the most important tools free to everyone to use and take advantage of. ❤️",2021-03-07 20:24:03,User of 6 years and I can’t recommend enough,5,sanvello-anxiety-depression,922968861
False,"{'id': 23269633, 'body': ""Thanks for your review and feedback, we're happy to hear setup was easy and that you're enjoying the Guided Journeys so far!!😊 I will be sure to share your UX recommendations with our product team for them to consider in future updates as well. Please email us at info@sanvello.com if you have any questions or additional feedback, we'd be happy to help!"", 'modified': '2021-06-08T17:02:57Z'}",huskiesandplants,"I love that Sanvello was available through my work’s healthcare, because otherwise I would not have tried it, so that’s definitely a plus that they make it easy to integrate with your insurance.

As far as assessments, I like them. They’re diverse enough to get me started without being overwhelming. As a dftba fan, I couldn’t help but love that they used John Green for one of the anxiety educational videos. Every other person or voice they use is soothing and not “over doing it.” I’m interested by the community feature, but I don’t use it as much as the activities. 

As far as UX, just a couple things: some buttons are not compatible with iPhone features, for example, the adjust volume slider is too close to the bottom of the screen, and so my phone thinks I want to swipe away from the app or close it. Also, sometimes the check ins don’t register and I have to start over or cancel them",2021-06-07 00:40:11,great way to start feeling better,4,sanvello-anxiety-depression,922968861
False,"{'id': 13401989, 'body': 'We are sorry you experienced these inconveniences. If you want to reach out to us at info@sanvello.com we can look into this further for you.', 'modified': '2020-02-10T15:42:00Z'}",Customer and ...,"I was excited to try this app because of the reviews and wanting to do more of my own self improvement and self healing.  I have had several issues. First off the print is to small for me to read even with my glasses but also because it’s not a dark color. It’s very light in color. It also would be nice if one had the ability to enlarge the text to fit their personal needs so not everyone has to have it in larger print. I did manage to get to step 3 in the reframe part of rethinking my answers I highlighted when I highlighted 3 of my items rephrased them it never let me hit finish because it didn’t light up. I retried again to answer the highlighted questions and it still did not let me save when I was done. I had to just go back and exit that section lost all my information and wasted about and hour of my time at 2:00 o’clock AM because I can’t sleep .  I would like to ask kindly for you to please fix this app. I’m glad I was giving it a try for free I would not be happy if I had purchased it without a test drive,",2020-02-10 09:55:16,Wishes,2,sanvello-anxiety-depression,922968861
False,"{'id': 18651662, 'body': 'Brilliant, thoughtful review.  THANK YOU. ', 'modified': '2020-10-22T21:53:43Z'}",Aly_Pu,"I used this app to help with panic attacks back in 2018 (when it was Pacifica), and now again with different issues, more depression related. I’ve tried many apps for years, and this one is the only one that sticks for me.

What I really love are the mediations and journeys. If you feel like you can’t control anxious or negative thoughts, they are great for getting “unstuck” in patterns, or at least helping one become aware. While I still lack confidence, I now know how my own thoughts reinforce beliefs and how I can reframe my perspective to combat that. 

I also did not feel like I had the language to discuss my emotions with others as well before using Sanvello. This app helps a lot if you are trapped in internalizing your experience. This app empowers me to open up to others and be more productive during therapy. Thank you so much!",2020-10-13 14:27:10,Learned how to escape negative thought traps,5,sanvello-anxiety-depression,922968861
False,,Kylie!!,"I have been trying to find an outlet for my emotions for a while. I never got into journaling or meditation, it just didn’t seem to release and feeling nor did it bring me peace. It actually stresses me out because my mind would wander during meditation and I would be frustrated that I couldn’t do it. And journaling was hard because I didn’t know what to write; if I wanted to detail everything it would take me 39 minutes to write it all out which was t practical for me. This app is quick and simple and motivates me to challenge myself. Within this app I track my mood and analyze triggers and negative self talk. I also listen to meditations and watch videos on how to help bring myself out of a negative emotions fog. I would really recommend this if you have struggled with the typical recommended therapies in the past.",2020-11-23 08:37:36,Really unlocked my emotions,5,sanvello-anxiety-depression,922968861
False,"{'id': 21692618, 'body': ""Thank you very much for your feedback, we're sorry for the difficulty and frustration you ran into with the app. I will share this feedback with our product team for them consider updating in future releases. In the meantime, please send us an email at info@sanvello.com if you ever have any questions or additional recommendations for us going forward."", 'modified': '2021-03-16T20:23:12Z'}",L1701L,"I don’t understand this app. It was recommended and covered by my employer so I tried it. First it makes me choose a theme. Stars seems nice! No, it spins at a pace that dizzied me and confused my brain. I quickly chose another. Lightning? That means constant flashing! Turns out none of the themes aren’t animated (at a weird rapid pace - if they were slow they wouldn’t bother me nearly so much.) So right off the bat, I’m frustrated. 

Then some of the text is barely readable against the background, for some reason? Black text against the theme background, in a few different screens. 

I get it that the lessons talk about the causes of anxiety, although apparently, according to this app, all of them are external? Let me tell you, my brain does a great job of giving me internal reasons to be anxious. But then it repeated it during the breathing exercise. I don’t want to think about the causes of my anxiety when I’m trying to clear my mind. Why even mention it there? I didn’t even make it three minutes into the seven minute relaxation because I kept getting angry at the relaxation exercise. 

I don’t know if it gets better at all, but just the basic stuff seems to frustrate me way more than relax me. These shouldn’t be roadblocks. Stick to lessons during lessons and relaxation during breathing exercises. Fix your visual stuff. Calm down the animations and make text readable.",2021-03-12 18:45:16,Not calming?,2,sanvello-anxiety-depression,922968861
True,"{'id': 15085237, 'body': ""Hi, this is a great suggestion. We haven't focused a lot on multimedia support here because it introduces some challenges, like laying the image out and where it appears. Have you tried the hope board though? This is intended for more visual content, and can serve a very similar purpose to the journal."", 'modified': '2020-05-04T16:12:06Z'}",Littledrummerboy3.0,"This is an overall wonderful app that I use daily and even paid for a year of premium after using it for free for a long time. That being said, as I’ve settled into practices that help my mental health, journaling in a physical notebook has become one of them. The journaling feature in Sanvello offers journaling via text and via audio. It needs to include picture support as well. I would like to be able to track my journaling practices and simultaneously have a virtual backup of my physical notebook. It wouldn’t be that hard to add picture support.
Edit: While using the Hope Board is an option, I’d like to keep my Hope Board separate for things that make me smile or things that make me happy. Spamming my Hope Board with a daily picture of my journal isn’t the best option because then it cheapens the actual content I post on my Board.",2020-05-04 22:01:00,Needs picture support for journaling,3,sanvello-anxiety-depression,922968861
False,"{'id': 13423371, 'body': 'Thank you for taking the time to write this detailed review. We are truly honored by all of it. Please do not hesitate to reach out to us at info@sanvello.com if you ever have any questions. Again, thank you so much and have a great day!', 'modified': '2020-02-11T15:48:06Z'}",Madison_13579,"When I first go this app I thought that it would be just like any other meditation app. I thought that it wouldn’t help me at all and that it was no use in getting it. I’ve had the app for about two weeks now and it has helped me so much with my emotions. It helped me with lowering my stress, social and performance anxiety, and other struggles I’ve had. I can record how I’m feeling and over the past few weeks my mentality went from “awful” or “okay” to “very good” and even “great.” The health tracker helps me to remind me to take my meds or to get enough sleep. The meditations really helped me to feel calm and now I have multiple healthy coping mechanisms (that actually work) to help me when I get too stressed or anxious. This app is a life saver.",2020-02-11 03:36:45,Amazing,5,sanvello-anxiety-depression,922968861
False,,BabsyTXB,"I have had some issues logging back into the app. It logs me out quite frequently. Sometimes I want to pop back into the app and do the mood tracker or jot something I’m feeling down. Having to log back in them go through the two step verification process frustrates me and deters me from doing those things. The two step verification I would rather it sent me a text instead of an email. It takes a while for the email to come through and by then I’ve already forgotten the thought I wanted to capture. 

Also it would be nice to clear some things off the Home Screen when you’ve already listened to them. Being able to click maybe a next button or swipe them to the next meditation, journey, or quote would be nice.",2020-10-30 16:47:03,Logging in issues,4,sanvello-anxiety-depression,922968861
False,"{'id': 22104911, 'body': 'Thanks for your review, we are so glad to hear that Sanvello has been helpful in reducing your anxiety! Please send us an email at info@sanvello.com if you ever have any questions or recommendations for us moving forward.\r\n', 'modified': '2021-04-07T16:34:41Z'}",Breezter,"For the past few months, my body has been in fight/flight/freeze mode on a consistent basis. My hands were always shaky, and my chest was so heavy and painful that it was hard to breathe. I was spiraling downwards and felt incredibly depressed. But then I began using this app. I have only been using it for three days, but I feel and see the difference. My breathing is deeper and steady, and the burden is almost lifted from my chest. I feel calmer and incredibly tired now, and I think that fatigue is from finally relaxing after being so very anxious for so very long. I cannot afford a therapist, so I never had any tools to manage my anxiety. This app has taught me those tools. I cannot recommend Sanvello enough.",2021-04-02 20:02:09,Life-Changing Advice,5,sanvello-anxiety-depression,922968861
False,,teachrulz2,"Having suffered a nervous breakdown, and being diagnosed with GAD, depression, and other neurological disorders, Sanvello has become my quarantine lifeline between telemed calls with my therapist and doctors. Sanvello has given me a place to track my moods, thoughts, goals, health, and realizations. In addition, I have been able to meditate and recognize when my panic sets in or moods shift. 
I have been so impressed, that I have recommended Sanvello to my husband, children, family members, and friends. I have told my therapist so much about Sanvello, that she has begun recommending it to other patients. 
To the creators of Sanvello...
I can not thank you enough for this app. It’s just what is needed at this moment in time.",2020-04-14 04:22:25,Quarantine Lifeline,5,sanvello-anxiety-depression,922968861
False,,Acathernb44,"This app has really helped me in a time in my life where I was really struggling with my mental health. It has a lot of things to offer such as setting daily goals that reminded me I needed to keep moving forward despite how badly I felt, it gave me lessons based on CBT that were educational and a reminder how to cope in those difficult time. It has support groups and features such as guided meditation. I felt the daily check in on how I was doing was very helpful because I could journal how my day was going and look back on my progress. This is a great app for someone who is going through something and needs some guidance and support.",2020-07-20 00:19:40,Helpful in a very dark time in my life,5,sanvello-anxiety-depression,922968861
False,"{'id': 14144297, 'body': 'You are so very welcome! Thank you for being a part of this community. Remember, alone we are strong, but together we are Sanvello Strong. Never hesitate to shoot us a note at: info@sanvello.com. All the best, your Sanvello Team.', 'modified': '2020-03-20T14:40:04Z'}",SheDizzle!,"Your gesture in offering a free premium subscription to all during these unprecedented times is a truly an act of kindness, compassion and generosity. Having to cope with PTSD, GAD and depression in a time of fear and chaos is at times unbearable. When I received your email for the premium subscription, I immediately opened the app and within minutes felt a sense of relief and community reading only a few comments from others. It was a perfectly timed reminder that even during times of isolation, I’m not alone. A genuine and heartfelt THANK YOU, I will do my part to pay it forward. To all who read this, stay safe and take care. 💖✨💕",2020-03-19 22:52:55,THANK YOU Sanvello!!,5,sanvello-anxiety-depression,922968861
False,,Marydigital21,"I love this app! I can keep track of everything I’m feeling and everything I’m doing to better myself (water, exercise, meditation, etc) What I really love is the extensive amount of feelings tags you can choose from. Other apps just use basic ones. Being able to pinpoint exactly how I’m feeling helps me learn more about myself and what I’m going through daily. I also love the visual representation of my daily moods, as well as the option to track it throughout the day. My mood isn’t the same all day, so I enjoy seeing a display of how things change for me depending on what’s going on in my day.",2020-04-24 01:03:21,Great!,5,sanvello-anxiety-depression,922968861
False,,Blueberry2267,"I have never written a review for an app, but felt moved to for Sanvello because it has helped me so much. I have generalized anxiety and used to suffer terrible panic attacks, most of which I would not have made it through without this app (back when it was called Pacifica). It offers so much, from journaling, to guided meditation, to safe spaces like discussion boards, to weekly check ins. If you feel like a victim to your mental illness, this is the app for you—it will help you to realize your strength & ability to manage, if not overcome, your struggles. Wish I could give above 5 stars, thank you so much to the creators!",2020-07-08 02:32:45,Life Changing.,5,sanvello-anxiety-depression,922968861
